,question,category,answer,choices/0,choices/1,choices/2,choices/3
806,Why are Charles Dickens books so wordy?,general,He got paid by the word,He knew he had a short life and wanted to get everything on paper,He got paid by the word,That was the style of the day,He didnt want anyone to say Please Sir! More gruel!
807,What is a bo diddley?,general,A home-made guitar,A sandwich common to poor people,A rock and roll band,A home-made microphone,A home-made guitar
808,Which woodwind instrument is not made of wood and has no reeds?,general,Flute,Flute,Clarinet,Oboe,Accordion
809,Wilhelm Kolff invented what device?,general,Dialysis machine,Dialysis machine,Football helmet,Linotype machine,PET scan
810,In which US state is the city of Truth or Consequences located?,general,New Mexico,Mexico,Utah,New Mexico,Texas
811,How many bones does a shark have?,general,0,0,103,206,100
812,On what island does King Kong live?,general,Skull  Island,The Island of no Return,The Forbidden Island,Skull  Island,Crater Island
813,"Who invented the armonica, a musical instrument made up of a series of tuned spinning  bowls?",general,Benjamin Franklin,Sir Edward Elgar,Benjamin Franklin,Dean Shostak,Thomas Edison
814,What is the oldest  symphony  orchestra  in the USA?,general,The New York Philharmonic,The Symphony Orchestra of New   Orleans,The New York Philharmonic,The Boston Philharmonic,The Philadelphia  Philharmonic
815,"Which of these events happened on April 7, 1927?",general,The first  long distance Television image was sent.,The first  long distance Television image was sent.,Adolph Hitler made his infamous first attempt to take over Germany.,The New York Stock Exchange fell 67 points (29% then),The first Easter Parade in was held in New York  City.
816,Who is Katie Hnida?,general,The first female to play NCAA Division 1 football,The first female to be a  professional boxer,The first female to play NCAA Division 1 football,The first  American female to ride on the Space Shuttle,The first female Prime Minister of Ecuador
817,What did  engineer James Wright  invent in 1943?,general,Silly Putty,The oral polio vaccine,Silly Putty,The first chemical to repel sharks,Acetate cartoon cells
818,"In 1957 Major John Glenn, Jr. set an air speed record for the trip from California to New York. How long did the trip take?",general,3 hours 23 minutes 8.4 seconds,3 hours 23 minutes 8.4 seconds,2 hours 19 minutes 4.8 seconds,1 hours 21 minutes 4.8 seconds,1 hour 56 minutes 8.4 seconds
819,Which mass murderer was the inspiration for the movie character Norman Bates in Psycho and  for Buffalo Bill in Silence of the Lambs?,general,Ed Gein,Ed Gein,Ted Bundy,Rickie Sperko,Jeffrey Dahmer
820,What was the name of Ghana before the country gained its independence?,general,The Gold Coast,The Belgian Congo,Ivory Coast,The Gold Coast,Limpopo
821,What is the last name of the man credited with inventing the modern bicycle?,general,Michaux,Bremen,Michaux,Wright,Turnbull
822,Where is General George Patton buried?,general,Luxembourg,"Normandy, France",Arlington National Cemetery,"Washington, D.C.",Luxembourg
823,"This author of popular novels, who was a lecturer at Wellesley College, spoke fluent  English, Russian and French and made chess problems in his spare time.",general,Nabokov,Brecht,Pasternak,Nabokov,Steinbeck
824,What did Earl Bakk and Clarence W. Lillehie invent in 1957?,general,Internal heart pacemaker,Liquid oxygen jet fuel,Internal heart pacemaker,High Definition Television,Artificial heart
825,Organic chemistry is the scientific study of the organic compounds that by definition contain which element?,general,Carbon,Nitrogen,Carbon,Hydrogen,Oxygen
826,Which of these statements regarding the words imply and infer is correct?,general,"The speaker implies, the listener infers",All these statements are true,Imply and infer mean exactly the same thing,"The speaker implies, the listener infers","The speaker infers, the listener implies"
827,These two states have Miami Universities.,general,Florida and Ohio,Florida and Georgia,Florida and Ohio,Florida and Alabama,Florida and North Carolina
828,Which U.S. President settled the North Western border dispute with Canada and England?,general,Polk,Hayes,Polk,Mckinley,Pierce
829,The Era of Good Feeling is generally applied to describe the national mood of the United States during which years?,general,1815 - 1825,1783 - 1805,1805 - 1820,1825 - 1845,1815 - 1825
830,"In music, what does andante refer to?",general,Moderately slow,Stop,Moderately slow,Lively,Very slowly
831,"Benny Goodman, a great clarinetist, was always compared to this great jazz clarinetist, composer, bandleader, and writer.",general,Artie Shaw,Cootie Williams,Art Farmer,Bunny Berrigan,Artie Shaw
832,"This Sudanese/American basketball player and activist, 77 (2.31 m) tall, managed to block 397 shots during the 1985-1986 season, thus setting a rookie record.",general,Manute Bol,Yao Ming,Swede Holbrook,Manute Bol,Wilt Chamberlain
833,Which U.S. President attempted to purchase Cuba from Spain?,general,Pierce,Johnson,Pierce,Tyler,Taylor
834,Great Britains first test tube baby was born in what year?,general,1978,1962,1980,1978,1975
836,Who invented the first working television system?,general,John Logie Baird,Thomas Edison,Alexander Graham Bell,John Logie Baird,Benjamin Franklin
838,Indian Ink comes from what country?,general,China,Japan,United States,India,China
839,What was the name of Margaret Mitchellâs only book written in 1936?,general,Gone With The Wind,Death on the Nile,Double Indemnity,Inherit The Wind,Gone With The Wind
841,What infectious disease can be transmitted by a mosquito bite?,general,malaria,trichnaria,styorrhea,myharia,malaria
842,This novel written by German author Herman Hesse was published in 1922.,general,Siddhartha,Nirvana,Siddhartha,Sartaka,Samsara
843,"This term of Indian origin refers to ones fate or destiny, as the result of ones actions.",general,karma,samsara,sarana,nirvana,karma
844,"A character, played by which of these actors/actresses survived in the movie The Poseidon Adventure?",general,Red Buttons,Red Buttons,Shelly Winters,Stella Stevens,Gene Hackman
845,The character played by which of these actors/actresses did not survive in the disaster movie The Towering Inferno?,general,Robert Wagner,Steve McQueen,Susan Blakely,Paul Newman,Robert Wagner
846,Which cast member of the TV drama Dallas starred in the film Earthquake?,general,Victoria Principal,Larry Hagman,Victoria Principal,Patrick Duffy,Mary Crosby
848,What was the special speaker system used during the 1974 theatrical release of the movie Earthquake?,general,Sensurround,Tremor speaker simulators,Seismaseats,Sensurround,Tremorsound
849,Which actor/actress who starred in the film The Poseidon Adventure appeared in the TV series The Hardy Boys/Nancy Drew Mysteries?,general,Pamela Sue Martin,Pamela Sue Martin,Pamela Sue Anderson,Roddy McDowell,David Cassidy
850,What was the cause of the fire in the movie The Towering Inferno?,general,Faulty electrical wiring,Short circuit in the elevator shaft,A loose lid on a can of kerosene stored in a closet,Faulty electrical wiring,Arson
852,What contributed to the quick tipping over of the luxury ocean liner in the movie The Poseidon Adventure?,general,There was not enough ballast,There was not enough ballast,Shelley Winters was too close to the starboard side of the boat,Not enough speed when the wall of water hit,Engines were at full power too long so they shut down
853,Which one of these actors/actresses did not star in the movie Earthquake?,general,Fred Astaire,Lorne Greene,Charlton Heston,Ava Gardner,Fred Astaire
854,Who played the last juror to vote not  guilty in the 1957 movie Twelve Angry Men?,general,Lee J. Cobb,Ed Begley,Lee J. Cobb,Martin Balsam,"Ed Begley,Jr."
855,Which of these famous people  was not an epileptic?,general,Otto von Bismarck,Otto von Bismarck,Vladimir Ilyich Lenin,Rudi Dutschke,F.M. Dostoevsky
856,Which was the first country to win two consecutive FIFA World Cups in 1958 and 1962?,general,Brazil,Italy,France,Argentina,Brazil
857,Jose Raul Capablanca of Cuba was the first person from the Western Hemisphere to do what?,general,Win the World Chess Championship,Be President of the U.N. General  Assembly,Win the World Chess Championship,Win an Olympic  baseball game,Win the Nobel Prize for Literature
858,Why was a performance by Bob Dylan interrupted in 1998?,general,A shirtless man with the words Soy Bomb written on his chest leapt on stage.,A shirtless man with the words Soy Bomb written on his chest leapt on stage.,His lyrics did not pass the decency level required by CBS Television.,Tom Petty had not made it into the stage in time to play the musical bridge in the song.,The show ran 15 minutes over and ABC Television had gone to the evening news.
859,You go into a diner and  you hear the  waitress yell out Cats Eyes. What has someone just ordered?,general,tapioca,a breakfast of steak and two eggs,strawberries and cream,tapioca,sunny side eggs
860,"The Peace Symbol, which became an icon of the 1960s anti-war movement, derives from what?",general,two semaphoric signals,a slightly twisted cross,None of these,two semaphoric signals,an image of a nuclear bomber
861,"Which battleship was used by the US Navy during World War II, the Korean War, and the Vietnam War?",general,USS New Jersey (BB-62),USS New Jersey (BB-62),USS Arizona (BB-39),USS Missouri (BB-63),USS Iowa (BB-61)
862,According to the Christian  tradition there are 39 books in the Old Testament. How many books are there in the Old Testament according to the Jewish tradition?,general,24,39,5,24,65
863,Who was the first Major League Baseball player born in what was then called Czechoslovakia?,general,Elmer Valo,Reno Bertoia,Ernie Orvitz,Elmer Valo,Andy Pafko
864,Which song was Billy Joels first US Top Ten Hit?,general,Just the Way You Are,Moivin Out,Just the Way You Are,Piano Man,Shes  Got A Way
865,In this 2005 documentary film a  large number of famous comedians show how they tell one particular dirty joke.,general,The Aristocrats,The Aristocrats,Dirty Rotten Scoundrel,The Elegants,Down and Dirty Comics
866,Where does the word Rastafarian come from?,general,The real name of a king,It comes from a Taino name,The name of a song,The real name of a king,It means the good religion
867,"Where did the word Melba come from, as in Melba toast and Peach Melba?",general,The name of an Australian singer,The name of the wife of the owner of Cunard Cruise Line.,The name of  the proprietress of Del Monicos Steak House.,The name of Henry Fords wife,The name of an Australian singer
868,Who is the only President who had a patent?,general,Lincoln,Hoover,Lincoln,Jefferson,Washington
869,Which US President invented the baseball seventh inning stretch?,general,Taft,Hoover,Taft,Wilson,Harding
870,To whom did the inventor of the typewriter sell his patent?,general,A maker of guns,A maker of guns,A sewing machine company,Thomas A. Edison,The US government
871,"Which if these is an area in Iraq, and a pilgrimage place for some Muslims?",general,Karbala,Tikrit,Mosul,Basra,Karbala
872,"What is the mathematical term for the shape of a footballs path, when thrown form one player to another?",general,Parabola,Parabola,Catenary,Hyperbola,Ellipse
873,Who wrote the opera Mozart et Salieri?,general,Rimsky-Korsakov,Berlioz,Bizet,Rimsky-Korsakov,Saint-Saiens
874,The Magna Carta went into effect in 1215.  Who signed it?,general,nobody,Eleanor of Aquitaine,King John aka John Lackland,nobody,King Richard the Lion Hearted
875,Who invented the doll that says Momma?,general,Alexander Graham Bell,Henry Ford,Benjamin Banneker,Alexander Graham Bell,Thomas Alva Edison
876,Find the odd one.,general,Libra,Taurus,Libra,Capricorn,Leo
877,Which of the following animals is the odd one?,general,Ram,Ram,Hen,Doe,Vixen
878,Which of these is the the odd one?,general,Amethyst,Narcissus,Amethyst,Rose,Daisy
879,Which number is the odd one out?,general,17462,11780,13491,17462,15183
880,Name the odd one.,general,Vixen,Viper,Vixen,Adder,Cobra
881,Which of the following is the the odd one?,general,Silk,Wooden,Steel,Lace,Silk
882,Which of these is the odd one out?,general,Jonquil,Carnelian,Jonquil,Beryl,Jasper
883,Which of the following months is the odd one?,general,April,April,December,May,July
884,Which of these names the odd one?,general,Ferdinand Marcos,Ramon Magsaysay,Sergio OsmeÃ±a Sr.,Ferdinand Marcos,Elpidio Quirino
885,What is another name for Ursa Major?,general,The Great Bear,The Great Bear,The Great Tiger,The Great Lion,The Great Boar
887,Which of the animals listed below has the longest gestation period?,general,Elephant,Rhinoceros,Tiger,Elephant,Boar
888,What would you be eating if you were served Angels on Horseback?,general,Oysters wrapped in bacon,Prunes wrapped in bacon,Clams wrapped in ham,Oysters wrapped in bacon,Shrimp wrapped in chicken
890,Which planet is 5th from the sun?,general,Jupiter,Jupiter,Saturn,Mars,Earth
891,How old was Bobby Fischer when he won the US chess championship on January 8th 1958?,general,14,12,14,22,19
892,What was the previous name of the Los Angeles Dodgers?,general,The Brooklyn Dodgers,The Kansas City Dodgers,The Brooklyn Dodgers,The Bronx Dodgers,The Baltimore Dodgers
894,How much did Harvard Universitys tuition and fees total for the 1958-1959 school year?,general,"$1,250","$2,925","$3,225","$1,250","$5,110"
895,"On the popular TV show The Honeymooners, Ralph worked as a bus driver for this fictional company.",general,Gotham Bus Company,Cityline Bus Company,Red and Tan Bus Company,Metro Bus Company,Gotham Bus Company
896,When was Kevin Bacon born?,general,July 8th 1958,July 8th 1958,May 8th 1958,April 8th 1960,April 8th 1959
897,Who won the 1958 Academy Award for Best Actress?,general,Susan Hayward,Helen Hayes,Susan Hayward,Althea Gibson,Wendy Miller
898,What singer won the 1958 Grammy Award for Best Male Vocal Performance?,general,Perry Como for the song Catch a Falling Star,Perry Como for the song Catch a Falling Star,Bobby Darin for the song Dream Lover,Domenico Mondugno for the song Nel Blu Dipinto,Dick Dale for the song Lets Go Tripping
899,"Who was Vice President under President Dwight D. Eisenhower, when the Alaska Statehood Act was signed?",general,Richard Nixon,Richard Nixon,Nelson  A Rockafeller,Brian V Mitchell,John L Truman
901,How large is one micron?,general,one millionth of a meter,one million meters,one millionth of a kilometer,one million kilometers,one millionth of a meter
902,Who killed Achilles according to Greek mythology?,general,Paris aided by Apollo,Hector aided by the Nereids,Priam aided by Paris,Peleus aided by Thetis,Paris aided by Apollo
903,Which Latin expression means actions speak louder than words?,general,facta non verba,quid edere  posseum,mei capelli sunt  flagrantes,non rape me si placet,facta non verba
904,Which one of these statements was not made by economist Milton Friedman?,general,For the bureaucrat the world is  a mere object to be manipulated by him.,Hell hath no fury like a bureaucrat scorned.,Inflation is one form of taxation that can be  imposed without legislation.,For the bureaucrat the world is  a mere object to be manipulated by him.,Governments never learn. Only people learn.
905,The person who developed the popular game Sudoku was from which country?,general,Switzerland,Switzerland,South Korea,Malaysia,Japan
906,This red herbivorous mammal is endangered because of habitat loss and human interference.,general,Lesser Panda,The Indian Red Badger,Lesser Panda,The Red Fox,The  Asian  Red  Squirrel
907,This programming language that allowed non-scientists to use computers was developed in 1963 by John Kemeny and Thomas Kurtz.,general,BASIC,BASIC,PASCAL,COBOL,Visual BASIC
908,How many prime numbers are smaller than 23?,general,8,8,0,11,12
909,Which of these is the last name of the two brothers who have each won the Cy Young Award given to the best Major League Baseball pitchers?,general,Perry,Perry,Niekro,Dean,Hernandez
910,"Which month is United States Aquarium Month, Candy Month, Dairy Month and Turkey Lovers Month?",general,June,June,November,August,October
911,Which French artist is considered the founder of Fauvism?,general,Matisse,Klee,Monet,Matisse,Manet
912,When Lincoln delivered his Gettysburg Address he was not  the main speaker. Who was the main speaker?,general,Edward Everett,General Grant,Edward Everett,Mrs. Lincoln,General Meade
913,Which of these events came first?,general,The completion of he first standardized Italian dictionary,The completion of he first standardized French dictionary,The completion of the first standard English dictionary,The completion of he first standardized Italian dictionary,The first use of the word scientist
914,"The newton (N), named after Sir Isaac Newton in recognition of his work on classical mechanics, is a unit measuring what?",general,Force,Mass,Speed,Force,Weight
915,"John Howard Lawson, Herbert Biberman, Albert Maltz, Adrian Scott, Sam Ornitz, Dalton Trumbo, Ed Dmytryk, Ring Lardner Jr, Alvah Bessie, and Lester Cole made short speeches to denounce McCarthyism. All of them belonged to a group, known by what name?",general,The Hollywood Ten,The ten spies of the CIA,The ten players of Dr. James Naismith,The Hollywood Ten,The ten judges at the Nuremburg Trials
916,"He reigned until 1725 and carried out a policy of Westernization and expansion, that transformed his country into a major European power.",general,Peter the Great,Peter the Great,Augustus II of Poland,Kemal Ataturk,Frederich the Great
917,"This small, distinct religious community, whose religion resembles Islam, but is influenced by Greek philosophy and other religions, is based mostly in the Middle East. Its members call themselves the People of Monotheism.",general,The Druze,The Druze,The Zoroastrians,The Waldentseinians,The BeHab
918,"This Spanish playwright and poet, author of The Dog in the Manger and The Widow from Valencia,  maintained that a writers business is to write so as to make himself understood.",general,Lope de Vega,Oscar Nareda,Lope de Vega,Jose Ortega y Gassett,Humberto Robinson
919,"This English shipbuilder, merchant and navigator, whose innovative measures made the new English ships fast and highly maneuverable, was one of the main commanders of the English fleet against the Spanish Armada in 1588.",general,John Hawkins,Martin Hawkins,John Hawkins,Francis Hawkins,William Blake
920,"This form of traditional Japanese theater, which aims to make the audience laugh, is characterised by brief plays, stock characters and exaggerated dialogue.",general,Kyogen,Kabuki,Lo fat,Kyogen,Noh
921,"This Dutch naval officer, who became a folk hero during the Eighty Years War between the Dutch republic and Spain, sailed out to capture the Spanish treasure fleet in 1628.",general,Pieter Heyn,Pieter Heyn,Heindrich Van Duten,Henry Hudson,Petyr Stuvessant
922,"The first screen kiss was seen in the short movie The Kiss, shown in what year?",general,1896,1919,1882,1912,1896
923,"Rene Descartes, who is given credit for the invention of analytic geometry in 1637, may have been preceded in this regard by which French mathematician?",general,Fermat,Fourier,Fermat,LaPLace,LaGrange
924,"A war, which was condemned by the United Nations, was fought in 1982 over a group of islands between which two countries?",general,Argentina and Great Britain,Grenada and the USA,Panama and the USA,Argentina and Great Britain,Chile and Argentina
925,"In chemistry, this term refers to two elements with the same atomic number, but different atomic weights.",general,Isotopes,Isotopes,Alleles,Isochronics,Isosceles
926,"This ancient thinker, who was the first person to propose a heliocentric model of the Solar system,  considered that the Earth revolves around the Sun.",general,Aristarchus,Aristades,Hippachus,Heron,Aristarchus
927,Which geographical term describes a geological formation that slopes down from the center in all directions?,general,Quaquaversal,Quean,Quassia,Quaquaversal,Quartan
928,"This US National Park, famous for its mineral waters, is located in southeastern Oklahoma, near the city of Sulphur.",general,Platt,Hot Springs,Yellowstone,Platt,Mesa Verde
929,"The Mars family were the richest American family of 1988, according to Fortune magazine.  They named one of their most successful products after their horse, who was named what?",general,Snickers,Snickers,Bounty,MM,Corny
930,"In 1915, the great American baseball player of the 1920s, Babe Ruth, hit his first home against which team?",general,The Yankees,The Yankees,The Red Stockings,The White Sox,The Red Sox
931,"In 1982, this major Japanese car manufacturer was the first one to begin production of Japanese cars in the USA.",general,Honda,Mazda,Honda,Toyota,Mitsubishi
933,In what year were pencils first mass-produced?,general,1662 A.D.,1662 A.D.,476 A.D.,1812 A.D.,1821 A.D.
934,Which of these is not among the reasons for which most pencils are yellow?,general,To copy the style of the first pencils made in the USA,To show that they come from China,To make them easier to see on a desk top,To show that they are top quality,To copy the style of the first pencils made in the USA
935,Which of these is a real event  in the history of the pencil?,general,"The discovery of graphite in Seathwaite, Burrowdale, England",The discovery of rubber in Malaysia in 1823,"The discovery of lead in what is now Turkey, ca. 573 A.D.",The discovery that cedar wood has three times the tensile strength of any other wood,"The discovery of graphite in Seathwaite, Burrowdale, England"
936,Who was the famous American writer  whose first job was selling and making pencils?,general,Henry David Thoreau,Henry David Thoreau,John Steinbeck,Benjamin Franklin,Nathaniel Hawthorne
937,This famous American writer wrote all of the novel Cannery Row in pencil. He claimed to have used 60 pencils a day for his writings.,general,John Steinbeck,John Steinbeck,Henry David Thoreau,Ernest Hemingway,Nathaniel Hawthorne
938,"In the first manned rocket flights into space, pencils, not pens, were given to the cosmonauts and astronauts. Why?",general,Pencils can write in zero gravity.,They were less dangerous because they contained no metal.,Pencils can write in zero gravity.,They were less affected by lower amounts of oxygen.,Pencils are lighter than pens.
939,Approximately how many pencils are sold annually in the USA?,general,"2,000,000,000","500,000,000","2,000,000,000","200,000,000","20,000,000"
940,A great step forward in the world of pencils was made in 1858. What was it?,general,Hyman Lipman began putting an eraser on the end of pencils.,Sears-Roebuck began selling pencils in their catalog.,Hyman Lipman began putting an eraser on the end of pencils.,Sarah Teasdale Wallace patented the first indelible pencil.,Irving Kellogg Watson patented the first drawing pencils in different colors.
941,"If your pencil has a pinkish grain and little or no smell, then it is probably made from which substance?",general,plastic,incense-cedar,tropical rainforest wood,plastic,non-incense-cedar
942,"If your pencil has a  reddish brown grain and a smell, what does that usually indicate?",general,It is made of  incense-cedar.,It is made of  incense-cedar.,It is made from non-incense-cedar.,It is made from plastic.,It is made of rainforest wood.
943,What happened in the pencil world in 1822?,general,The mechanical pencil was invented.,The eraser was put onto the pencil.,Pencils were made with clips to hold onto a  pocket.,Pencils that wrote in different colors were made.,The mechanical pencil was invented.
944,Who is P.L. Travers most famous literary character?,general,Mary Poppins,Frankenstein,Mary Poppins,Scrooge,Scarlett OHara
945,What event did the terrorists target in the 1977 movie Black Sunday?,general,Super Bowl,Super Bowl,Democratic Convention,Times Square Ball Drop,Macys Thanksgiving Parade
946,"What was the occupation of The Greatest American Hero, according to the TV show?",general,High school teacher,Police officer,Taxi driver,Deep diver,High school teacher
947,"According to the popular song, in what city is the House of the Rising Sun located?",general,New Orleans,Lexington,New Orleans,San Francisco,Dallas
948,What color is Johnnie Walkers jacket?,general,Red,Brown,Pink,Red,Blue
949,"According to a popular 1960s slogan, where would you meet the nicest people?",general,On a Honda,At the AMC theaters,On a Honda,At Macys,In Las Vegas
950,"On TV, what was the name of Sergeant Prestons horse?",general,Rex,Videl,Rex,Max,Hopper
951,What movie popularied the phrase Make My Day?,general,Sudden Impact,Die Hard,Midnight Run,Total Recall,Sudden Impact
952,The ending of what Steven Spielberg movie takes place at Devils Tower?,general,Close Encounters of the Third Kind,Close Encounters of the Third Kind,E.T: The Extra-Terrestrial,Raiders of the Lost Ark,Saving Private Ryan
953,What was Shakespeares last play?,general,The Tempest,A Lovers Complaint,Romeo and Juliet,The Winters Tale,The Tempest
955,How tall is Chicagoâs Sears Tower?,general,1453 ft (443 m),1095 ft (334 m),1811 ft (552 m),1211 Ft (369 m),1453 ft (443 m)
956,What 1951 film did Humphrey Bogart win an Oscar for?,general,African Queen,The Barefoot Contessa,The Caine Mutiny,African Queen,Casablanca
957,Which of Henry VIIIâs wives outlived him?,general,Catharine Parr,Catharine of Aragon,Anne Boleyn,Catharine Parr,Jane Seymour
959,"This actor, whose autobiography was called My Wicked Wicked Ways, starred in the movies Adventures of Robin Hood (1938), Istanbul (1957) and They Died with Their Boots On (1941).",general,Errol Flynn,Claude Rains,Errol Flynn,Anthony Quinn,George Reeves
960,What substance do South American Indians use on the tips of their poison darts?,general,curare,ammonia,Metrazol,curare,snake venom
