,question,category,answer,choices/0,choices/1,choices/2,choices/3
0,This drink contains caffeine.,general,Coffee,Mineral water,Orange juice,Coffee,Beer
1,"Finish the proverb:

Poets are born, ________.",general,...not made.,...not made.,...but can also be made.,...but thats not for sure.,"..., long live the poets!"
2,If a TV program is rated G then this is true.,general,It is suitable for all audiences.,It contains moderate violence.,It contains mild sexual situations.,It is suitable for all audiences.,It is suitable for young children.
3,The theory of relativity was introduced in physics by this man.,general,Albert Einstein,Galileo Galilei,Albert Einstein,Archimedes,Isaac Newton
4,The symbol for the chemical element iron is this.,general,Fe,I,Fe,Zn,Br
5,The author of the novel A Portrait of the Artist as a Young Man is this writer.,general,James Joyce,T. S. Eliot,Samuel Beckett,William Faulkner,James Joyce
6,The capital of Mongolia is this city.,general,Ulaanbaatar,Davao,Islamabad,Quezon,Ulaanbaatar
7,Mitochondrias function in cells is to perform this.,general,To convert organic materials into energy,To control chemical reactions within the cytoplasm,To store information needed for cellular division,To convert organic materials into energy,To process proteins targeted to the plasma membrane
8,The US bought Alaska in this year.,general,1867,1942,1882,1854,1867
9,The 23rd US President was in office during this period.,general,1889 - 1893,1909 - 1913,1889 - 1893,1837 - 1841,1877 - 1881
10,One of these actors did not star in the 1971 movie A Clockwork Orange.,general,Warren Brown,Michael Bates,Patrick Magee,Warren Brown,Malcolm McDowell
11,The first Bulgarian state was formed in this year.,general,681 AD,429 AD,681 AD,712 AD,651 AD
12,The 1962 Soccer World Cup tournament was held in this country.,general,Chile,Switzerland,Mexico,Chile,Italy
13,The Meryas were a probably Finno-Ugric tribe who lived in the region of modern Russia. This is the first historian to mention them.,general,Jordanes,Eusebius of Caesarea,Jordanes,Priscus,Sima Guang
14,"The word abacus derives from a Hebrew word, meaning this.",general,Dust,Movement,Sky,Dust,Wood
25,"Sean Connery, George Lazenby, Roger Moore, Timothy Dalton and Pierce Brosnan have all played the role of a fictional British spy. Who was that character?",general,James Bond,James Bond,Johnny English,Jim Malone,Eliot Ness
26,"Man On The Moon, Amadeus and One Flew Over the Cuckoos Nest are all movies directed by him.",general,MiloÅ¡ Forman,Stanley Kubrick,MiloÅ¡ Forman,Pedro AlmodÃ³var,Martin Scorsese
27,"Across the Hall, Friends Like Us, Insomnia Café and Six of One are all working titles of one of famous US TV-series.  Name the series.",general,Friends,Friends,Sex and the City,ALF,One Tree Hill
28,"The common link between these four movies -Chicken Run, Harry Potter, The Mummy Returns and Cast Away, is that...?",general,They all are produced by one and the same company.,They all treat one and the same social problem.,They all are produced by one and the same company.,One and the same actor is starring in all of them.,They all refer to one and the same social class.
29,Three of the following movies are produced by 20th Century Fox. Which is the odd one?,general,House of Wax,"Me, Myself  Irene",Dr. Dolittle 2,Cast Away,House of Wax
31,"Tom Cruise had a lead role in all, but one of these movies.  Which one?",general,Endless Love,Rain Man,The Firm,Magnolia,Endless Love
32,"All but one of these statements represents a common bond between the movies, The Terminal and Catch Me if You Can.",general,Leonardo DiCaprio stars in them both.,They both can be classified as dramas.,They both are produced by Spielberg.,Tom Hanks stars in them both.,Leonardo DiCaprio stars in them both.
33,"Brad Pitt starred in all these movies, except one. Can you spot it?",general,The Beach,Meet Joe Black,Mr.  Mrs. Smith,Oceans Eleven,The Beach
34,"Robin Williams starred in Mrs. Doubtfire. Another great actor, Dustin Hoffman starred in Tootsie. Both characters pretended to be this.",general,Women,Women,Dead,Insane,Bed-ridden and sick
36,There is something specific about Anne Boleyns ghost. What is it?,general,Her ghost is without a head.,She does not have a ghost.,Her ghost is male.,Her ghost is without hands.,Her ghost is without a head.
37,Which of the following statements about ghosts is incorrect?,general,They are always depicted of a human size and shape.,They are always depicted of a human size and shape.,Ghosts do not have a gross physical body.,Sometimes they might manifest their presence by moving other objects or producing noises.,"They are usually portrayed as silvery, shadowy and fog-like."
38,The ghost of the Roman Emperor Caligula was said to haunt this place.,general,The Lamian Gardens of Rome,Basilica di San Giovanni in Laterano,Amphitheatrum Castrense,The Lamian Gardens of Rome,Great Synagogue of Rome
39,Ghosts have taken a significant place in literature and art since this period.,general,Renaissance,Renaissance,Middle Ages,Romanticism,Baroque
40,"What does Suetonius, Geoffrey of Monmouth and Herodotus have in common?",general,They are three writers that produced the first urban legends.,They are three writers that produce modern urban legends.,They are three writers that produced the first urban legends.,They are three ghost from the modern urban legends.,They are three ghosts from the first urban legends.
43,In 1993 an interesting study about Friday the 13th was published in the British Medical Journal. Its authors investigated if this mystical date is really dangerous. They compared the ratio of traffic volume to the number of vehicular accidents on two different days throughout several years. What was the conclusion of the study?,general,Friday the 13th actually affects the number of vehicular accidents,The number of vehicular accidents is lower on Friday the 13th,The results were inconclusive,Friday the 13th doesnt have any affect on the number of vehicular accidents,Friday the 13th actually affects the number of vehicular accidents
44,The fear of the fatal date is called this.,general,Paraskevidekatriaphobia,Paraskevidekatriaphobia,Aphenphosmphobia,Chronomentrophobia,Coitophobia
46,"There are countless theories about the origins of fear of number 13. One says that the phobia comes from Norse mythology. According to a legend, the 13th god, the god of mischief, turned up at a gathering of the 12 Viking gods and caused the death of Balder the Good.  What was the god of mischief called?",general,Loki,Loki,Tor,Odin,Hod
47,"People fear Friday for many reasons. For example, Jesus Christ was crucified on Friday, the Great Flood began on Friday and Adam and Eve were banned from the Garden of Eden on Friday. Do you know what type of day Friday was in the pagan Roman empire?",general,Execution day,Parade day,Tax day,Execution day,Day for prayers
49,"The bad name of both Friday and number 13 can be explained by many historical and religious facts. However, the reason why they are linked together to form this powerful superstition, cant be explained so easily. According to one theory, the ill-fame of Friday 13th dates back to 13 October 1307, when King Philip IV of France arrested most of the knights of one famous Order. What was the name of the Order?",general,The Knights Templar,The Ancient and Illustrious Order Knights of Malta,Ancient Order Knights of the Mystic Chain,The Knights Templar,Teutonic Order
51,"Having in mind the mysterious background of Black Friday, it is quite natural that the TV series Friday the 13th were so popular. The main character, Jason, is one of the biggest celebrities in the world of horror movies. What is Jasons family name?",general,Vorhees,Hardy,Vorhees,Christy,Burrell
52,Over any given 400-year cycle the 13th day of the month occurs 4800 times. The 13th most often falls on this day of the week.,general,Friday,Sunday,Monday,Wednesday,Friday
53,What movie stars George Peppard as a WWI ace pilot?,general,The Blue Max,The Blue Max,The Blue Baron,The Red Baron,The Black Knight
54,"This movie, directed by Stanley Kubrick, stars Malcolm McDowell as Alex DeLarge.",general,A Clockwork Orange,A Backward Peach,A Future of  Red,A Clockwork Orange,Soylent Green
56,"In Black Sunday, Michael Lander played by Bruce Dern, conspires with a Palestinian terrorist group to kill masses of innocent people in what way?",general,"by detonating a bomb, housed in the undercarriage of a blimp, over a football stadium during the Super Bowl",by detonating a nuclear device inside the Pentagon,"by detonating a bomb, housed in the undercarriage of a blimp, over a football stadium during the Super Bowl",by hijacking a 747 and taking it to Syria,by infecting a water supply with the black plague
58,"In the film The Hunt For Red October, what was the unique quality of the Russian submarine Red October?",general,"It was built with a revolutionary stealth propulsion system called the caterpillar drive,",It was a laser guided sub that tracks 24 targets at the same time.,"It was built with a revolutionary stealth propulsion system called the caterpillar drive,",Its stealth armor confuses the enemy sonar,None of these
59,"Which 1985 comedy film starred Tom Hanks, Jim Belushi and Lori Singer?",general,The Man With One Red Shoe,The Man With One Red Shoe,The Woman In Red,The Masque of the Red Death,Reds
60,"In the movie Goldfinger, which one of the following characters does not die?",general,Pussy Galore,Tilly Masterson,Pussy Galore,Goldfinger,Oddjob
61,"What was unique about The Green Berets, a film starring John Wayne?",general,It was the only Vietnam War film that was produced during the war itself,None of these,It was John Waynes first movie without a female co-star,It was the only non-western John Wayne movie in color,It was the only Vietnam War film that was produced during the war itself
63,"One of the first known blondes was this Greek goddess, whose hair was described by Homer as golden.",general,Aphrodite,Demeter,Aphrodite,Hera,Medusa
64,The hairs of a natural blonde can be described as this.,general,More than those of a brunette,More than those of a brunette,Thinner than those of a brunette,The same number as those of a brunette,Fewer than those of a brunette
65,Researchers in England found this to be true of  blond cashiers in supermarkets.,general,Gather greater queues,Have frequent technical issues with the registers,Gather greater queues,Receive more tips from customers,Have higher chances of not balancing the register at the end of the day
66,During The Restoration period blond hair became a symbol of this.,general,Prostitution,Stupidity,High class,Intelligence,Prostitution
67,Most fairy tale characters have this color hair.,general,Blonde,Blonde,Dark,Green,Red
68,"Blonde hair was important to Hitler, according to him it symbolized this.",general,The purity of the Aryan race,Valor,German nationality,Innocence,The purity of the Aryan race
69,She is regarded as the most famous blonde of all times.,general,Marilyn Monroe,Marlene Dietrich,Eva Brown,Marilyn Monroe,Madonna
70,"Strange as it may be, there are paintings, depicting a blonde one of her.",general,Cleopatra,Madamme Butterfly,Cleopatra,Beyonce,Aretha Franklyn
71,Red is the color of all these except one.,general,Sadness,Danger,Warmth,Passion,Sadness
73,The movie Trois couleurs: Rouge (Three Colors: Red) is about a girl who discovers her neighbour is keen on invading peoples privacy. This is her profession.,general,Model,Photographer,Teacher,Model,Actress
74,The Rothschilds were one of the most successful business families in history. Their family name literally means this.,general,Red Shield,Red Shire,Red Sheath,Red Shield,Red Sheave
75,Three of the following albums are by the band Red Hot Chili Peppers. Which is the odd one?,general,In Another Land,Blood Sugar Sex Magik,Freaky Styley,In Another Land,By the Way
76,"Red River College (RRC) is a large and very comprehensive institute of applied learning, located in this city.",general,Winnipeg,Ottawa,Toronto,Vancouver,Winnipeg
77,Red Lobster is a U.S. chain of seafood restaurants. Its original name was this.,general,Harbor for Seafood Lovers,Harbor for Seafood Lovers,Lobster Lovers,Lobster Barbecue,Red Harbor
78,Manfred Albrecht Freiherr von Richthofen was a German pilot and is still regarded today as the ace of aces. Which of the following pairs (nickname - nation calling him that) is wrong?,general,They are all true.,Red Battle-Flyer - the Germans,Red Devil - the French,Red Baron - the British,They are all true.
79,Simply Red is a British band. The bands name is related to this soccer team.,general,Manchester United,Arsenal,Liverpool,Manchester United,Middlesbrough
80,One of these four countries does not border the Red Sea.,general,Oman,Jordan,Egypt,Oman,Sudan
81,"Internationally, blue is the color of these political parties.",general,Conservative parties,Labour parties,Liberal parties,Communist parties,Conservative parties
82,"The term blue blood, meaning aristocracy or related to aristocracy, originated in this country.",general,Spain,England,Germany,Spain,France
83,Eiffel 65 is a trio of Italian musicians who play electronic music. One of their biggest hits is Blue (Da Ba Dee). The album featured this hit.,general,Europop,Eiffel 65,Contact!,Europop,Suggested Title - Crash Test
84,In German the word for blue is used to describe that a person is this.,general,Drunk,Married,Crazy,Rich,Drunk
85,"Blue is a British boy band consisting of four members. The song Signed, Sealed, Delivered, Im Yours is performed by them and this musician.",general,Stevie Wonder,Jim Morrison,Stevie Wonder,Elton John,Steve Lawrence
86,"In The Hitchhikers Guide to the Galaxy there are several references to a super-intelligent shade of the color blue, called this.",general,Hooloovoo,Cyan,Volo-loco,Hooloovoo,Gobo
87,Blue pages are a telephone directory of these.,general,Government offices,Business offices,Celebrities home numbers,Brothels numbers,Government offices
88,This huge company is often referred to as Big Blue.,general,IBM,Hewlett-Packard,Microsoft,IBM,"Cisco Systems, Inc."
89,"What did electrical engineering professor, Dr. Brent Townshend, invent in 1996?",general,The 56K modem,The 56K modem,Potato Chips,Bookshelf speakers,The remote control locator
90,"What did George Crum invent at the Moon Lake Lodge resort in Saratoga Springs, New York?",general,The potato chips,The remote control locator,The potato chips,Bookshelf speakers,The 56K modem
91,"In 1971, this programmer implemented the first email system capable of sending mail between users on different hosts connected to the ARPANET.",general,Ray Tomlinson,David Thomson,John Tomlinson,Mark Thomson,Ray Tomlinson
92,"This device, named Missing Link,  was invented by twin sisters Kelli and Vanessa Dunn.",general,The remote control locator,The remote control locator,The bookshelf speakers,The 56K modem,The microphone
93,"In 1986, this musician, famous for performing the song  Johnny B. Goode, became the first person inducted into the Rock and Roll Hall of Fame.",general,Chuck Berry,Bill Haley,Chuck Berry,Elvis Presley,Jerry Lee Lewis
94,"This actor, who plays Dr. Norman in What Lies Beneath, is also a licensed pilot of both planes and helicopters.",general,Harrison Ford,John Travolta,Anthony LaPaglia,Ralph Finnes,Harrison Ford
95,"How old was Cio-Cio-San, a character in Giacomo Puccinis opera, Madame Butterfly ?",general,15,15,20,19,21
96,This number is usually associated with the unknown and the bad luck. A fear of this number is known as triskaidekaphobia.,general,13,6,13,9,666
97,This is the number of heavens in Islamic tradition. It is also the figurative number of seas.,general,7,11,3,4,7
98,50 years of marriage are known as this.,general,Gold anniversary,Pearl anniversary,Diamond anniversary,Gold anniversary,Platinum anniversary
99,The first Soviet nuclear ballistic submarine was called K-(this number).,general,19,18,17,19,21
100,This is the number of points outlined by president Woodrow Wilson for reconstructing a new Europe following World War I.,general,14,12,24,14,27
101,One of these statements about the enigmatic number 23 is wrong.,general,All statements are in fact true.,Each parent contributes 23 chromosomes to the DNA of a child.,Julius Caesar was stabbed 23 times when he was assassinated.,All statements are in fact true.,"The Knights Templar had 23 Grand Masters, the last being Jacques de Molay."
102,"According to Douglas Adams book The Hitchhikers Guide to the Galaxy, this number is the answer to the Ultimate Question of Life, the Universe and Everything.",general,42,37,53,42,27
104,This is the number of syllables in a haiku (a very short Japanese poetic form).,general,17,41,35,28,17
105,This is the total number of books in the New Testament of the Holy Bible.,general,27,27,57,37,17
106,"In this movie Eminem plays the main character, whose name is Jimmy B-Rabbit Smith, Jr.",general,8 Mile,Torrance Rises,The Wash,8 Mile,The Slim Shady Show
107,This comedian stars in Who Framed Roger Rabbit (a 1988 motion picture).,general,Bob Hoskins,Jim Varney,Bob Hoskins,Jim Carrey,Danny DeVito
108,The young of which of these animals is not called a joey?,general,dog,dog,opossum,wombat,kangaroo
109,"In these fractions, used by ancient Egyptians, the numerator is 1 and the denominator is a positive integer.",general,unit fractions,algebraic fractions,decimals,continued fractions,unit fractions
110,What is the name of the informal association of people who can trace their ancestry to the original Virginian colonists from England?,general,First Families of Virginia,First children of Virginia,First Settlers of Virginia,First Families of Virginia,Founders of Virginia
111,Which collective noun denotes a group of owls?,general,parliament,parliament,descent,dule,covey
112,"Which battleship of the Imperial Japanese Navy was sent on a suicide mission in 1945, during the invasion of Okinawa?",general,Yamato,Yamato,Kamikaze,Tojo,Noh
113,This word deriving from Latin refers to the act of throwing someone or something out of a window.,general,defenestration,defenestration,sylvan,peloton,homunculus
114,"Which word was coined by philosopher and theologian, William Whewell in 1833?",general,scientist,holography,magenta,scientist,trastevere
115,"What was the first word addressed to Mission Control by Neil Armstrong, when his craft landed on the Moon on July 20, 1969?",general,Houston,One,Buzz,Roger,Houston
116,"The Cretaceous-Tertiary event, also known as KT boundary, refers to what?",general,a period of massive extinction of species,a period of massive extinction of species,The destruction of the largest pyramid in the Western hemisphere,the first recorded devastating tsunami,None of these
117,Sapphire is usually associated with this month.,general,September,November,December,October,September
118,One of the following pairs (month - the gem associated with it) is wrong.,general,February - Peridot,February - Peridot,December - Turquoise,March - Aquamarine,June - Pearl
121,"The birth stones associated with March, September and December can all be found in this color.",general,Blue,Blue,Green,Pink,White
122,History records the fact that a Roman senator named Nonius chose exile rather than surrender his precious stone to Mark Anthony. This is Nonius gem stone.,general,Opal,Ruby,Opal,Tourmaline,Zircon
123,"In chemistry, if you mix an acid with a base you would get these chemicals.",general,Water and a salt,Water and carbon dioxide,Carbon dioxide and water,Water and a salt,A salt and oxygen
124,Which was the first car model to sell one million cars in one year?,general,Chevy Impala,Corvette,Chevy Impala,Volkswagon Beetle,Toyota Corolla
125,"Which company built the A6M, aka Zero -- the fighter aircraft  that was used in the attack on Pearl Harbor?",general,Mitsubishi,Toshiba,Isuzu,Mitsubishi,Mikayashi
126,Which U.S. President is famous for saying I choose not to run?,general,Calvin Coolidge,Calvin Coolidge,Herbert Hoover,John Tyler,Warren G. Harding
127,What type of chocolate contains the most  flavonoids and may help lower your cholesterol?,general,Dark chocolate,Chocolate with almonds,Milk chocolate,White chocolate,Dark chocolate
128,How much did the USA pay Russia for Alaska?,general,$7.2 million,$72 million,$720 million,"$720,000",$7.2 million
129,At what temperature is the Fahrenheit temperature equal the Celsius temperature?,general,-40 degrees,0 degrees,-40 degrees,4 degrees,-4 degrees
130,What musical instrument made jazz performer Lionel Hampton famous?,general,Vibes,Trombone,Drums,Clarinet,Vibes
131,What are the only two landlocked countries in South America ?,general,Bolivia and Paraguay,Bolivia and Paraguay,Paraguay and Uruguay,Bolivia and Uruguay,Colombia and  Ecuador
132,The real McCoy refers to the man who invented this.,general,The locomotive self-lubricator,The train throttle,The sewing machine,The train coupling,The locomotive self-lubricator
133,"Which word means a practitioner of the martial art of Okinawan origin, karate?",general,Karateka,Konyico,Karateka,Sojin,Samurai
134,Which of these Biblical characters is known to have the greatest number of children?,general,David,Jacob,King Saul,David,Joshua
135,"Which device was patented in 1970 by  Douglas Engelbart, an American inventor of Norwegian descent?",general,The computer mouse,The traffic light,The computer mouse,The internal combustion engine,The can opener
136,"When did the famous American crooner Nat King Cole and his daughter Natalie Cole record their hit song, Unforgettableâ?",general,Never,in 1989,Never,in 1990,The date was never officially revealed
138,"In ancient times, which stone was believed to protect from drunkenness?",general,amethyst,amethyst,ruby,emerald,onyx
139,"Nicknamed Mighty Mo (or Big Mo), this Iowa-class battleship from the end of World War II was the last battleship built by the United States.",general,USS Missouri,USS Missouri,USS Illinois,USS Idaho,USS Minnesota
141,In what year did French mechanic Nicolas Joseph Cugnot invent the first self-propelled road vehicle?,general,1769,1891,1824,7874,1769
142,This is the only RB/soul singer asked by Johnny Carson to perform twice in the same week in The Tonight Show.,general,Patti LaBelle,Gladys Knight,Aretha Franklin,Patti LaBelle,Whitney Houston
143,"3M Company was formed in 1902 in Two Harbors, Minnesota near Lake Superior with the intent of selling sandpaper. The company made $22.923 billion USD in 2006 and is famous for several inventions, including Scotch tape. What does 3M stand for?",general,Minnesota Mining and Manufacturing Company,The number 3000,Minnesota Mining and Manufacturing Company,The year 3000 A.D.,"Michaels, McCallister and Murphy"
144,"Having won 6 Tony Awards, including Best Musical, this 1950s production is a modern retelling of the Faust legend. Its main characters are Mr. Applegate, Joe Boyd and Lola.",general,Damn Yankees,"Hello, Dolly!",The Music Man,Guys and Dolls,Damn Yankees
145,"Born in Vladivostok, Russia in 1920, this Academy Award-winning actor is best know for playing King Mongkut of Siam 4,626 times onstage. He also reprised the role in the film version of the musical.",general,Yul Brenner,Telly Savalas,Yul Brenner,Lee J. Cobb,Peter Sellers
146,This country is a founding member of the European Union and the United Nations and one of the five permanent members of the United Nations Security Council. It is visited by over 75 millions tourists annually.,general,France,Germany,France,Spain,England
148,"Author Marianna Mayer describes this mythical creature as the only fabulous beast that does not seem to have been conceived out of human fears. In even the earliest references he is fierce yet good, selfless yet solitary, but always mysteriously beautiful. He could be captured only by unfair means. What creature is this?",general,Unicorn,Satyr,Griffin,Unicorn,Phoenix
149,This Shakespearean play is referred to as The Scottish Play or The Scottish King by most actors and theater people since it is considered bad luck to mention the name of the play.,general,Macbeth,King Lear,Othello,Macbeth,Hamlet
150,The average person can live this number of days without water.,general,11,11,4,21,31
152,The first couple to be shown in bed together on prime time television was this.,general,Johnny and Mary Kay Stearns,Johnny and Mary Kay Stearns,The Simpsons,The Jetsons,The Adams
153,He was the only US President to win the Pulitzer Prize.,general,John F. Kennedy,Woodrow Wilson,Dwight D. Eisenhower,Lyndon B. Johnson,John F. Kennedy
154,"Some sources claim the youngest pope was Benedict IX (1032 A.D.), elected at this age.",general,12,21,9,16,12
156,"According to GlobalNet UK, less than what percentage of 500 Chinese cities surveyed have clean air?",general,1%,15%,24%,30%,1%
157,Tegestology is the hobby of collecting this.,general,Beer mats,Beer mats,Coffee spoons,Bottle labels,Bottle lids
158,Who invented the ball point pen?,general,Jozsef Laszlo Biro,Elias Schaeffer,Elias Howe,John Fitzsimmons Waterman,Jozsef Laszlo Biro
159,The idea of a helicopter was first documented by this man.,general,Leonardo Da Vinci,Sikorsky,Einstein,Aristotle,Leonardo Da Vinci
160,What was the first product to have a bar code?,general,Wrigleys gum,Scotts Tissue,Pez candy,Bounty bar,Wrigleys gum
161,What do we call a storage place for bees?,general,Apiary,A bee zoo,Apiary,Asterciary,Aviary
162,Former NBA coach Frank Layton once fined small forward Adrian Dantley thirty pieces of silver.  What did Layton say the fine was for?,general,Betrayal,Being late to three  practices in a row,Betrayal,Asking to be traded,Missing three foul shots in a row
163,Which of these elements has the highest melting point?,general,Carbon,Nitrogen,Hydrogen,Oxygen,Carbon
