,question,category,answer,choices/0,choices/1,choices/2,choices/3
1520,"Television beamed their fairytale wedding to over 270 million viewers on July 29, 1981. Sadly, on August 28, 1996 a divorce was granted to the Peoples Princess  and her once Prince Charming. Who was the Princess referring to when she stated in an interview on the BBC, There were three of us in the marriage, so, it was a bit crowded.?",general,Camilla Parker Bowles,Wallis Warfield Simpson,Camilla Parker Bowles,Tiggy Legge-Bourke,Alice Keppel
1521,"Look for me by moonlight
Watch for me by moonlight
Ill come to thee by moonlight, though hell should bar the way.
What is the title of the poem that tells of the ill-fated love of Bess the landlords daughter and her lover who lay in his blood on the highway, with a bunch of lace at his throat.?",general,The Highwayman,Danny Deever,Annabel Lee,Curfew Shall Not Ring Tonight,The Highwayman
1522,What color is the sweat of the Hippopotamus?,general,Red,Red,Clear,Pink,Blue
1523,What is the strongest muscle in the body in relation to its size?,general,Masseter,Deltoids,Tongue,Gluteus Maximus,Masseter
1524,Which of these presidents had a pet alligator?,general,John Quincy Adams,Roosevelt,John Quincy Adams,George Bush,Thomas Jefferson
1525,"On the Canadian 2 dollar bill, what flag flies over the parliament building?",general,US flag,US flag,British Flag,UN flag,French Flag
1526,"The US Postal Service issued a series of stamps honoring these movies: Beau Geste, Gone With the Wind, The Wizard of Oz, and Stagecoach. What do these films have in common?",general,All were all released in the same year.,They were all released by Warner Brothers.,They all starred Clark Gable.,They all had their premiers in California.,All were all released in the same year.
1527,The ages of many men are mentioned in The Bible. Who is the only woman whose age is mentioned in The Bible?,general,Sarah,Vashti,Sarah,Ruth,Bathsheba
1529,What useful device was invented by Sylvan Goldman?,general,The shopping cart,The TV remote control,The hair curler,The shopping cart,TiVo
1530,This word can mean: 1) the upper part of a shoe that covers the instep; 2) an improvised accompaniment in music; 3) a seductive woman.,general,vamp,vamp,tramp,truel,hypoxiol
1531,What did Benjamin Green invent in 1944?,general,Coppertone,Kevlar,The garage door opener.,Coppertone,TiVo
1533,"When US President James Garfield was assassinated, this famous inventor tried to use his new metal detector to help the surgeons find the bullet.",general,Alexander G. Bell,Nikolai Tesla,Samuel F. B. Morse,Alexander G. Bell,Thomas Alva Edison
1534,Which Amendment  to the US Constitution guarantees the right to privacy?,general,It is not guaranteed in the Constitution,The Fourteenth,The Fifteenth,It is not guaranteed in the Constitution,The Second
1535,Normal saline solution contains this percentage of salt (NaCl)?,general,0.9%,0.9%,9%,4.5%,1.3%
1536,Who was the first guest star to step off the plane on Fantasy Island?,general,Bill Bixby,Bill Bixby,Don Knots,Roddy McDowell,Victoria Principal
1537,It is generally accepted that this was the first novel whose manuscript was typed on a typewriter.,general,The Adventures of Tom Sawyer,The Adventures of Huckleberry Finn,The Adventures of Tom Sawyer,The Great Gatsby,Moby Dick
1538,What is the name of the first full length movie to use color?,general,"The World, the Flesh And the Devil",A Visit to the Seaside,"The World, the Flesh And the Devil",The Raven,The Coward
1539,Who made the first chocolate bar?,general,J. S. Fry  Sons,J. S. Fry  Sons,Nestle,Mars,Hershey
1540,Who is the first State of the Union Address attributed to?,general,George Washington,Jefferson Thomas,George Washington,John Adams,James Madison
1541,What is Americas first continuously-published newspaper?,general,Boston News-Letter,Boston Globe,Boston Star,Boston Herald,Boston News-Letter
1542,When was the first Copper Penny created?,general,1792,1792,1794,1795,1793
1543,"The First Inauguration of a US President included saying the phrase, So help me God, and kissing the Bible after taking the oath. Who was the President that set the precedent?",general,George Washington,George Washington,Andrew Jackson,Thomas Jefferson,James Madison
1555,What is the fastest bird of prey?,general,Peregrine Falcon,Harris Hawk,Bald Eagle,Osprey,Peregrine Falcon
1556,What team became the English Premier League champion in the 2006-2007 season?,general,Manchester United,Liverpool,Manchester United,Arsenal,None of these
1557,How many bones does the human spine have?,general,33,16,12,48,33
1560,Which definition is incorrect?,general,Halophile - one who has an affinity for direct light.,Halophile - one who has an affinity for direct light.,Petrophile - one who loves or has an affinity for rocks.,Lygophile - one who loves darkness.,Ombrophile - an animal or plant that has an affinity for large amounts of rainfall.
1561,Which statement  about the phobias of these fictional characters is untrue?,general,Winston Smith from the book 1984 had an unreasonable fear of birds.,Beatrix Kidd from Kill Bill had an unreasonable fear of being  buried alive.,Ron Weasley from the Harry Potter books had an unreasonable fear of spiders.,Fox Mulder from The X-Files had an unreasonable fear of  fire.,Winston Smith from the book 1984 had an unreasonable fear of birds.
1562,Who was on the cover of the first issue of  People magazine?,general,Mia Farrow,Elvis Presley,Joseph G. Cannon,Mia Farrow,Lucille Ball
1563,Who was the first actor to play Tarzan?,general,Elmo Lincoln,Johnny Weissmuller,Mike Henry,Ron Ely,Elmo Lincoln
1564,"This person, who became public announcer for the New York Yankees in 1951, appeared in the movies 61, It Could Happen to You,  The Scout and Anger Management.",general,Bob Sheppard,Joe Buck,Phil Rizzuto,Bob Sheppard,Michael Kay
1565,What did French engineer Louis Reard invent in 1946 ?,general,the Bikini,the first complete fossil of a triceratops,the oversized catchers mitt,the chemical test for prostate cancer (The PSA test),the Bikini
1566,Which of Jim Hensons Muppets was the first one to be a regular on The Jimmy Dean Show?,general,Rowlf  the Dog,Rowlf  the Dog,Kermit the Frog,Big Bird,Oscar the Grouch
1567,Which statement about the name Florence Nightingale Graham is true?,general,It is the real name of the famous beauty expert and business woman Elizabeth Arden.,It is the real name of  Billie Holliday.,"It is the married name of the famous nurse, Florence Nightingale",It is a pseudonym for the author Agatha Christie.,It is the real name of the famous beauty expert and business woman Elizabeth Arden.
1568,Which of these is the alter ego of Iron Man?,general,Tony Stark,Matt Murdock,Hank Williams,Tony Stark,John Johnson
1570,Kurt Wagner is the alter ego of which character?,general,Nightcrawler,Spawn,Mockingbird,Wonder Woman,Nightcrawler
1571,Fictional character Barbara Morse graduated from the Georgia Institute of Technology with a Ph.D. in biology and helped rediscover the Super-Soldier formula that created Captain America. She eventually became this super heroine.,general,Mockingbird,Batwoman,Mockingbird,Poison Ivy,Wonder Woman
1572,Who is Cat Woman?,general,Selina Kyle,Samantha Wayne,Pam Isley,Sarah Connor,Selina Kyle
1575,What kind of phobia is defined as fear of high places?,general,Acrophobia,Tapephobia,Acrophobia,Xenophobia,Botophobia
1576,What term refers to a phobia that involves fear of men?,general,Arrhenphobia,Arrhenphobia,Botophobia,Xenophobia,Nosophobia
1584,This former presidents name was a little bit too close to raygun to start the Star Wars Missle Defense System. Who was this former action hero?,general,Ronald Reagan,Ronald Reagan,George W. Bush,George Bush,Bill Clinton
1586,"In a pen, what is the object that holds the ink called?",general,ink reservoir,ink composite,ink compress,ink reservoir,ink tube
1587,When was the first fountain pen invented?,general,1883,1902,1906,1883,1887
1589,Where does the oldest known ink come from?,general,China and India,India and Turkey,England and China,China and India,France and Japan
1590,You are doing a handwriting analysis test. You choose green ink. What does this say about you?,general,You are adaptable and desire harmony.,You are very friendly and spiritual.,You have a desire to stand out from the crowd.,You are adaptable and desire harmony.,You enjoy leadership and dominance.
1592,What are the two classes into which ink is divided?,general,Printing and Writing,Printing and Writing,Printing and Office,Writing and Lining,Printing and Balling
1593,"This group, formed in the late 1930s, are known for the song If I Didnt Care.",general,The Ink Spots,The Ink Boys,The Ink Spots,The Ink Sounds,The Ink Brothers
1594,"In this year, Led  Zeppelin  released Stairway to Heaven and  Andrew Lloyd Webbers Jesus Christ Superstar opened.",general,1971,1971,1977,1973,1975
1595,Where was Nicole Kidman born?,general,Honolulu,Perth,Wellington,Honolulu,Sydney
1597,Natale Cole is the daughter of Nat King Cole. Who was her famous grandfather?,general,Duke Ellington,Duke Ellington,Count Basie,Terry Coles,Roger Coles
1598,"In the year 632, he succeeded Mohamed and became the First Caliph.",general,Abu Bakr,Abu Bakr,Tahallah,Abu Qahafa,al-Zubahr
1599,What is the state motto of Rhode Island?,general,Hope,Forward,The Union,Industry,Hope
1600,At what angle is the Earth tilted?,general,23.5 degrees,23.5 degrees,90 radians,45 radians,45 degrees
1601,Which of these states has the biggest area?,general,Hawaii,Hawaii,"Washington, D.C.",Connecticut,Delaware
1602,Tom Hanks co-starred in the TV program Bosom Buddies with this fine actor/juggler.,general,Peter Scolari,Christopher Knight,Peter Scolari,Steve Zahn,Tom Everett Scott
1603,What type of rock is pumice?,general,Igneous,Igneous,Sedimentary,Metamorphic,Conglomerate
1605,"In the year 100, there were about 255 square miles per living person on earth. What was that number in  2000?",general,8.2 square miles,17.3 square  miles,127.4 square miles,8.2 square miles,64.1 square  miles
1606,This United States Navy aircraft was used widely during the Second World War.,general,F4U Corsair,B17 Flying Fortress,F-5 Tiger,P47 Thunderbolt,F4U Corsair
1607,This aircraft is used widely by the Thunderbirds and Air Force Fighter Wings.,general,F-16,F-16,F-14,F-15,F-18
1608,What is the first stealth fighter used by the United States Military?,general,F-22 Raptor,F-22 Raptor,F/A18 Super Hornet,F-5 Tiger,P-47 Thunderbolt
1609,What aircraft was used by the United States Navys Blue Angles demonstration team prior to adopting the F/A18 Super Hornet?,general,A-4,Cessna 182,A-10,A-4,F-4
1610,"This aircraft, introduced in 1956, is the main transport plane used by the United States Military.",general,C-130,C-130,Boeing 777,Citation X,Gulf Stream G5
1611,This helicopter was used widely by the U. S. military during the Vietnam War.,general,Huey,Pavelow,Apache,Cobra,Huey
1612,This bomber was introduced in February 1955.,general,B-52,B-17,B-52,F-15,B-29
1613,Before the F/A18 this was the main U.S. Marine Corps fighter/bomber.,general,Harrier,Cobra,Thunderbolt,Harrier,Tiger
1614,This stealth aircraft was used during Operation Desert Storm in 1991.,general,F-117 Nighthawk,F-22 Raptor,Joint Strike Fighter,F-117 Nighthawk,FA/18 Super Hornet
1615,This aircraft entered service with the United States Navy in 1999.,general,F/A18 Super Hornet,F-15 Eagle,E-3 Sentry,F-16 Fighting Falcon,F/A18 Super Hornet
1616,Which of the following actors has NOT portrayed the Frankenstein monster?,general,Michael Landon,Randy Quaid,Christopher Lee,Robert DeNiro,Michael Landon
1617,This Czech writer wrote a play called  R.U.R.: Rossums Universal Robots.,general,Karel Capek,Carl Kuchik,Peter Kipchak,Karel Capek,Wilhem Capok
1618,This is a technique or method of dyeing fabrics using wax (to cover parts of the fabric not intended to be dyed).,general,batik,batik,susak,barak,kurak
1619,Which one of these women is a sculptor famous for works with war-related themes?,general,Renee Headings,Renee Headings,Lin Mae Wang,Lisa Picard,May Howard  Jackson
1620,"Which statement is not true about Madame LaForce, who was a Confederate spy during the American Civil War?",general,She was French born.,She was a man.,She was French born.,She was a flirt.,She led the take-over of the steamer St. Nicholas in 1861.
1621,Which statement about the actor Donald Sutherland is untrue?,general,"He was born in Teddington, Middlesex, England.",He starred as Casanova in Il Casanova di Federico Fellini,"He was born in Teddington, Middlesex, England.",He starred as Homer Simpson.,"He starred in Alex in Wonderland, which featured Federico Fellini"
1622,Which of these famous baseball players became the first major league player to hit two grand slams in one game?,general,Tony Lazzeri,Tony Lazzeri,Babe Ruth,Lou Gehrig,Bobby Bonds
1623,The animals from which group are often called sea cows?,general,Sirenia,Enhydra,Odobenidae,Sirenia,Otariidae
1624,Which was the first country in the world to constitutionally abolish its army?,general,Costa Rica,Costa Rica,Gabon,Togo,Estonia
1625,Which of these countries is the oldest independent constitutional republic?,general,San Marino,Iceland,Monaco,San Marino,Costa Rica
1626,In which American city is the fast-food restaurants chain McDonalds incorporated?,general,"San Bernardino, California","Phoenix, Arizona","San Bernardino, California","Oak Brook, Illinois","Arcadia, California"
1627,"This former baseball player, born in Donora, Pa, has 3630 hits in his career - 1815 hits at home and 1815 hits on the road.",general,Stan Musial,Frank Thomas,"Ken Griffey, Jr.",Ken Griffey,Stan Musial
1628,How many red balls are in a game of snooker?,general,15,3,1,15,8
1629,In what body of water is the island of Malta located?,general,Mediterranean Sea,Mediterranean Sea,Pacific Ocean,Atlantic Ocean,North Sea
1630,"According to the Bible, where was Jesus Christ born?",general,Bethlehem,Jerusalem,Erichon,Bethlehem,Egypt
1631,Where is the city of Bahia Blanca located?,general,Argentina,Argentina,Colombia,Micronesia,Dominican Republic
1632,Which lake is NOT one of the Great Lakes?,general,Great Salt Lake,Great Salt Lake,Lake Huron,Lake Michigan,Lake Ontario
1633,Dry air consists mostly of what gas?,general,Nitrogen,Carbon Dioxide,Oxygen,Nitrogen,Argon
1634,Which of these stories was written by the Brothers Grimm?,general,The Frog Prince,The Adventures of Pinocchio,Puss in Boots,Sleeping Beauty,The Frog Prince
1635,What role does the carburetor have in the engine?,general,Mixing air and fuel,Cooling,Mixing air and fuel,Igniting the fuel mixture,Cleaning
1636,What does lacrimation mean?,general,Shedding Tears,Psychosis,Shedding Tears,Addiction,Dilation
1637,What was the second  song played on MTV?,general,You Better Run,You Better Run,Hit Me With Your Best Shot,Video Killed the Rock Star,Radio Killed the Video Technician
1638,What was Elvis Presleys second number 1hit?,general,Dont Be Cruel,Dont Be Cruel,Love Me Tender,Hound Dog,Heartbreak Hotel
1639,Which team won the second Super Bowl?,general,The Green Bay Packers,The New York Jets,The Washington Redskins,The Kansas City Chiefs,The Green Bay Packers
1640,What is the second book of the Bible?,general,Exodus,Acts,Mark,Joshua,Exodus
1641,In which city was Michael Jordans second professional team based?,general,Chicago,Baltimore,Washington,Charlotte,Chicago
1642,Which team won the second World Series between the National League and the American League?,general,New York Giants,Pittsburgh Pirates,New York Giants,Providence Grays,New York Metropolitans
1643,Who was the second US President  to face impeachment?,general,William Clinton,William Blount,Andrew Johnson,Richard Nixon,William Clinton
1644,What was the second war fought by the USA?,general,The War of 1812,The War against the Barbary Pirates,The Civil War,The War of 1812,The Mexican War
1645,Who was the second host of the Tonight Show?,general,Jack Paar,Johnny Carson,Steve Allen,Jay Leno,Jack Paar
1646,Who was Elizabeth Taylors second husband?,general,Michael Wilding,Michael Wilding,Mike Todd,Nick Hilton,Eddie Fisher
1647,Who was Frank Sinatras second wife?,general,Ava Gardner,Mia Farrow,Ava Gardner,Barbara Marx,Nancy Barbato
1648,Which was the second motion picture  to win the Oscar for Best Movie?,general,The Broadway Melody,The Broadway Melody,Wings,All Quiet on the Western Front,Cimarron
1649,Which of the following is generally considered to be the second longest symphony?,general,Shostakovitchs Leningrad Symphony,Mozarts Jupiter Symphony,Mahlers Symphony No. 3 in D minor,Shostakovitchs Leningrad Symphony,Beethovens Symphony Number 9 (the Choral)
1650,Who was the second Republican US President?,general,Ulysses Grant,Andrew Johnson,Ulysses Grant,Abraham Lincoln,Rutherford B. Hayes
1651,Which of these is covered by the second amendment to the US Constitution?,general,the right to bear arms in order to maintain a militia,the right to bear arms in order to maintain a militia,the right to not have soldiers living in our houses,the right to a fair and speedy trial,the right to vote
1652,What is true  about  music compact discs?,general,The hole is the exact size of the Dutch coin called dubbeltje.,Americas Greatest Hits is the number one selling CD in the USA.,The hole is the exact size of the Dutch coin called dubbeltje.,The patent behind the compact disc is co-owned by Dick Clark.,Glen Campbells Greatest Hits was the first music CD in the USA.
1653,Which of these is not a quote by Groucho Marx?,general,I have a memory like an elephant. In fact elephants often consult me.,I have a memory like an elephant. In fact elephants often consult me.,The husband who wants a  perfect marriage should keep his mouth shut and his checkbook open.,Bloods not  thicker than money.,I was married by a judge. I should have asked for the jury.
1654,This drink was invented for a party given by Winston Churchills mother.,general,The Manhattan,The Gibson,The Sidecar,The Manhattan,The Sloe Gin Fizz
1655,The USA has an extensive Interstate Highway System. What five state capitals are NOT directly served by this system?,general,"Juneau, Dover, Jefferson City, Pierre, Carson City","Juneau, Dover, Carson City, Honolulu, Pierre","Juneau, Honolulu, Jefferson City, Carson City, Pierre","Juneau, Honolulu, Salem, Columbia,  Salt Lake City","Juneau, Dover, Jefferson City, Pierre, Carson City"
1656,Which best defines the word Sanhedrin?,general,The court of 23  judges biblically required to be present in every city,The condition of being without mental faculties,The religious book on which the Jain religion is based,The ancient spice used in Egypt to counter bad omens,The court of 23  judges biblically required to be present in every city
1657,What is Belle Fourche?,general,The  geographic center of the United States.,The  geographic center of the United States.,"A new dessert created on TV, which contains three types of chocolate, strawberries, and  cranberry marmalade.",The resort voted Number One Vacation Destination  by Forbes Magazine,"A very upscale suburb of Paris in which the average house goes for 3,450,000 Euros"
1658,"By act of Congress, this is the official alcoholic spirit of the USA.",general,Bourbon,Corn liquor,Gin,Rye,Bourbon
1659,Who is Hiroo Onoda?,general,The last Japanese casualty from World War II,The last Japanese casualty from World War II,The founder of Mazda,This is the real name of Tojo.,The Japanese fisherman who first sees Godzilla in the movie of the same name
1660,What is lethologica?,general,A psychological disease first identified as a serious condition by Carl Jung,Any  word used incorrectly in a sentence.,A physical disease in which the patient does not have enough energy to speak,A psychological disease first identified as a serious condition by Carl Jung,A religious practice involving saying certain Biblical names to counter a sin.
1662,"Which Biblical prophet, mentioned in two books of the Bible, was swallowed by a great leviathan?",general,Jonah,Jeroboam,Jonah,Joshua,Jeremiah
1663,He was called Big Train. He was the first baseball player whose last name began with a J to be elected to the Baseball Hall of Fame. Who was he?,general,Walter Johnson,Judy Johnson,Ban Johnson,Addie Joss,Walter Johnson
1664,"What is the name of the poem in which these nonsense words are used: chortled, vorpal, galumphing, and frabjous?",general,Jabberwocky,Jabberwocky,Jansonaught,Jerboky,Jessenight
1665,"This great boxer, known as the Galveston Giant, was the worlds Heavyweight Champion from 1908-1915.",general,Jack Johnson,Jim Jeffries,Jim Johnson,Jack Johnson,Jack Jeffries
1666,In the USA we often see commercials for Subway sandwiches. They usually feature a man who went  from 425 pounds to 190 pounds because of a diet  based on Subways menu. What is his name?,general,Jared Fogel,Jared Leto,Jared Nugent,Jared Lamanite,Jared Fogel
1667,"This psychiatrist, born in Switzerland in 1875, was one of the founders of analytic psychology.",general,Carl Gustav Jung,Johannes Jorenstem,Erik Jung,Yokaim Junster,Carl Gustav Jung
1668,"Who killed Jesse James, one of the legendary figures of the Wild West?",general,Robert Ford,Charley Ford,Frank James,John Carradine,Robert Ford
1669,"His first name was Jimmy and he was a great defensive back for the San Francisco 49ers from 1961 -1976. He is in the Pro Football Hall of Fame. His brother, Rafer, is more famous as an athlete and as a  part-time special bodyguard. What  is Jimmy and Rafers last name?",general,Johnson,Johnson,James,Jameson,Jackson
1670,This was the first country that starts with the letter J to join the United Nations.,general,Jordan,Jurasconia,Jamaica,Japan,Jordan
1671,"It is one of the oldest religions. Most of its followers live in India, where it began. Adherents believe that each individual is responsible for his/her actions. They believe that each living thing has an eternal soul. What is this religion?",general,Jainism,Jensenism,Judaism,Jainism,Jarita Dharma
1672,He won the 2000 Nobel Peace Prize for his work promoting peace and democracy.,general,Kim Dae Jung,Kim Dae Jung,Jo El Karl,Leon Jouhaux,James Jarrod
1673,What was Christine Jorgensen most famous for?,general,transgender surgery,voice-over actor/singer,transgender surgery,mystery writer,photography
1674,They were a group of landed nobility in Prussia  and Eastern Germany. Their name comes from the German for young lord. They formed several aristocratic political groups in Germany.,general,Junkers,Jurrsia,Jongres,Junkers,Junists
1675,"This sea animal is found in the Atlantic, Pacific and Indian Oceans but is most numerous off Hawaii and Australia. Although it usually weighs about .8 Kg, some individuals actually weigh 3 Kg (over 6.7 pounds.) This animal is blue on top and silver on bottom, often with a blue stripe.",general,jack-ass fish,jack-ass shrimp,jack-ass prawn,jack-ass fish,jack-ass skate
1676,WWII is undoubtedly the bloodiest war. This is the number of fatalities it caused.,general,56.4 million,56.4 million,44.0 million,71.8 million,27.3 million
1677,The most garbage collecting volunteers gathered in this US state.,general,California,Ohio,Texas,California,New York
1678,The largest consumption of cigarettes belongs to this country.,general,China,Brazil,India,China,The US
1679,The fastest time to eat this number of mince pies is 1 min : 52.67 seconds.,general,3,3,13,21,5
1680,This country is the leader in beer consumption (per capita).,general,Czech Republic,USA,Czech Republic,Austria,Germany
1681,The largest burger weighed this much.,general,"6,040 pounds (2,740 kg)","6,878 pounds (3,120 kg)","1,111 pounds (504 kg)","6,040 pounds (2,740 kg)","18,388 pounds (8,341kg)"
1682,The largest gay and lesbian rights march took place in the capital of this country.,general,The US,The UK,Canada,France,The US
1683,This country has the highest income tax rate.,general,Denmark,Norway,Denmark,Sweden,The US
1684,This is the largest employer in the world.,general,Indian Railways,Walmart,United States Postal Service,Indian Railways,Microsoft
1685,This man is the highest earning fashion designer.,general,Armani,Armani,Versace,Chanel,Dior
1686,"China is the most populous nation in the world. India is second, and the USA is third. What is the fourth most populous nation in the world?",general,Indonesia,Russia,Japan,Indonesia,Pakistan
1687,What book did author Douglas Adams describe as the fourth book in the Hitchhiker trilogy?,general,"So Long, and Thanks For All the Fish","So Long, and Thanks For All the Fish",The Restaurant at the End of the Universe,"Life, the Universe and Everything",The Hitchhikers Guide to the Galaxy
1688,Who was the fourth US president?,general,James Madison,James Madison,James Monroe,John Quincy Adams,Thomas Jefferson
1689,What is referred to as the fourth dimension?,general,time,weight,length,time,height
1690,What is the fourth estate?,general,the press,the clergy,the nobles,the commoners,the press
1691,"What is referred to by the term fourth world (in contrast to the better-known terms first world, second world and third world?",general,disenfranchised societies,interplanetary societies,disenfranchised societies,undiscovered societies,global societies
1692,What is the fourth amendment to the US Constitution?,general,The right to not be subject to unreasonable searches and seizures,The right to not be subject to self incrimination,The right to not be subject to unreasonable searches and seizures,The right to bear arms,The right to not be subject to the quartering of soldiers
1693,What is the fourth largest nation in the world in area?,general,China,Brazil,USA,Australia,China
1694,"We all know that New York, Los Angeles and Chicago are the three largest cities in the USA. What is the fourth largest city in the USA, as measured by metropolitan area (SMSA) according to 2006 US Census Bureau estimates?",general,Dallas-Fort Worth,Miami,Houston,Philadelphia,Dallas-Fort Worth
