,question,category,answer,choices/0,choices/1,choices/2,choices/3
2457,"Between the 1920s and 1940s, the pink color was considered appropriate for this group of people, but later it became popular with others too.",general,Boys,Boys,Babies,Young women,High-class people
2458,The pink ribbon is associated with raising awareness for what disease?,general,Breast cancer,Skin cancer,Breast cancer,AIDS,Autism
2459,"In the French academic dress system, what academic field is symbolized by the redcurrant color -- an extremely red shade of pink?",general,Medicine,Theology,Law,Medicine,Arts
2460,What day of the week is associated with the pink color in Thailand?,general,Tuesday,Friday,Saturday,Monday,Tuesday
2461,"In what city a principal of an elementary school got a pink Mohawk haircut on 6 September 2007, as he had promised to do if the students raised the schoolâs Academic Performance Index by at least 55 points?",general,San Francisco,Manchester,San Francisco,Houston,Los Angeles
2462,"What type of books are called novela rosa, or pink novel, in Spain?",general,Sentimental novels,Crime novels,Sentimental novels,Erotic novels,Books for little children
2463,What is the real name of the American female artist known as Pink?,general,Alecia,Pamella,Alecia,Emily,Stacey
2464,In what country is a cake called Pink Panther very popular?,general,Spain,Canada,France,Spain,Switzerland
2465,When did a war start over a postage stamp?,general,1932,1833,1896,1932,1847
2467,Paul Erdos (pronounced Irr-dish) was a Hungarian mathematician with a very peculiar trait. What is it?,general,He has said that he prefers mathematics to sex.,"He memorized all the prime numbers from 2 through 5,986,771,223",He has said that he prefers mathematics to sex.,He is the only mathematician to have won an Oscar.,He is a self-taught mathematician - he wrote his Doctor thesis without ever taking a course in any college.
2468,Which of these statements is not correct?,general,The Smithsonian Institute is the longest building in the world.,The Smithsonian Institute is the longest building in the world.,All race horses are considered to have been born on January first.,"There is a list of unsolved math problems called the Milenium Problems. Anyone solving them is guaranteed $1,000,000 in prize money.","The same man who invented the toy The Transformers also invented the hole cam, the camera used to see the hole cards on TV poker shows."
2469,Who was the first American novelist  to be considered an imoportant writer by the Europeans?,general,John Quincy Adams,Washinton Irving,James Fennimore Cooper,Thomas  Howell,John Quincy Adams
2470,"What do these  people have in common: both Presidents Bush, actor James Spader, actor Jack Lemmon, actor Humphrey Bogart and writer Edgar Rice  Burroughs?",general,They all went to the same high school.,They all went to the same high school.,They all were in Texas on 9/11/2001.,They are the same Zodiac sign.,They were all born in the same month.
2471,What is the lowest point in Europe?,general,The Caspian Sea,The Caspian Sea,Comedy clubs  in Germany,Gabo de Roca,Gavdos
2472,Which college did William Shakespeare attend?,general,He did not go to college,He did not go to college,Cambridge,UCLA,Stanford
2473,What was Freddie Mercurys real name?,general,Farroukh Bulsara,Frederick Von Messner,Farroukh Bulsara,Fernando Mercurio,Fredricio de la Massino
2474,What is the term that denotes an airplane accident in which the plane is a total loss?,general,Hull loss incident,Burial incident,Decommission accident,Hull loss incident,Finishing accident
2475,"Otto Lilienthal, the first person to make repeated successful gliding flights, died after an airplane accident on 10 August 1896. What were the last words he uttered moments before he passed away?",general,Sacrifices must be made,Sacrifices must be made,"I am not dying in vain, I am dying in the name of progress",It was all worth it,I gave all I had
2476,US Army Lt. Thomas Selfridge was the first person killed in a powered fixed-wing aircraft. Where did the accident happen?,general,Virginia,France,Virginia,Colorado,Pennsylvania
2477,What is the most common reason for airplane incidents?,general,Human error,Human error,Overload,Equipment malfunction,Weather conditions
2478,"What was the main cause for Airline hull loss accidents from 1996 through 2005, according to a study by Boeing?",general,Flight crew error,Flight crew error,Bad weather,Air traffic control,Maintenance
2479,Which of these airplane disasters is considered the deadliest in history?,general,The destruction of the World Trade Center,The destruction of the World Trade Center,The Charkhi Dadri mid-air collision,The Tenerife disaster,The Hawaiian disaster
2480,"What was the reason for the Tenerife airplane disaster of March 27, 1977?",general,Two airplanes collided on the runway before takeoff,The airplane crashed into a hospital,Two airplanes collided on the runway before takeoff,The airplane exploded in midair,Two airplanes collided in midair
2481,"What was the reason for the 1996 Charkhi Dadri mid-air collision of two airplanes over Haryana, India?",general,One of the airplanes was flying at a lower altitude than permitted,There was a storm and visibility was poor,One of the airplanes was flying at a lower altitude than permitted,Both airplanes were experiencing technical problems before the collision,All of these
2482,"Where did the Turkish Airlines Flight 981 McDonnell Douglas DC-10 crash on On March 3, 1974?",general,Close to Paris,Close to Paris,Nearby Rome,Nearby London,Istanbul
2483,"What caused the Air India Flight 182 crash on June 23, 1985, when 329 people passed away?",general,Bomb explosion on board,Miscalculation of the altitude,One of the pilots had a heart attack,Engine malfunction,Bomb explosion on board
2484,Which of the following fears is not of a color?,general,Mageirocophobia,Leukophobia,Mageirocophobia,Xanthophobia,Porphyrophobia
2485,Potophobia is the abnormal fear of what?,general,alcohol,potatoes,alcohol,ibuprofen,church
2487,Selachophobia is the fear of this sea creature.,general,shark,octopus,fish,shark,crab
2488,Samhainophobia is the fear of this holiday.,general,Halloween,Valentines Day,Halloween,St. Patricks Day,Christmas
2489,What condition is characterized by fear of hurricanes?,general,Lilapsophobia,Chirophobia,Lilapsophobia,Pagophobia,Stenophobia
2491,Helminthophobia is the fear of what?,general,of being infested with worms,of scientific terminology,of not going to heaven,of seeing blood or bloody objects,of being infested with worms
2492,"6 am:  My alarm went off and my 4-year-old daughter jumped in bed with me, triggering my pedophobia. What was I afraid of?",general,Children,Loud noises,Children,Quick movements,Daylight
2493,"I ran into the bathroom and decided to brush my teeth. Upon looking up, I panicked due to my spectrophobia. What was I afraid of?",general,Mirrors,Pimples,Uncombed hair,Wearing no make-up,Mirrors
2494,"Upon hearing my screams, my husband stepped out of the shower to make sure I was alright, causing me recoil due to my gymnophobia. What was I afraid of?",general,Nudity,Men,Nudity,Getting wet,Water
2495,One of my companion animals entered the bathroom and brought about my ailurophobia. What was I afraid of?,general,Cats,Ferrets,Birds,Dogs,Cats
2496,"I ran from my bathroom into the kitchen where I decided to eat breakfast to calm my nerves. Unfortunately, my aichmophobia was provoked when I opened the silverware drawer. What was I afraid of?",general,Pointed objects,Spiders,Pointed objects,Rattling sounds,Crumbs
2497,"My husband came downstairs dressed for work, thus setting off my coulrophobia. What was I afraid of?",general,Clowns,Hair gel,Uniforms,Clowns,Ties
2498,I ran outside but stopped dead due to my anthophobia. What was I afraid of?,general,Flowers,Pollen,Paved roads,Neighbors,Flowers
2499,"I tried to run away, but I couldnt get far due to my agyrophobia. What was I afraid of?",general,Crossing roads,Getting a muscle cramp,Crossing roads,Grass,Driving
2500,"I decided to return home, but when I walked in the front door there was a party in progress and my choreophobia caused me to panic yet again. What was I afraid of?",general,Dancing,Balloons,Loud music,Dancing,Crowds
2501,"I ran to my room and my daughter brought me a bowl of vegetable soup, but I couldnt eat it due to my phagophobia. What was I afraid of?",general,Swallowing,Liquids,Swallowing,Hot objects,Celery
2502,"I went to my closet to get dressed for work, but this threw me into a panic due to my decidophobia. What was I afraid of?",general,Making decisions,Shoes,Making decisions,Clothing,Getting undressed
2503,I sat back down on my bed and looked around my room. This triggered my autophobia. What was I afraid of?,general,Being alone,Being late for work,Being alone,Dust,An unmade bed
2504,"I was trying to calm myself when my mind settled on my greatest fear, defined as taphopobia. I freaked out. What was I afraid of?",general,Being buried alive,Spiders,Being buried alive,Germs,Needles
2505,"Well, it was getting dark and I was worn out from the stress of the day, so I decided to get ready for bed. Sadly, this prompted a panic attack due to my ablutophobia. What was I afraid of?",general,Bathing,Going to sleep,The dark,Pajamas,Bathing
2506,"What happens to criminal Johnny Clay at the end of the 1956 movie The Killing, directed by Stanley Kubrick?",general,He is arrested.,He commits suicide.,He is arrested.,He gets killed.,He gets married.
2507,The plot of the 1968 Stanley Kubrick movie 2001: A Space Odyssey involves a space mission to which planet of the Solar system?,general,Jupiter,Jupiter,Pluto,Uranus,Mercury
2508,What celebrity couple starred in Stanley Kubricks 1999 neo-noir psychological thriller movie Eyes Wide Shut?,general,Tom Cruise and Nicole Kidman,Brad Pitt and Gwyneth Paltrow,Brad Pitt and Jennifer Aniston,Tom Cruise and Penelope Cruz,Tom Cruise and Nicole Kidman
2509,What actor played three different roles in Stanley Kubricks 1964 movie Dr. Strangelove or: How I Learned to Stop Worrying and Love the Bomb?,general,Peter Sellers,George C. Scott,Slim Pickens,Peter Sellers,Sterling Hayden
2510,What actor portrayed rebellious slave Spartacus in Stanley Kubricks 1960 historical movie Spartacus?,general,Kirk Douglas,Kirk Douglas,Laurence Olivier,Omar Sharif,Tony Curtis
2511,"What catchy tagline was used for the theatrical poster of the 1962 movie Lolita, directed by Stanley Kubrick?",general,How did they ever make a movie of Lolita?,How did they ever make a movie of Lolita?,What on earth were they thinking?,Most scandalous film of all time,She was only a child. Until...
2512,What type of movie is the 1987 Stanley Kubrick film Full Metal Jacket?,general,War movie,Sports movie,War movie,Horror movie,Comedy movie
2513,What movie directed by Stanley Kubrick was nominated for seven Academy Awards?,general,Barry Lyndon,Fear and Desire,2001: A Space Odyssey,Barry Lyndon,Spartacus
2514,What actor starred in Stanley Kubricks 1980 psychological horror movie The Shining?,general,Jack Nicholson,Dustin Hoffman,Jack Nicholson,Robert De Niro,Christopher Walken
2515,What is the last statement made by Alex at the end of the 1971 Stanley Kubrick movie A Clockwork Orange?,general,"I was cured, all right!","I was cured, all right!",Everything looks blurred...,Nothing on this planet is what it seems to be.,I see the tunnel clearly now.
2516,In which of these areas is stretching the neck with neck rings practiced?,general,Africa and Asia,Australia,North America,Africa and South America,Africa and Asia
2517,Which of these terms denotes an insertion of an object underneath the skin to create a raised design?,general,All of these,All of these,3-D implantation,Subdermal implantation,Pocketing
2518,"Which of these methods is used in tongue splitting, an example of extreme body modification?",general,All of these,Using a scalpel,Using a surgical laser,Tightening of a nylon bind around a tongue piercing,All of these
2519,Trepanation is a term that denotes making a hole in this part of the body.,general,Skull,Hand,Skull,Eyelid,Foot
2520,In what part of the body is the cosmetic procedure known as corneal tattooing done?,general,Eyeball,Inside of the lower lip,Genitals,Eyeball,Tongue
2521,"In which country was eyeball jewelry, or extraocular implantation, developed in 2002?",general,The Netherlands,The United Kingdom,The U.S.A.,India,The Netherlands
2522,In what geographic area is tooth filing practiced?,general,All of these,The Philippines,All of these,Africa,Indonesia
2523,"Which of these procedures is done as a form of ear shaping, which often results in a non-human appearance of the ear?",general,All of these,Pointing,All of these,Amputation,Cutting and cropping
2524,In which of these countries was foot binding practiced?,general,China,Vietnam,India,Peru,China
2525,"What type of body modification is the artificial cranial deformation, in which a part of the body is reshaped by applying force?",general,Deformation of the skull,Deformation of the fingers,Deformation of the skull,Deformation of the ribs,Deformation of the toes
2526,Which of these actors starred in the 2009 movie Angels  Demons?,general,Tom Hanks,Nicolas Cage,Tom Hanks,Robert De Niro,Dustin Hoffman
2527,Who wrote and performed the 1997 hit song Angels?,general,Robbie Williams,Sting,Robbie Williams,George Michael,Elton John
2528,What kind of plant is the Angelica?,general,Herb,Herb,Tree,Fern,Shrub
2529,Basketball has always been a physical sport. This player is a record breaker for the most personal fouls in one NBA season.,general,Darryl Dawkins,Darryl Dawkins,Moses Malone,Joe Dumars,Wilt  Chamberlin
2530,"In 1951, this city set a new record for the most fans at a basketball game.",general,Berlin,New York City,Melbourne,Berlin,Los Angeles
2531,Which is the largest active volcano on Earth?,general,Mauna Loa,Mount Rainier,Mount Etna,Mauna Loa,Merapi
2532,"In 2007, where was a new record for the biggest country flag set?",general,Israel,North Korea,Venezuela,Mexico,Israel
2533,Which was the first music album to sell at least 20 million units?,general,Led Zeppelin - Led Zeppelin IV,Led Zeppelin - Led Zeppelin IV,Pink Floyd - The Wall,Billy Joel - Greatest HitsVolumes I and II,AC/DC - Back in Black
2534,"In 2005, Danny Way became the first person to do this. In the process he attained a speed of over 50 mph. What did he do?",general,Skateboard over the Great Wall of China,Eject from an SST,Skateboard over the Great Wall of China,High dive from the Eiffel Tower,Shoot out of a submarine torpedo tube
2535,This was the largest active passenger airplane for 2007.,general,Airbus A380,Sukhoi 27,Boeing 757,Airbus A380,Boeing 747
2536,The Freedom of the Seas was the largest cruise ship for 2007. It is owned by Royal Caribbean. Which statement is NOT true about this ship?,general,It is about as tall as the CN Tower.,"It displaces about 160,000 tons.","It can carry 3,634 passengers.","It is about 1,112 feet (340 m) long by 184 feet (56 m) wide.",It is about as tall as the CN Tower.
2537,Sportsman Jerry DePoyster is a record breaker in this category.,general,Shortest punt in the NFL,Fastest 100 yard dash on roller skates,Longest field goal in an NBA game,Shortest punt in the NFL,Worst pass completion record in an NFL season
2538,The worlds largest swimming pool in 2007 was in this country.,general,Chile,Chile,Morocco,North Korea,Venezuela
2539,Who is the first performer/band to have at least 36 Billboard Top Ten albums?,general,The Rolling Stones,The Beatles,Elvis Presley,The Rolling Stones,Frank Sinatra
2540,In 1963 this soundtrack broke the record for the most weeks as the number one album on the Billboard charts.,general,West Side Story,The Body Guard,West Side Story,Saturday Night Fever,South Pacific
2541,Which of these performers/bands has had the number one and number two albums on the Billboard chart twice?,general,Guns n Roses,The Rolling Stones,Guns n Roses,Pink Floyd,Frank Sinatra
2542,Who was the first performer to have both the Billboard number one and number two album?,general,Bob Newhart,Willie Nelson,Frank Sinatra,Bob Newhart,Johnny Mathis
2543,This was the worldâs largest university for 2007 (considering total active enrollment.),general,Allama Iqbal Open University,Allama Iqbal Open University,The Ohio State University,Indira Gandhi National Open University,Islamic Azad University
2544,"This luxury U.S. car make was founded in 1902 from what had remained from the Henry Ford Company, and in 1909 it was bought by General Motors.",general,Cadillac,Hummer,Cadillac,Ford,Chevrolet
2545,The first passenger car of this Japanese car make was built in 1936. The brand also operates Lexus and Scion.,general,Toyota,Honda,Toyota,Nissan,Yamaha
2546,"In 1889, this French car brand produced its first automobile, a three-wheeled car powered by steam and designed by Leon Serpollet.",general,Peugeot,Renault,Bugatti,Peugeot,Citroen
2547,"This Italian car make, founded in 1963, has a bull on its emblem.",general,Lamborghini,Lamborghini,Ferrari,Maserati,Alfa Romeo
2548,"The founder of this German car brand produced the first petrol-powered motorcycle in the world, as well as the first gasoline-powered automobile.",general,Mercedes-Benz,BMW,Porsche,Mercedes-Benz,Opel
2549,"This British car make was founded under the name Swallow Sidecar Company in 1922, and is known for its elegant sports cars and luxury saloons.",general,Jaguar,Jaguar,Bentley,Rolls-Royce,Land Rover
2550,"This American car make was founded in 1911, and was purchased by General Motors in 1917.",general,Chevrolet,Hummer,Ford,Chevrolet,Cadillac
2551,"The slogan of this Japanese car make, founded on September 24, 1948, is The Power of Dreams.",general,Honda,Nissan,Suzuki,Honda,Yamaha
2552,"What German car make, founded in 1931, is famous for its high performance luxury automobiles?",general,Porsche,Volkswagen,Mercedes-Benz,BMW,Porsche
2553,"This Italian car brand was founded on June 24, 1910 in Milan. Its badge features a red cross and a serpent devouring a human.",general,Alfa Romeo,Lancia,Fiat,Ferrari,Alfa Romeo
2554,Where did the first reported attacks of the legendary blood-sucking creature called Chupacabra occur?,general,Puerto Rico,Puerto Rico,Brazil,"Texas, USA",Nicaragua
2555,"In February 2004, In Romania the relatives of a dead man called Toma Petre were terrified of the thought that he had become a vampire. What did they do?",general,They exhumed his corpse.,They exhumed his corpse.,They hired a priest to keep an eye on his grave at night.,All of these,They planted garlic on his grave and all around the graveyard.
2556,"What cruel punishment did Vlad III, Prince of Wallachia, who inspired Bram Stokers 1897 novel Dracula, like to impose?",general,Impalement,Skinning alive,Impalement,Burning alive,Blood draining
2557,A popular method of finding a vampires grave involved this animal that would supposedly balk at the grave.,general,Horse,Horse,Chicken,Black cat,Wolf
2558,Which of these plants was believed to scare off vampires and keep them at bay?,general,Wild rose,Hyacinth,Wild rose,Dandelion,Parsley
2559,In 2006 a female corpse dating from the 16th century was found near Venice. According to archaeologists the presence of this object in the corpses mouth was the result of a vampire-slaying ritual.,general,A brick,An animal bones,A glass piece,A crucifix,A brick
2560,"The African vampiric creature, known as Adze, was believed to take the form of this animal in order to hunt children.",general,Firefly,Lizard,Firefly,Snake,Bat
2561,"According to Slavic belief, what type of death caused the soul to become unclean and potentially transformed a corpse into a vampire?",general,All of these,Early death,Violent death,Death of an unbaptized person,All of these
2562,"Which of these diseases has been connected with vampires, as some of the symptoms were interpreted as vampirism?",general,Rabies,Plague,Epilepsy,Rabies,Neurosis
2563,"Which of these serial murderers was nicknamed The Vampire of Sacramento, as he drank the blood and ate the remains of his victims?",general,Richard Chase,Joseph Paul Franklin,Joe Ball,Richard Chase,Jeffrey Dahmer
2564,Name the famous (infamous?) philosopher who posited the concept of The Superman(Der Ubermensch).,general,Nietzche,Marx,Kant,Hegel,Nietzche
2565,Name the young actor who starred in 2006s Civic Duty and whose nicknames include Superman and Dodi.,general,Khaled Abol Naga,Peter Krause,Khaled Abol Naga,Richard Schiff,Ian Tracy
2566,"This concept was popularized in Dostoevskys Notes from the Underground, Pushkins Eugene Onegin and in many of the works of Turgenev.",general,The Superfluous Man,The Super-Tribe,The Superfluous Man,The Total Man,The Super Race
2567,Who played Clark Kent/Superman in the 1948 Superman movie?,general,Kirk Alyn,Jack Larsen,George Reeves,Christopher Reeves,Kirk Alyn
2568,What does C.W. Ettingers book Man into Superman deal with?,general,Cryogenics,Putting computers into humans,Cryogenics,Transplanting animal organs into humans,Transplanting human organs
2569,Which of the following starred in the movie Superfly?,general,Ron ONeal,Ron ONeal,Louis Gossett,Richard Roundtree,Levar Burton
2570,What phobia means fear of making decisions?,general,Decidophobia,Deipnophobia,Defecaloesiophobia,Dementophobia,Decidophobia
2571,What phobia is referred as fear of houses?,general,Domatophobia,Dishabiliophobia,Dysmorphophobia,Domatophobia,Doraphobia
2572,What term means fear of skin diseases?,general,Dermatosiophobia,Dextrophobia,Dermatosiophobia,Dermatophobia,Dentophobia
2574,What does demophobia mean?,general,Fear of crowds,Fear of insanity,Fear of crowds,Fear of demons,Fear of trees
2576,What is the word for fear of horses?,general,Equinophobia,Equinophobia,Ereuthrophobia,Eremophobia,Epistemophobia
2577,This phobia is known as the fear of criticism.,general,Enosiophobia,Ephebiphobia,Entomophobia,Enosiophobia,Eosophobia
2579,What is known as the fear of electricity?,general,Electrophobia,Eleutherophobia,Electrophobia,Emetophobia,Enetophobia
2580,"What do  the male name Thomas and its derivatives Tom, Thom, Tomas, Tomm all mean?",general,Twin,Brave,Doubt,Soldier,Twin
2581,"What is the meaning of the names Paul, Paula, Paulina, Pablo, Paulo, Paolo?",general,"Small, humble","Small, humble","Sacred, hallowed",Gtreat,"Stubborn, obstinate"
2582,"What do the names Matthew, Mathew, Matt and Mat mean?",general,Gift of God,Preacher,God is merciful,Holy star,Gift of God
2584,"What is the meaning of the female names Anastasia, Anastacia, Stacy, Nastassja, Nastia?",general,Resurrection,Martyr,Angelic,Resurrection,River
2585,"The names Robert, Robbie, Rob, Robin, Robyn, Roberto, Bert, refer to what?",general,Bright fame,Long way,Honorable master,Mighty warrior,Bright fame
2586,"What is the meaning of the names Emily, Emma, Amelie, Amelia, Em, Emmie?",general,Rival,Spice,Sympathy,Justice,Rival
2587,"What do the names Henry, Harry, Harrison, Hal, Hank, Enrique mean?",general,Home ruler,Home ruler,Victorious warrior,Active in battle,Abundant land
2588,"What is the origin of the popular feminine names Susanna, Susan, Sue, Suzie, Sanna?",general,Persian,Greek,Persian,Hebrew,Old Germanic
2589,"What is the meaning of the popular names Joseph, Josephine, Jose, Josef, Joe, Joey?",general,The Lord will add.,The Lord is merciful.,The Lord will add.,The Lord is with us.,The Lord loves us.
2590,Which set of numbers is most significant to baseball?,general,"3,4,9","3,4,9","1,83,26","9,13,26","1,7,17"
2591,Which year is most significant to Napoleon Bonaparte?,general,1800 AD,1700 AD,1600 AD,1800 AD,2525 AD
2594,"This U.S. general, born in Little Rock Arkansas, fought in 3 major wars (World War I, World War II, Korean War) and was one of the few men ever to rise to the rank of General of the Army.",general,Douglas MacArthur,Omar Bradley,Dwight Eisenhower,Colin Powell,Douglas MacArthur
2596,"This General, born in Wynnewood Oklahoma, was the U.S. general leading the attack on the Taliban in Afghanistan in response to the September 11th 2001 attacks on the World Trade Center and The Pentagon.",general,Tommy Franks,Matthew Ridgeway,Donald Rumsfeld,Tommy Franks,Colin Powell
2597,"This famous general is considered to be one of the most gifted tactical commanders in United States history. He excelled at the First Battle of Bull Run (where he received his famous nickname), Antietam, and Fredericksburg. Who is he?",general,Thomas Jonathon Jackson,Robert E Lee,Ulysses S. Grant,Tommy Richardson,Thomas Jonathon Jackson
2598,Which general born in New York in 1954 was elected the 10th Commander of the U.S. Central Command?,general,David Petraeus,George Patton,Lloyd Wright,Wesley Clark,David Petraeus
2599,What was the cause of the Malaysia Airlines Flight 653 crash on 4 December 1977?,general,Hijacking,Storm,All of these,Engine malfunction,Hijacking
2600,"What caused the tragedy with the Saudia Flight 163 on August 19, 1980?",general,Fire,The pilot fell asleep.,Fog,A bird,Fire
2601,"Which of these statements is true about the Pan Am Flight 759 disaster that happened on July 9, 1982?",general,All of these,All of these,153 people were killed.,There was only one survivor.,It was flying from Miami to Las Vegas.
2602,Where did the South African Airways Flight 295 crash on 28 November 1987?,general,Indian ocean,Madagascar,Mediterranean sea,Indian ocean,Morocco
2603,What was the cause of one of the deadliest airplane disasters in history that happened on 26 April 1994 with China Airlines Flight 140?,general,Pilot error,Overload,Fire,Pilot error,All of these
2604,"What did the American Airlines Flight 965 crash into on December 20, 1995 in Colombia?",general,Mountain,Another plane,Mountain,Village,Skyscraper
2605,"In which of these New York City neighborhoods did the American Airlines Flight 587 crash on November 12, 2001?",general,Queens,Queens,The Bronx,Brooklyn,Manhattan
