,question,category,answer,choices/0,choices/1,choices/2,choices/3
2153,The world of Narnia created by C.S. Lewis contained the land of Narnia and several others. Which of the following is not in the land of Narnia?,newest,Terebinthia,Cair Paravel,Chippingford,Beaversdam,Terebinthia
2154,"This English novelist created the European Soviet satellite state of Slaka for his novel Rates of Exchange, and even published a mock guidebook to its culture: Why Come to Slaka?.",newest,Malcolm Bradbury,Malcolm Bradbury,David Lodge,Tom Sharpe,Kingsley Amis
2155,"Which British writer wrote the novel  The Island of Sheep, which is partly set on a thinly disguised version of the Faroe Islands?",newest,John Buchan,Erskine Childers,John Buchan,Somerset Maugham,Dornford Yates
2156,This 20th century author wrote of the northern lands of Thule and Zembla in works such as Solus Rex and Pale Fire.,newest,Vladimir Nabokov,Italo Calvino,Umberto Eco,Vladimir Nabokov,Jorge Luis Borges
2157,In what country was Twiggy born?,newest,England,the USA,Scotland,England,Australia
2158,What is Twiggys birth name?,newest,Lesley Hornby,Helen Lydia Hornby,Lesley Hornby,Twiggy Lawson,None of these
2159,Name the hairdresser who became Twiggys manager at the beginning of her modelling career.,newest,Justin de Villeneuve,Justin de Villeneuve,Jean Louis David,None of these,Eugene Perma
2161,In which of these movies did Twiggy not appear?,newest,E.T. the Extra-Terrestrial (1982),E.T. the Extra-Terrestrial (1982),The Blues Brothers (1980),Body Bags (1993),The Little Match Girl (1986)
2162,Which of these models was Twiggys greatest influence?,newest,Jean Shrimpton,Inès de la Fressange,Cheryl Tiegs,Jean Shrimpton,Wilhelmina
2164,Twiggy appeared in this comedy starring Robin Williams.,newest,Club Paradise,Sun Child,Club Paradise,Edge of Seventeen,Mrs. Doubtfire
2166,In which 1990s TV series did Twiggy appear?,newest,Princesses,Twiggy,The Muppet Show,Princesses,Victorian Scandals
2167,This Wild Wild West villain was a dwarf.,newest,Dr. Miguelito Loveless,Ernst Stavro Blofeld,Emilio Largo,Dr. Miguelito Loveless,Professor Moriarty
2168,How did Jim West and Artemus Gordon travel around the country on the TV show The Wild Wild West?,newest,Private Train,Model T,Private Train,Horseback,Steamboat
2169,Who played Jim West was on the TV show The Wild Wild West?,newest,Robert Conrad,Cary Grant,Robert Conrad,Peter Graves,Kevin Kline
2170,"Who portrayed Jim West partner, Artemus Gordon on The Wild Wild West?",newest,Ross Martin,Ross Martin,William Schaller,"Alan Hale, Jr.",Charles Aidman
2171,Where did Jim West carry his derringer on the TV show The Wild Wild West?,newest,up his sleeve,up his sleeve,in his shoe,in his hat,behind his belt buckle
2175,Why was the show The Wild Wild West cancelled?,newest,CBS canceled the show because of the violence.,They ran out of stories,CBS canceled the show because of the violence.,Robert Conrad got tired of the show.,The show wasnt as good without Ross Martin.
2177,What famous wild west character did Audie Murphy portray more than once?,newest,Jesse James,Billy the Kid,Wild bill Hickok,Buffalo Bill,Jesse James
2180,"Besides being a war hero and movie star, Audie Murphy had what other career?",newest,Country music songwriter,Silver mine owner,Country music songwriter,Washington Lobbyist,Choreographer
2182,In which of these movies did Audie Murphy star with Jimmy Stewart?,newest,Night Passage,Destry,Night Passage,The Duel at Silver Creek,The Kid from Texas
2183,Where was James Stewart born?,newest,"Indiana, Pennsylvania","Los Angeles, California","Iowa city, Iowa","Pittsburgh, Indiana","Indiana, Pennsylvania"
2184,"What James Stewart classic has Doris Day singing (Que Sera, Sera), Whatever Will Be, Will Be?",newest,The Man Who Knew Too Much,The Man Who Knew Too Much,Rope,Rear Window,Vertigo
2185,What was the last movie in which James Stewart starred with John Wayne?,newest,The Shootist,The Shootist,Bandolero!,Rooster Cogburn,Brannigan
2186,In what season of the show Rescue Me did Lou write poetry?,newest,1,3,4,1,2
2188,What is Tommys favorite sport in the TV series Rescue Me?,newest,Ice Hockey,Basketball,Baseball,Ice Hockey,Football
2191,Why do the guys from the firehouse recruit Black Sean?,newest,To play basketball for the firehouse,To play basketball for the firehouse,He was a friend of Mike and Sean.,He was first in his academy class.,Tommy told them to.
2193,Which firefighter did Laura date on the show Rescue Me?,newest,Franco,Tommy,Sean,Lou,Franco
2194,Where does Tommys dad die in the TV series Rescue Me?,newest,At a minor league baseball game,At a minor league baseball game,At Uncle Teddys house,At the fire house,At his home
2195,In what season of Rescue Me does the fire house get shut down?,newest,6,2,5,3,6
2196,"In the Abbott  Costello Whos on first, what is the only position without a name?",newest,Right field,Right field,Center field,Catcher,Pitcher
2197,"Which of these is an Abbott  Costello comedy horror movie, directed by Charles Barton and released in 1949?",newest,"Abbott and Costello Meet the Killer, Boris Karloff","Abbott and Costello Meet the Killer, Boris Karloff",Abbott  Costello Meet Frankenstein,Abbott  Costello Meet Dr. Jekyll  Mr. Hyde,Abbott and Costello in the Foreign Legion
2199,What was Tony Curtis birth name?,newest,Bernard Schwartz,Tony Adverse,Tony Curtis,Albert DeSalvo,Bernard Schwartz
2200,Which armed service did Tony Curtis join during World War II?,newest,Navy,Army,Coast Guard,Air force,Navy
2201,What film featured Tony Curtis and Jack Lemmon dressed as women?,newest,Some Like It Hot,Sweet Smell of Success,Some Like It Hot,Who Was That Lady,Monte Carlo or Bust
2202,"In Some Like It Hot when Tony Curtis assumed the disguise of the Millionaire, he did an impersonation of what actor?",newest,Cary Grant,Cary Grant,James Stewart,Gregory Peck,Paul Newman
2203,Tony Curtis appeared in over 100 films from 1948-2009. How many Academy Awards did he win during this period?,newest,0,5,0,2,4
2204,"What is the name of the beach movie that starred Tony Curtis along with Claudia Cardinale and
Sharon Tate?",newest,Dont Make Waves,Sex and the Single Girl,The Great Race,Dont Make Waves,Who Was That Lady
2205,"This film starred Tony Curtis, Kirk Douglas, Janet Leigh and Ernest Borgnine as Ragnar.",newest,The Vikings,Forbidden,The Vikings,Trapeze,Spartacus
2206,In what circus film did Tony Curtis and Burt Lancaster star together?,newest,Trapeze,Houdini,Trapeze,Ringling Brothers Circus,Double Take
2210,Actor Sidney Toler took over the role of Charlie Chan after Warner Olands death. What was Tolers nationality?,newest,American,American,Canadian,Swedish,British
2213,What statement about Abraham is true?,newest,All of these,He is considered a founding father in the Islamic tradition.,All of these,He is considered a founding father in the Christion tradition.,He is considered a founding fataher in the Jewish tradition.
2214,Which of the following is a traditional Christian belief?,newest,All of these,Jesus performed miracles,Jesus founded the Church,All of these,Jesus was born of a virgin.
2215,Name the spiritual teacher from ancient India who founded Buddhism.,newest,Siddhārtha Gautama,Abhay Charanaravinda,Muhammad,Laozi,Siddhārtha Gautama
2216,"Where was Muhammad, the founder of Islam, born?",newest,Mecca,Mecca,None of these,Medina,Nazareth
2217,Which of the following is a philosopher of ancient China and a central figure in Taoism?,newest,Laozi,Wang Chong,Huan Tan,Jing Fang,Laozi
2218,Confucius was a thinker and social philosopher from this country.,newest,China,China,Israel,Ancient Greece,Japan
2219,"What nationality was Zoroaster (Zarathushtra), the founder of the Zoroastrian religion?",newest,Iranian,Chinese,Greek,Iranian,Indian
2222,Who was the founder of Sikhism?,newest,Nanak Dev,Har Krishan,Nanak Dev,Gobind Singh,Amar Das
2223,Memorial Day was first enacted to honor soldiers who died in what war?,newest,The Civil War,The Civil War,World War I,The Spanish-American War,The Revolutionary War
2224,What was the original name of the US federal holiday known as Memorial Day?,newest,Decoration Day,Soldiers Day,Decoration Day,Remembrance Day,Veterans Day
2225,"At the beginning of this 1998 epic war movie, an elderly World War II veteran and his family visit the Normandy American Cemetery and Memorial in France.",newest,Saving Private Ryan,When Trumpets Fade,Schindlers List,Saving Private Ryan,Pearl Harbour
2226,Arlington National Cemetery was established during the American Civil War on the grounds of the estate which once belonged to Mary Anna Custis family. Whose wife was Mary Anna Custis?,newest,Robert E. Lees,Robert E. Lees,Jefferson Davis,Ulysses S. Grants,George Washingtons
2227,What village was designated as the official birthplace of Memorial Day by President Lyndon B. Johnson?,newest,"Waterloo, New York","Waterloo, New York","Columbus, Mississippi","Sharpsburg, Maryland","Charleston, South Carolina"
2228,In Arlington National Cemetery there is a small memorial which commemorates the veterans of the Secret War. Which war conflict does the term Secret War refer to?,newest,The Laotian Civil War,The Laotian Civil War,The Cold War,The Boer War,The Vietnam War
2229,At what time does the National Moment of Remembrance take place on Memorial Day?,newest,3 p.m,3 p.m,None of these,2 p.m.,4. p.m
2230,What notable memorial war poem was written by Canadian poet and physician Lieutenant Colonel John McCrae?,newest,In Flanders Fields,We Shall Keep the Faith,I Stand Before You,Freedom is not free,In Flanders Fields
2231,"Known as the Poppy Lady, this U.S. professor and humanitarian conceived the idea of wearing poppies as a symbol of remembrance for those who served in World War I.",newest,Moina Michael,Julia Ward Howe,Betsy Ross,Ethel Lynn Beers,Moina Michael
2232,"Franklin Sousley, Harlon Block, and Michael Strank, who were immortalized in an iconic photo by Joe Rosenthal, were killed during what WWII battle?",newest,Battle of Iwo Jima,The Battle of Okinawa,The Battle of Stalingrad,The Battle of Moscow,Battle of Iwo Jima
2233,What US President presided over the entombment of the Unknown Soldier of World War II and the Unknown Soldier of the Korean War?,newest,Dwight D. Eisenhower,Harry S. Truman,John F. Kennedy,Lyndon B. Johnson,Dwight D. Eisenhower
2234,What was the occupation of Nora Fontaine Davidson who is regarded as the inspiration for the US Memorial Day?,newest,schoolteacher,schoolteacher,singer,nurse,poet
2235,"What statement is true about General John Logan, national commander of the Grand Army of the Republic?",newest,He issued a proclamation that Decoration Day be observed nationwide.,He issued a proclamation that Decoration Day be observed nationwide.,He wrote the poem In Flanders Fields.,"He introduced measures to return Memorial Day to its traditional date, 30 May.","He refused to celebrate Decoration Day, due to lingering hostility towards the Confederate Army."
2236,"What Union general is credited with composing the bugle call Taps, which is sounded on Memorial Day?",newest,Daniel Butterfield,Fitz John Porter,Ulysses S. Grant,Philip Kearny,Daniel Butterfield
2237,"What automobile race is held annually over the Memorial Day weekend, starting in 1911?",newest,Indianapolis 500,Indianapolis 500,Sprint Cup,Daytona 500,None of these
2238,Which of these was not an alias Fletch used in the film Fletch Lives?,newest,J.R. Ewing,Elmer-Fudd Gantry,J.R. Ewing,Henry Himler,Billy-Jean King
2239,"In the movie Fletch Lives, on the flight to Louisiana what Disney film does Fletch dream about?",newest,Song of the South,Dumbo,Herbie the Love Bug,Bambi,Song of the South
2240,"In the comedy movie Fletch Lives, when Fletch visits Bly Bio Chem, he tells the supervisor that he goes through how many suits in a day?",newest,5,6,5,3,4
2241,What is the name of the fictional pest control company in the movie Fletch Lives?,newest,Bug Busters,ABC Pest Control,Bug Away,Bug Busters,Pest Be Gone
2242,Which Law and Order SVU star appeared in Fletch Lives?,newest,Richard Belzer,Richard Belzer,Mariska Hargity,D.B. Wong,Christopher Meloni
2243,What city was Bly Bio Chem located in in the movie Fletch Lives?,newest,"Yazoo City, Mississippi",New Orleans,"Vicksburg, Mississippi","Yazoo City, Mississippi","Sherveport, Louisiana"
2244,What is the name of the plantation Fletch inherits in the movie Fletch Lives?,newest,Belle Isle,Belle Isle,South Fork,Wayne Mannor,Southern Hill
2245,What is the name of the woman on the flight with Fletch in the movie Fletch Lives?,newest,Cindy Mae Sample,Cindy Thompson,Sally May Johnson,Cindy Mae Sample,Kelly Boyd
2246,"In the film Fletch Lives, where did the woman on the flight with Fletch say she was going?",newest,Selma,Houston,New Orleans,Dallas,Selma
2247,What city in Louisiana was Fletch going to in the comedy movie Fletch Lives?,newest,Thibodaux,Golden Meadow,Houma,Avery Island,Thibodaux
2248,"For many years, in a series of films, Basil Rathbone played what was probably the best known Sherlock Holmes. Who played his friend and companion Dr Watson?",newest,Nigel Bruce,Hubert Willis,Nigel Bruce,Andre Morel,Nigel Stock
2249,"In the comedy Without a Clue, we had a Dr Watson who was the brains of the partnership and a Sherlock Holmes who was a bumbling idiot. Sir Ben Kingsley played Watson. Who played Holmes?",newest,Sir Michael Caine,Jonathan Pryce,Sir Michael Caine,John Cleese,Sir Patrick Stewart
2252,In which film did Christopher Plummer play Holmes?,newest,Murder by Decree,Murder by Decree,The Seven-Per-Cent Solution,A Study in Terror,The Hound of the Baskervilles
2253,Which couple has not appeared on-screen as Holmes and Watson?,newest,Peter OToole and Donald Houston,Vasily Livanov and Vitaly Solomin,Peter OToole and Donald Houston,Robert Stephens and Colin Blakely,Nicol Williamson and Robert Duvall
2254,Which of the following played Sherlock Holmes on film several times?,newest,Mack Sennet,Harold Lloyd,Mack Sennet,Buster Keaton,Roscoe Fatty Arbuckle
2255,Who was awarded the Order of the British Empire for his portrayal of Sherlock Holmes?,newest,Vasily Livanov,Basil Rathbone,Clive Merrison,Vasily Livanov,Jeremy Brett
2256,Where did Sherlock Holmes live in London?,newest,221B Baker Street,221 Baker Street,21 Baker Street,221B Baker Street,21B Baker Street
2257,What was the name of Sherlock Holmes elder brother?,newest,Mycroft,Porlock,Mycroft,Porcroft,Moriarty
2258,In which of Conan Doyles stories does Sherlock Holmes first meet Dr Watson?,newest,A Study in Scarlet,A Study in Scarlet,The Hound of the Baskervilles,A Scandal in Bohemia,The Sign of the Four
2259,Sherlock Holmes once refers to a story for which the world is not yet prepared and which was never the subject of a Conan Doyle tale. What did the mysterious story concern?,newest,The Giant Rat of Sumatra,The Sussex Vampire,The Voice of Terror,The Giant Rat of Sumatra,The Scarlet Claw
2260,"How many times in the complete Sherlock Holmes stories by Conan Doyle does Holmes use the phrase Elementary, my dear Watson.?",newest,never,3 or more times,never,once,twice
2262,Where is the gemstone found in the Sherlock Holmes story The Adventure of the Blue Carbuncle?,newest,Inside a Christmas goose,Inside a plaster bust of Napoleon,"It is never found, having been thrown into the Thames.","In a cardboard box, tied up with tarry string",Inside a Christmas goose
2263,"What pattern of bullet holes did Sherlock Holmes create on the interior wall of his lodgings, apparently just for pistol shooting practice?",newest,VR (for Victoria Regina),4,VR (for Victoria Regina),IA (for Irene Adler),Small figures resembling dancing men
2264,"At home, where did Sherlock Holmes keep his smoking tobacco?",newest,In the toe of a Persian slipper,In the coal scuttle,In an engraved silver tobacco tin,In his violin case,In the toe of a Persian slipper
2265,When were the first Barbie dolls released?,newest,1959,1962,1959,1966,1960
2266,Which of these Barbie dolls debuted in 1971?,newest,Malibu Barbie,Malibu Barbie,Silkstone Barbie,Holiday Barbie,Vintage Barbie
2267,"When was an 18 Supersize Barbie, with a Superstar face, first made?",newest,1978,1980,1967,1969,1978
2268,What was the name of the Mattel fashion designer who created Barbies clothes?,newest,Charlotte Johnson,Charlotte Johnson,Bob Mackie,Kelly Smith,Byron Lars
2269,What is the first name of Ruth Handlers daughter?,newest,Barbara,Kelly,Barbie,Mary,Barbara
2272,"Who wrote the Southern Gothic novel Absalom, Absalom!?",newest,William Faulkner,William Faulkner,Ernest Hemingway,Harriet Beecher Stowe,Booth Tarkington
2273,Which of these plays were written by Arthur Miller?,newest,The Crucible and Death of a Salesman,Strange Interlude and Desire Under the Elms,The Night of the Iguana and The Rose Tattoo,The Skin of our Teeth and Our Town,The Crucible and Death of a Salesman
2274,What statement about James Thurber and Dorothy Parker is true?,newest,They were humorists.,They were humorists.,They were communists.,They were playwrights.,They were poets.
2275,Who wrote the modernist poem The Waste Land?,newest,T.S. Eliot,Robert Frost,Carl Sandburg,George Eliot,T.S. Eliot
2276,Ernest Hemingways writing style is characterized by which of the following?,newest,understatement and terseness,biting wit and sarcasm,flowing imagery,sentimentality,understatement and terseness
2282,"I am in a dark room. I have a candle, a wood stove, a gas lamp and a match to light, which all can drive away darkness. What to light first?",newest,The match,The candle,The wood stove,The gas lamp,The match
2284,What secret organization did U.N.C.L.E. battle on the TV show The Man from U.N.C.L.E.?,newest,THRUSH,THRUSH,KAOS,SPECTRE,GALAXY
2286,Where was the secret entrance to the New York offices of U.N.C.L.E. on the TV show The Man from U.N.C.L.E.?,newest,A tailor shop,In times square,A phone booth,A tailor shop,A park fountain
2288,"On The Man from U.N.C.L.E., when at the headquarters all agents had to wear badges. What number was Illya Kuryakins badge?",newest,2,10,2,11,7
2289,What country was Illya Kuryakin from on the TV show The Man from U.N.C.L.E.?,newest,Russia,Austria,Russia,Mongolia,Poland
2290,Every episode of The Man from U.N.C.L.E. had this word in its title.,newest,Affair,Big,Party,The,Affair
2291,What chess piece was on Paladins calling card?,newest,Knight,Queen,Knight,Bishop,Rook
2292,In what city did fictional character Paladin live?,newest,San Francisco,Denver,Kansas City,Dodge City,San Francisco
2293,What was the name of Paladins favorite bellhop at the hotel?,newest,Hey Boy,Kam Fong,Hey Boy,Chin Ho,Hey You
2295,How much did Paladin typically charge for his services?,newest,"$1,000",Different for each case,$100 a day,"$1,000",$500 + expenses
2296,Where did Paladin get his education?,newest,West Point,Harvard,Oxford,West Point,School of Hard Knocks
2297,What did Paladin carry in his boot when he was traveling?,newest,Fine cigars,Derringer,Extra cash,Fine cigars,Bowie knife
2298,"When visiting India, what did Paladin do that made the natives respect him?",newest,killed a man-eating tiger,killed a man-eating tiger,took his shoes off when he entered the Taj Mahal,saved the life of the princess,saved the life of a native
2300,"What on earth could dance, and live and die?
Without legs, or lungs, or being alive?",newest,Fire,Water,Wind,Fire,Darkness
2301,Whats as big as the biggest camel and weighs nothing at all?,newest,shadow,wind,shadow,water,air
2302,What kind of camel can jump higher than a tree?,newest,any kind of camel,no camel,a leaping camel,a frog camel,any kind of camel
2303,"Golden treasure am I, guarded by hundreds and thousands of armed guards. I am stored in a labyrinth where no man can walk, yet men often come to steal my gold. What am I?",newest,honey,none of these,golden jewelery,honey,gold
2304,"They do not have feathers, or flesh, or scale, or bone. Yet they have fingers and thumbs of their own. What are they?",newest,gloves,polar bear,gloves,eel,boxing
2305,"Gleaming and glittering down I thrust a sparkling spear, I never rust. What am I?",newest,icicle,spear,stalagmite,icicle,horn
2306,"Each morning I appear
To lie at your feet,
All day I follow you
No matter how fast you run,
Yet I nearly die
In the midday sun.
What am I?",newest,Your shadow,Your shadow,A doppelganger,An apparition,Someone Elses shadow
2307,"Im one of five, and Im not alive.
The one who sent me forth became king,
the one who got me died.
What am I?",newest,A stone,A rock,A banana,A boulder,A stone
2308,"I am related to the water but I am not wet.
I am related to a shadow but I am multicolored.
I create an illusion but show what is real. What am I?",newest,a mirror,gold,a mirror,a bed,shiny things
2309,"I have eight to spare, in case I lose my one.
Im not a number.
What am I?",newest,a cat,a cat,one,nine,a dog
2310,In what year was Gene Kelly born?,newest,1912,1914,1912,1916,1910
2311,Who was Gene Kellys co-star in The Pirate?,newest,Judy Garland,Ginger Rodgers,Betty Grable,Frank Sinatra,Judy Garland
2312,What musical film directed by Gene Kelly starred Barbra Streisand?,newest,"Hello, Dolly",Funny Girl,"Hello, Dolly",Funny Lady,Guys and Dolls
2313,What country awarded Gene Kelly the Legion of Honor in 1960?,newest,France,Great Britain,Canada,France,USA
2317,"In the Webkinz Kinzstyle outlet, what is PJs real name?",newest,Pollie Jean Collie,Penny Jean Collie,None of these,Polly Jane Collie,Pollie Jean Collie
2318,What Kinztunes track starts out: Life on the farm is a life for me. Im a happy piggy with a piggly family...?,newest,Piggy Plum Pie,Just Another Extraordinary Pig,Misunderstood,A Piggy Holiday,Piggy Plum Pie
2320,Webkinz World came up with a new room theme for which event?,newest,2010 FIFA World Cup,The 2008 Olympics,2010 FIFA World Cup,The arrival of Kinztunes,The arrival of Zums
2321,What is the name of the newspaper in Webkinz World?,newest,The Kinzville Times,The Webkinz World Gazette,Webkinz News,None of these,The Kinzville Times
2323,The Webkinz signature raccoon comes with what item along with the big city window?,newest,Limo,None of these,Fallen log raccoon tunnel,Pampered paws bathtub,Limo
2324,"In Webkinz World, what is the Red Squirrels favorite food?",newest,Peppermint pinecone,Tree bark truffles,Fluffy tail fajitas,Peppermint pinecone,Nut casserole
2325,Who is the cheerful brown dog at Webkinz Stadium?,newest,Fred Rover,Fido Friendly,None of these,Frank Spaniel,Fred Rover
2326,Which animal is pictured on the front of all Webkinz adoption tags?,newest,A cocker spaniel,A gorilla,A bluffadoodle,A beagle,A cocker spaniel
2327,The tiger is the national animal of which of the following countries?,newest,India,India,Moscow,Israel,Sri Lanka
2328,What did the Tungusic people of Siberia and northern China call the Siberian Tiger?,newest,Both of these,Old Man,None of these,Both of these,Grandfather
2329,What is a group of tigers called?,newest,Streak,Sawt,Pride,Streak,Leap
2334,What is tigers lifespan in the wild?,newest,10-15 years,over 30 years,20-30 years,5-10 years,10-15 years
2338,How old was fictional character Nancy Drew when her mother died?,newest,Three years old,Five years old,Seven years old,Her mother died during childbirth,Three years old
2339,What is the profession of Nancy Drews aunt Eloise in New York in the popular book series?,newest,Teacher,Theater Actress,Teacher,Librarian,Detective
2340,"Nancy Drews tall, handsome boyfriend is quite the athlete. In addition to being a football star, Ned Nickerson also plays on the varsity teams of what other two sports at Emerson College?",newest,Baseball and basketball,Basketball and track  field,Baseball and basketball,Baseball and rowing,Track  field and rowing
2341,Nancy Drews boyfriend Ned Nickerson is a member of which fraternity at Emerson College?,newest,Omega Chi Epsilon,Omega Chi Epsilon,Delta Tau Chi,Tau Kappa Epsilon,Sigma Chi
2342,What is the name of the river than runs through Nancy Drews fictional hometown?,newest,Muskoka River,Muskoka River,Mulberry River,Merrimack River,Mississippi River
2343,What is the name of Nancy Drews pet terrier?,newest,Togo,Snowball,Buster,Togo,Max
2344,What color is Nancy Drews convertible?,newest,Blue,Silver,Red,White,Blue
2345,What are the names of Bess Marvins and George Faynes boyfriends in the Nancy Drew stories?,newest,Dave and Burt,They do not have boyfriends.,Dave and Burt,Curt and Dave,Robert and David
2346,Nancy Drew often used aliases when solving mysteries. Which of the following is NOT an alias that was used by Nancy?,newest,Anna Martin,Debbie Lynbrook,Anna Martin,Dru Gruen,Irene Insbruck
2347,Which of the following is NOT a villain in one of the Nancy Drew Mystery Stories?,newest,Dick Milton,Bushy Trott,Nathan Gomber,Dick Milton,Stumpy Dowd
2348,Who is the director of the 2007 movie Redline?,newest,Andy Cheng,George Lucas,Mel Gibson,Peter Jackson,Andy Cheng
2349,What make and model of car was impounded by the police in the movie Redline?,newest,Ford GT,Ford GT,Rolls-Royce Phantom,Lamborghini Diablo,Mercedes-Benz McLaren SLR
2350,Which of these cars does not appear in the film Redline?,newest,Bugatti Veyron,Koenigsegg CCX,Bugatti Veyron,Ferrari Enzo,Porsche Carrera GT
2351,In what car does Jason pick up Carlo from the bus station in the movie Redline?,newest,Ferrari F430 Spider,Shelby Cobra,Lamborghini Murcielago Roadster,Lamborghini Gallardo Spider,Ferrari F430 Spider
2352,What car was wrecked accidentally by a cast member of the movie Redline?,newest,Ferrari Enzo,Saleen S7,Koenigsegg CCX,Lamborghini Murcielago,Ferrari Enzo
2353,Which car wins the final race in the movie Redline?,newest,Saleen S7,Saleen S7,Mercedes-Benz McLaren SLR,Ferrari Enzo,Porsche Carrera GT
2354,What is Nat short for in Nats Garage as seen in the movie Redline?,newest,Natasha,Natasha,Natalie,Nathaniel,Nate
