,question,category,answer,choices/0,choices/1,choices/2,choices/3
0,In how many provinces is the Dominican Republic divided?,newest,31,31,21,None of these,11
1,"#10 on the list of highest-grossing films is this Disney animated feature film, which came out in 1937 and earned $1,746,100,000.",newest,Snow White and the Seven Dwarfs,Fantasia 2000,101 Dalmatians,The Three Caballeros,Snow White and the Seven Dwarfs
2,"# 9 on the list of highest-grossing films is this 1975 film that earned $1,945,100,000 and scared the pants off most of the audience. In fact, people swimming in the ocean dropped that year.",newest,Jaws,Jaws 2,Jaws 3-D,Jaws,Great White
3,"#8 on the list of highest-grossing films is a 1965 film about the Russian Revolution in 1917-1918 and grossed $1,988,600,000.",newest,Doctor Zhivago,Reds,October: Ten Days That Shook the World,Doctor Zhivago,Anastasia
4,"#7 on the list of highest-grossing films was this 1956 religious film starring Charlton Heston. It grossed $2,098,600,000.",newest,The Ten Commandments,Samson and Delilah,The Ten Commandments,The Prince of Egypt,Ben-Hur
5,"#6 on the list of highest-grossing films is a 1982 sci-fi movie by Steven Spielberg, which grossed $2,216,800,000.",newest,E.T. the Extra-Terrestrial,E.T. the Extra-Terrestrial,Blade Runner,The Thing,Star Trek II: The Wrath of Khan
6,"#5 on the list of highest-grossing films is a musical which takes place in Austria. It was made in 1965 and grossed $2,269,800,000. Sing the scales for me on a hill top.",newest,The Sound of Music,Help!,The Great Race,The Sound of Music,Beach Blanket Bingo
7,"#4 on the list of highest-grossing films is based on a real event. It was made in 1997 and grossed $2,413,800,000. It will leave your heart sinking in the end but Im sure it will go on.",newest,Titanic,The Poseidon Adventure,The Hunt for Red October,Titanic,The Abyss
8,"#3 on the list of highest-grossing films is this 1977 sci-fi movie thats had so many sequels and prequels, Ive lost count. It grossed $2,710,800,000.",newest,Star Wars,The Incredible Hulk,Star Wars,The Island of Dr. Moreau,Close Encounters of the Third Kind
9,"#2 on the list of highest-grossing films is the only one from the 21st century. It features weird colorful figures. It grossed $2,782,300,000.",newest,Avatar,The Twilight Saga: Breaking Dawn Part I,Avatar,"Harry Potter and the Deathly Hallows, Part II",Transformers: Dark of the Moon
10,"#1 on the list of highest-grossing films is about the American South. It grossed $3,301,400,000.",newest,Gone With the Wind,Ben-Hur,Gone With the Wind,Cleopatra,All Quiet on the Western Front
11,This 1973 horror film was the second of many devilish movies.,newest,The Exorcist,The Omen,The Exorcist,Rosemarys Baby,The Exorcism of Emily Rose
12,"What movie title was translated in Mexico as title Grow, Run and Stumble?",newest,Juno,Rachel Getting Married,Juno,Four Friends,All or Nothing
13,In Spain this movie title was translated as Pigs And Diamonds.,newest,Snatch,Donnie Brasco,Snatch,Unforgiven,Marathon Man
14,To the Devil with the Devil is the Mexican title of this movie.,newest,Bedazzled,Ghost Busters,Dogma,The Witches of Eastwick,Bedazzled
15,What movie title was translated in Mexico as Dumb But Not That Dumb?,newest,Billy Madison,Besieged,Billy Madison,The Butterfly Effect,The Station Agent
16,What movie title was translated in Italy as Four Bastards for a Room in Hell?,newest,Shark!,The Order,Horror,Hellboy,Shark!
17,No Rules in Love is the Italian title of this movie.,newest,Leatherheads,Offside,Dear Frankie,The Blind Side,Leatherheads
18,The Secret Is In the Sauce is the French title of this movie.,newest,Fried Green Tomatoes,Waitress,Fried Green Tomatoes,Paul Blart: Mall Cop,Cure
19,The Teeth From the Sea is the French title of this movie.,newest,Jaws,Jaws,Shark in Venice,The Reef,Open Water
20,This war movie is titled Voyage to the End of Hell in France.,newest,The Deer Hunter,Sealed Cargo,The Deer Hunter,Voyage of the Damned,A Tale of Five Cities
21,What movie was titled Sexy Dance in France?,newest,Step Up,Delhi Belly,Step Up,Billy Elliot,Biloxi Blues
22,A Supertough Kangaroo is the Spanish title of this movie.,newest,The Pacifier,Chocolat,Mogambo,The Pacifier,Crocodile Dundee
23,Breaking the Ice is the Spanish title of this movie.,newest,Happy Feet,The Incredibles,Happy Feet,The Last Airbender,The Golden Compass
24,Airport Attack is the Portuguese title of this movie.,newest,Die Hard 2,Snakes on a Plane,Heat,Delta Force 2,Die Hard 2
25,What movie title was translated i Portugal as A Very Crazy Dead Man?,newest,Weekend at Bernies,Weekend at Bernies,Kiss Kiss Bang Bang,Shaun of the Dead,Waking Ned
26,The 8th Passenger is Death is the Hungarian title of this movie.,newest,Alien,Alien,The Sky Dragon,Broken Flowers,Taxi Driver
28,How many votes from the College of Cardinals does it take to declare a new Pope?,newest,Two thirds of the votes plus one,Half of the votes plus one,Two thirds of the votes,Half of the votes,Two thirds of the votes plus one
29,What was the longest interregnum between popes?,newest,Two years and 9 months,14 months,8 months,Two years and 9 months,Five years and 2 months
33,Urban VII set a record for the shortest papacy. How many days was he in office?,newest,12 days,184 days,33 days,102 days,12 days
34,"If you were elected pope, what would your chances of becoming a saint be?",newest,1 out of 3,1 out of 10,1 out of 3,1 out of 6,1 out of 4
35,Why do popes wear white?,newest,It was a fashion trend in 1566 brought on by the newly elected Pope Pius V.,It was a fashion trend in 1566 brought on by the newly elected Pope Pius V.,It symbolizes pure light.,It is easy to recognize him in a crowd.,It signifies that the pope will not get dirty.
36,Who was the first pope to change his name?,newest,"Pope John II, formerly Mercury","Pope Innocent XIII, formerly Michaelangelo","Pope Pius III, formerly Francesco","Pope Sylvester II, formerly Gerbert","Pope John II, formerly Mercury"
37,"I made a pun in springtime. (Next sentence, please)",newest,It was a May zing.,It was really winter,It was a May zing.,It was amazing.,It was stupid
38,Magician’s assistants are _______________.,newest,highly sawed after,insurance deficient,highly sought after,highly sawed after,dumb to say the least
39,"I dated a politician over the holidays but when I wrapped myself up as a present, he couldnt __________________.",newest,cut through the red tape,understand what he was supposed to do since his aides were on vacation,get a committee organized to suggest a solution,tear himself away from his cell phone,cut through the red tape
40,I missed my miniature Indian musical instrument practice last night. I couldnt find a ___________.,newest,baby sitar,taxi,small enough violin,baby sitar,baby sitter
41,Two coin collectors got together for _______________.,newest,old dimes sake,old times sake,old dimes sake,quarter of an hour,pennies from heaven
42,When I found out that the fire department was charging $75.00 per table for their craft fair I told them _________________.,newest,they could go to blazes,that it seemed steep to me,they could stick it where the sun dont shine,they could go to Hades,they could go to blazes
43,"I try wearing tight jeans, but I can __________________.",newest,never pull it off,gain weight while they are on my body.,never pull it off,never relate to fashion,not stand anything that sticks out
44,I think Santa has riverfront property in Brazil. All our presents came from ____________.,newest,Amazon this year,Deep in the Jungle,Ipanina,Amazon this year,Rio de Janeiro
45,"If I tell you I’m afraid of apple orchards, will you tell me to ______________?",newest,grow a pear,grow a pair,grow avocados,grow a pear,quit while your a  head
46,If you step onto a plane and recognize a friend of yours named Jack dont yell out ______!,newest,Hi Jack,Hi Jack,"Jack, whats in your backpack",Man you look heavier than ever,"On, no"
47,"When asked by a passenger how high he would get, the pilot replied,",newest,I dont do drugs.,Higher than the highest mountain,Whats it to you?,higher than the ground,I dont do drugs.
48,"The airlines have become so cash-strapped, they charged me for ___________.",newest,my emotional baggage,looking like a nuisance,being overweight,my emotional baggage,my hat
49,Dont expect to eat something fancy when youre flying ___________________.,newest,because its plane food,because its plane food,unless you bring your own food,unless youre a good tipper,because its plain food
50,If you get sick at the airport it could be a _____________.,newest,terminal illness,disaster for the folks around you,sign of a fatal disease,real upsetting experience,terminal illness
51,Traveling on a flying carpet is a ______________.,newest,rugged experience,rugged experience,tuff experience,blast but dont lean over,fairy tale of course
52,During his air test a young pilot flew through a rainbow. (Next sentence please),newest,He passed with flying colors.,"He thought he was in heaven, lost control of his plane and crashed.","Guess what, he found the pot of gold.",We never saw him again.,He passed with flying colors.
53,One of the first things youll notice at the Beijing airport is __________________.,newest,a whole lot of Chinese checkers,a strange looking man in a clown suit pointing you to McDonalds,no lines because they are prohibited by law,a whole lot of Chinese checkers,a big sign that says	歡迎  (welcome in Chinese traditional) or    欢迎 (in Chinese simplified)
54,An astronaut broke the law of gravity and got ______________ .,newest,a suspended sentence,a suspended sentence,hung up in the air,some floating debris up his nose,strung up by his toes
55,The little green men told me it was the Dog Star. I told them ______________ .,newest,they cant be Sirius,they cant be Sirius,not one more martini,it sure as hell looks like a cat from here,they cant be serious
56,Did you hear about the pilot who always had work? (Next sentence please),newest,He was great at landing a job.,He was great at landing a job.,His arrival always caused a stir.,He never asked for any pay.,He was always stoned and flying high.
57,An astronaut who fails on a weightlessness experiment must be ______________.,newest,aware of the gravity of the situation,hospitalized immediately with broken bones,counselled about the enormity of his problems,drawn and quartered,aware of the gravity of the situation
58,The cost of the space program is____________ .,newest,astronomical,astronomical,through the ceiling,astrophysical,cosmological
59,"If the Taiwanese director doesn’t win an Oscar, hell ________________.",newest,be one Ang Lee fellow,never direct another film,really be angry,be one Ang Lee fellow,probably move to Detroit
60,"When I learned what the gun lobby was doing, I ___________ !",newest,went ballistic,hitched up my holster,left the lobby,shot my dog,went ballistic
61,I once knew a guy who had fish and chips every day for a year. (Please add the next sentence).,newest,His stomach took a battering.,He died of scurvy.,His stomach took a battering.,His face looked like a fish and he had a chip on his shoulder.,He smelled of garlic for the next 5 years.
62,"When the Pirates of the Caribbean ordered my death, my mind went _________. I knew I was in _____  ______.",newest,plank - Depp ship,plank - Depp ship,blank - deep dodo,blank - Depp ship,plank - deep dodo
63,The painter was hospitalized due to ______________.,newest,too many strokes,too many strokes,too many toxic fumes,extreme wall staring,a big splashing mistake
64,"Its raining cats and dogs. Well, as long as it doesnt __________________.",newest,reindeer,reindeer,snow,get my suit wet,break my umbrella
65,"She wanted the large estate quite badly but, she dared not ___________________.",newest,mansion it to her frugal husband,mansion it to her frugal husband,mention it to her lover,mansion it to her lover,mention it to her frugal husband
66,"Since I went to work in the plumbing department of the home center, I have developed a _______________.",newest,multi-fauceted personality disorder,multi-faceted personality disorder,stinking personality,complete dislike for toilets,multi-fauceted personality disorder
67,Any country that obeys seat belt laws is an object of my _____________.,newest,fasten nation,fasten nation,fascination,strapping body,choosing planes
68,"Its not that the man did not know how to juggle, he just didnt have ______________.",newest,the balls to do it,the proper equipment,the balls to do it,enough bowling pins,the courage to face an audience
69,"During the first Academy Awards, Warner Brothers got an Honorary Award for The Jazz Singer. What individual got an Honorary Award as well?",newest,Charlie Chaplin,Charlie Chaplin,Mary Pickford,Buster Keaton,Emil Jannings
70,At the 1st Academy Awards ceremony this film was nominated for the most Academy Awards (5) and won only three.,newest,Seventh Heaven,Wings,Seventh Heaven,The Last Command,Sunrise: A Song of Two Humans
71,During this Academy Award ceremony no movie won more than one Oscar.,newest,2nd,2nd,1st,4th,3rd
72,What is the first film to win the Best Director Oscar without being nominated for Best Picture?,newest,The Divine Lady,The Patriot,The Divine Lady,The Divorcee,The Big House
73,What is NOT true about the 2nd Academy Awards?,newest,"Elliot Clawson was nominated for Best Writing of 3 pictures – The Cop,The Leatherneck, Sal of Singapore.",The number of categories was reduced from twelve to seven.,It was the only occasion where there were no official nominees.,"Elliot Clawson was nominated for Best Writing of 3 pictures – The Cop,The Leatherneck, Sal of Singapore.",It was the first ceremony for which the winners were not announced in advance.
74,This category was introduced during the 3rd Academy Awards and was the first new one since the awards began.,newest,Best Sound Recording,Best Assistant Director,Best Sound Recording,Best Engineering Effects,Best Live Action Short Film
75,This picture was the first western to win the Academy Award for Best Picture.,newest,Cimarron,Cimarron,In Old Arizona,The Noose,The Virginian
76,Who was the first child star to receive a Best Actor/Actress nomination?,newest,Jackie Cooper,Jackie Coogan,Shirley Temple,Mickey Rooney,Jackie Cooper
77,"What is the first film to be nominated only for the Best Picture Oscar, which it won?",newest,Grand Hotel,The Front Page,Grand Hotel,The Champ,Dr. Jekyll and Mr. Hyde
78,The 5th Academy Awards saw the introduction of 3 new categories. What was NOT one of them?,newest,"Best Live Action Short Film, Color","Best Live Action Short Film, Color","Best Live Action Short Film, Novelty","Best Live Action Short Film, Comedy",Best Animated Short Film
79,These were the first two movies to receive both Best Actor Oscar and Best Actress Oscar nominations.,newest,Cimarron; A Free Soul,Bulldog Drummond ; The Divorcee,Cimarron; A Free Soul,Shanghai Express; Bad Girl,The Patriot; The Divine Lady
80,What does the word Argo refer to in Ben Afflecks dramatic thriller Argo?,newest,a fake movie production,a secret society,a dangerous drug,a team of CIA operatives,a fake movie production
81,"In the Oscar-winning movie Life of Pi, Pi was named by his father after which of the following?",newest,a swimming pool in France,a traditional Indian dish,the mathematical symbol π,a river in India,a swimming pool in France
82,On what period of Abraham Lincolns life does Steven Spielbergs 2012 movie Lincoln focus?,newest,the final four months of his life,the final four months of his life,the first years of his presidency,his presidential nomination and campaign,his early years
83,"Jennifer Lawrence, who won the Academy Award for Best Actress for her role in Silver Linings Playbook, achieved international recognition as the heroine Katniss Everdeen in this movie.",newest,The Hunger Games,Avatar,Twilight,Black Swan,The Hunger Games
84,The 2012 Academy Award-winning musical drama Les Misérables was based on a novel by this French author.,newest,Victor Hugo,Honoré de Balzac,Stendhal,Alexandre Dumas,Victor Hugo
85,In what country is the computer-animated fantasy film Brave set?,newest,Scotland,Iceland,Germany,Scotland,the USA
86,Who performed the song Skyfall which won the Academy Award for Best Original Song at the 85th Academy Awards?,newest,Adele,Adele,Michael Bublé,Kelly Clarkson,Rihanna
87,Which of these Acacemy Award-winning movies is NOT correctly matched with its director?,newest,Django Unchained - Joe Wright,Silver Linings Playbook - David O. Russell,Life of Pi - Ang Lee,Django Unchained - Joe Wright,Lincoln - Steven Spielberg
88,What actress portrays Anna Karenina in the self-titled 2012 romantic drama film?,newest,Keira Knightley,Anne Hathaway,Natalie Portman,Keira Knightley,Jennifer Lawrence
89,"This drama film, starring Jean-Louis Trintignant, Emmanuelle Riva and Isabelle Huppert, won the Best Foreign Language Oscar at the 85th Academy Awards.",newest,Amour,Amour,A Royal Affair,Kon-Tiki,Monsieur Lazhar
90,Which movie title was translated as Held by Wind in Montana in Japan?,newest,Horse Whisperer,Horse Whisperer,The Winds of Autumn,Man from Gods Country,Badlands
91,What movie title was translated in Japan as I Love My Dad The Best In The World?,newest,Jersey Girl,Jersey Girl,Jack Everyman,My Year Without Sex,Before Sunset
92,I’m Drunk and You’re a Prostitute is the Japanese title of this movie.,newest,Leaving Las Vegas,The Libertine,The Lost Weekend,Barfly,Leaving Las Vegas
93,"In the Philippines, they pull no punches with the title Because She’s Ugly. What is the original title of the movie?",newest,Never Been Kissed,Ben  Arthur,Never Been Kissed,Bloodeaters,Elephant Man
94,What movie title was translated as Rain of Falafel in Israel?,newest,Cloudy with a Chance of Meatballs,He Died with a Felafel in His Hand,Inception,Priest,Cloudy with a Chance of Meatballs
95,The title of what movie was translated as Love in the Skies in Israel?,newest,Top Gun,Forgetting Sarah Marshall,Top Gun,Father Goose,Passenger
96,What movie title was translated as Super Horny in Israel and Superguys Who Play Hooky in Portugal?,newest,Superbad,Q,Superbad,Hysteria,Drive Thru
97,What movie title was translated as The Spy Who Behaved Very Nicely Around Me in Malaysia?,newest,Austin Powers: The Spy Who Shagged Me,From Russia with Love,Our Man Flint,Johnny English,Austin Powers: The Spy Who Shagged Me
98,What film was called Super Speeding Cleaning Evil Accounts in Thailand?,newest,Drive Angry,The Ninth Gate,Night of the Demon,Evil Ambitions,Drive Angry
99,Hum Tum is the Bollywood version of this Hollywood film.,newest,When Harry Met Sally...,Sunshine State,When Harry Met Sally...,High Society,Separate Tables
100,The Sunny Classroom is the Japanese title of this American movie.,newest,Mr. Holland’s Opus,Music of the Heart,Nowhere Boy,Mr. Holland’s Opus,Music Within
101,I got a small ticket for speeding.  __________________.,newest,Its fine with me.,Its fine with me.,I dont pay them anyways.,big deal,I put up a big fuss.
102,"There are pigs that sound like horses, in _______________.",newest,my neigh-boar hood,my house using the toilet,my garden snouting around,my neighbor hood,my neigh-boar hood
103,Some mathematicians are reluctant to _________________.,newest,cosine a loan,cosine a loan,count their change,speak in tongues,cosign a loan
104,Every calendars days are ___________.,newest,numbered,numbered,reminders of the next day,on a calendar,printed
105,A cartoonist was found dead in his home. (Next sentence please),newest,Details are sketchy.,A crayon was the weapon of choice.,The police want to know what happens at the end of the current cartoon.,He should have been working in an office.,Details are sketchy.
106,I fed some lemon to my cat and now I have a __________.,newest,sour puss,yen for limes,problem with sour fruit,cat with allergies,sour puss
107,Santas helpers are ________________.,newest,subordinate clauses,subordinate clauses,his reindeer,little strange looking elves,useless after a New Years Eve party
108,Did you see the movie about the hot dog?,newest,It was an Oscar Wiener.,It was a tasty treat.,It was an Oscar Wiener.,It was an Oscar Winner.,It was too long.
109,What’s a real estate lawyer’s least favourite song?,newest,Lien On Me,Lean On Me,Take the Money and Run,Will Your Lawyer Talk to God For You?,Lien On Me
110,"“If there are no stupid questions, then what kind of questions do stupid people ask? Do they get smart just in time to ask questions?” Which comic book creator created this witty remark?",newest,Scott Adams,Will Eisner,Frank Miller,Scott Adams,Brian Bolland
111,"“If you simplify your English, you are freed from the worst follies of orthodoxy. You cannot speak any of the necessary dialects, and when you make a stupid remark its stupidity will be obvious, even to yourself.” Which novelist said this?",newest,George Orwell,F. Scott Fitzgerald,George Orwell,Evelyn Waugh,Graham Greene
112,"Which bozo made both of these quotes: “If youre going to get mad at me everytime I do something stupid then I guess Ill have to stop doing stupid things!” and Stupid, eh? Yeah, Im stupid. Stupid like a fox!”.?",newest,Homer Simpson from The Simpsons,Peter Griffin from Family Guy,Woody Boyd from Cheers,Joey Tribbiani from Friends,Homer Simpson from The Simpsons
113,"“Creating a cultural icon out of someone who goes, Im stupid, isnt it cute? makes me want to throw daggers. I want to say to them, My grandma did not fight for what she fought for just so you can start telling women its fun to be stupid. Saying that to young women, little girls, my daughter? Its not OK.” Which actress owns this one?",newest,Reese Witherspoon,Jessica Simpson,Paris Hilton,Reese Witherspoon,Megan Fox
114,“Beware your inner idiot. Success and stupidity dont mix. Your bosss stupidity is only half the problem. Your own stupidity can easily complete the disaster.” Which government official said this?,newest,J. Edgar Hoover (Director of the FBI),Norman Thomas (US Socialist Presidential Candidate),Winston Churchill (Prime Minister of Britain),Clarence Thomas (Supreme Court Justice),J. Edgar Hoover (Director of the FBI)
115,“I refuse to slap some stupid words on the stupid paper just so we have a stupid song finished.” Which singer/songwriter came up with the triple stupid?,newest,Suzanne Vega,Nelly Furtado,Amy Winehouse,Suzanne Vega,Missy Elliott
116,"Which comedian do you think came up with these remarks: “Just think of how stupid the average person is, and then realize half of them are even stupider!” and “Think of how stupid the average person is, and realize half of them are stupider than that.”.",newest,George Carlin,Jeff Foxworthy,Jay Leno,George Carlin,Don Rickles
117,"What philosopher said “Men are born ignorant, not stupid. They are made stupid by education.”?",newest,Bertrand Russell,Henry David Thoreau,Bertrand Russell,John Stuart Mill,Noam Chomsky
118,"Who said, “Some people think having large breasts makes a woman stupid. Actually, its quite the opposite: A woman having large breasts makes men stupid.”?",newest,Rita Rudner,Rosie ODonnell,Rita Rudner,Queen Latifah,Bette Midler
119,"“I have many regrets, and Im sure everyone does. The stupid things you do, you regret… if you have any sense, and if you dont regret them, maybe youre stupid.” is a quote from this famous actress.",newest,Katharine Hepburn,Joanne Woodward,Audrey Hepburn,Bette Davis,Katharine Hepburn
120,"“Conservatives are not necessarily stupid, but most stupid people are conservatives.” What political economist made this unflattering comment?",newest,John Stuart Mill,Donald L. Horowitz,Henry Kissinger,John Stuart Mill,Niccolò Machiavelli
121,"This famous actress uttered the words: “If I play a stupid girl, and ask a stupid question, Ive got to follow it through. What am I supposed to do, look intelligent?”",newest,Marilyn Monroe,Ursula Andress,Marilyn Monroe,Raquel Welch,Bo Derek
122,"The Unbelievable Trip In A Wacky Aeroplane or The Incredible Journey In A Crazy Airplane are the German titles of this movie. In Australia, New Zealand, South Africa, Japan and the Philippines it is known as Flying High.",newest,Airplane!,Away We Go,Get Shorty,Up,Airplane!
123,My Partner With the Cold Snout is the German title of this movie.,newest,K-9,Ace of Hearts,K-9,Top Dog,Beverly Hills Chihuahua
124,This movie title is translated into German as Floppy Coppers Don’t Bite or Yellow Coppers Don’t Bite.,newest,Dragnet,Dragnet,Starsky  Hutch,Wasabi,Osmosis Jones
125,This movie is known as Die Slowly in Germany  and as Skyscraper Attack in Portugal.,newest,Die Hard,Die Hard,Die Hard 2,Die Hard: With a Vengeance,Die Hard Dracula
126,"This movie is titled Die Slowly, Now More Than Ever in Germany and Die Hard: Mega Hard in Denmark its titled. However, in Spain it is known as Crystal Jungle.",newest,Die Hard: With A Vengeance,Die Hard Dracula,Die Hard: With A Vengeance,Die Hard 4.0,Die Hard 2
127,I Think I’m Kicked by a Horse is the German title of this movie.,newest,Animal House,Under the Western Sun,Animal House,Son of Paleface,Cat Ballou
128,Play me the Song of Death is a title inspired by a line from this movie.,newest,Once Upon a Time in the West,The Mark of Zorro,Liberty Heights,Once Upon a Time in the West,The Alamo
129,The Year 2022. Those Who Want to Survive is the German title of this movie.,newest,Soylent Green,Dawn of the Dead,Avatar,Soylent Green,Alien
130,A Pope to Kiss is the German title of this movie.,newest,The Pope Must Die,Gone with the Pope,The Shoes of the Fisherman,Luther,The Pope Must Die
131,The title of what sci-fi movie was translated in Germany as Alarm in Space.,newest,Forbidden Planet,Alien,Galaxy Quest,Apollo 13,Forbidden Planet
132,Final Call – When He Hangs Up She Has to Die is the German title of this movie.,newest,Cellular,Dial M For Murder,Cellular,Phone Booth,The Crazies
