,question,category,answer,choices/0,choices/1,choices/2,choices/3
618,What year was Tombstone released?,rated,1993,1994,1993,1997,1991
619,Who stars as the county sheriff John Behan in the Tombstone western movie?,rated,Jon Tenney,Jon Tenney,Harry Carey Jr,Tomas Arana,Stephan Lang
621,"In the western Tombstone, who said It would appear that the strain was more than he could bear.?",rated,Doc,Wyatt,Jonny Ringo,Curley Bill,Doc
623,"In Tombstone, who was leader of the Cowboys?",rated,Curly Bill Brocious,Frank Stillwell,Curly Bill Brocious,Johnny Ringo,Ike Clanton
624,In which of these states is Slippery Rock University located?,rated,Pennsylvania,California,Kentucky,Tennessee,Pennsylvania
625,What state is Gonzaga University in?,rated,Washington,Arkansas,Delaware,New York,Washington
626,The Old Dominion University Monarchs are from which state?,rated,Virginia,West Virginia,Georgia,Virginia,South Carolina
628,Name the state in which Murray State University is located.,rated,Kentucky,Wisconsin,California,Kentucky,Ohio
629,Tulane University is in which of the following states?,rated,Louisiana,New Mexico,Louisiana,Nevada,Colorado
630,In which of these states is Austin Peay State University located?,rated,Tennessee,Illinois,Tennessee,Oregon,Indiana
631,Morehead State University is in the city of Morehead that is located in which state?,rated,Kentucky,Florida,Ohio,Alabama,Kentucky
632,Which of these states is the location of Marshall University?,rated,West Virginia,West Virginia,South Dakota,Hawaii,Arizona
633,"St. Bonaventure University, founded in 1858, is located in Cattaraugus County. Which state is it in?",rated,New York,Florida,Pennsylvania,New York,Idaho
634,What does the prefix tachy- mean?,rated,too fast,too slow,too soft,too fast,too loud
635,The suffix -itis refers to what condition?,rated,inflammation,bleeding,deficiency,enlargement,inflammation
636,The doctor says you need a CBC. What is he talking about?,rated,A blood test,A vacation,A medication,A blood test,An enema
637,The doctor writes a prescription with instructions to take the medication PRN. What does PRN mean?,rated,As needed,By mouth,Immediately,As needed,Every other day
638,"In preparation for a blood test, the lab slip says you have to be NPO for 8 hours prior to the test. What do you have to do?",rated,Do not take anything by mouth,Lie flat in bed for 8 hours,Exercise for 8 hours,Sleep for 8 hours,Do not take anything by mouth
639,"During a physical exam, the doctor says he wants to auscultate your heart. What instrument will he use?",rated,Stethoscope,Scalpel,Forceps,Stethoscope,Blood pressure monitor
640,"To palpate your thyroid gland, what part of your body will the doctor touch?",rated,Neck,Lower abdomen,Upper arm,Neck,Lower back
641,Where are the Islets of Langerhans?,rated,in the pancreas,in the pancreas,in Denmark,in the brain,in the liver
642,"If the doctor writes NSR on your electrocardiogram, what can you expect him to tell you?",rated,That everything is fine,That youll need open heart surgery,That the reading isnt accurate and the test should be repeated,That youll have to take medication for your heart,That everything is fine
643,"After checking your blood pressure, the doctor says the diastolic pressure is elevated. To which number is he referring?",rated,The bottom number,The difference between the numbers,Both numbers together,The top number,The bottom number
644,What year did Green Acres first air on television?,rated,1965,1966,1967,1965,1964
647,"On the show Green Acres, what was the name of the pig adopted by Fred and Doris Ziffel?",rated,Arnold,Willie,Wilber,Arnold,Agnes
649,Where did the phone company install the Douglases phone in the series Green Acres?,rated,On top of the telephone pole,In the bathroom,On top of the telephone pole,On the front porch,On the back porch
651,Which character on Green Acres was played by Alvy Moore?,rated,Hank Kimball,Fred Ziffel,Eb Dawson,Hank Kimball,Sam Drucker
652,"What was the last name of Eustace Charleton, the wacky character on Green Acres?",rated,Haney,Dawson,Monroe,Ziffel,Haney
653,How do you say I feel hot in Spanish?,rated,Tengo calor.,Tengo frio.,Tengo ocho anos.,Tengo calor.,Tengo resfriado.
654,How do you ask What is your name? in Spanish?,rated,Come se llama usted?,Come se llama usted?,Quien me llama a mi?,Que tienes?,Cuantos anos tiene usted?
655,Which if the following translates as We are going to the store in Spanish?,rated,Vamos a la tienda.,Vamos al cine.,Vamos a la bibiloteca.,Vamos a la tienda.,Vamos a la playa.
656,How do you say fire-fighter in Spanish?,rated,Bombero,Enfermero,Florista,Poeta,Bombero
657,What is the Spanish equivalent of apple?,rated,Manzana,Arroz,Apio,Manzana,Uva
658,How do you say Im lost in Spanish?,rated,Estoy perdido.,Estoy perdido.,Estoy listo.,Estoy en la cocina.,Estoy cansado.
659,What is the word for grandmother in Spanish?,rated,Abuela,Hermana,Sobrina,Abuela,Prima
660,How do you say to the right in Spanish?,rated,A la derecha,A la derecha,A la iglesia,A la una,A la izquierda
661,Which of these sentences translates as The trees are green. in Spanish?,rated,Los arboles son verdes.,Los gatos son blancos.,Los arboles son verdes.,Las casas son azules.,Los perros son negros.
663,When was Clint Eastwood born?,rated,"May 31, 1930","May 31, 1931","May 30, 1931","May 31, 1930","May 30, 1930"
665,"Clint Eastwood was drafted into the US Army in 1951 and stationed at Ft. Ord, CA. What duty did he perform while there?",rated,swimming instructor,swimming instructor,"None, he broke his arm within the first week and was medically discharged",heavy engine mechanic,folding and stuffing parachutes
666,Eastwood portrayed the man with no name in a trilogy of spaghetti westerns.  Which of these is NOT one of those films.,rated,High Plains Drifter,"The Good, The Bad, and The Ugly",A Fistful of Dollars,High Plains Drifter,For A Few Dollars More
667,In what movie is Eastwoods character on the run from bounty hunters and Union soldiers?,rated,The Outlaw Josey Wales,High Plains Drifter,Pale Rider,The Beguiled,The Outlaw Josey Wales
668,How many movies were made featuring the character Dirty Harry during the 70s and 80s?,rated,5,3,6,4,5
669,For which two movies has Clint Eastwood been given the Academy Award for Best Director?,rated,Unforgiven  Million Dollar Baby,Unforgiven  Million Dollar Baby,Mystic River  Midnight in the Garden of Good  Evil,Unforgiven  Mystic River,Mystic River  Million Dollar Baby
670,Which Academy Award-winning film actor married Madonna in 1985 and divorced her in 1989?,rated,Sean Penn,Sean Penn,Mickey Rourke,Bruce Willis,Guy Ritchie
671,"Which American actor, known for his passion for basketball and the LA Lakers in particular, appeared in One Flew Over the Cuckoos Nest as Randle Patrick McMurphy?",rated,Jack Nicholson,Gene Hackman,Dustin Hoffman,Jack Nicholson,Matthew Perry
672,"This actress, best known for her roles in Legally Blonde and Walk the Line, got engaged to Ryan Phillippe in 1998, and co-starred with him in the 1999 hit movie Cruel Intentions.",rated,Reese Witherspoon,None of these,Sarah Michelle Gellar,Selma Blair,Reese Witherspoon
673,Which of the Baldwin brothers was married to Kim Basinger from 1993 to 2002?,rated,Alec,William,Alec,Daniel,Stephen
674,"Which Hollywood actress won an Academy Award for her portrayal of the young transman, Brandon Teena in the 1999 movie Boys Dont Cry?",rated,Hilary Swank,Alicia Goranson,Hilary Swank,Chlo Sevigny,Jeanetta Arnette
675,"In 2004, this Academy Award-winning actress, was listed by the Australian magazine BRW, as the richest Australian woman under 40.",rated,Nicole Kidman,Olivia Newton-John,Naomi Watts,Nicole Kidman,Heath Ledger
676,"In 2004, this English actress received her fourth Academy Award nomination for her performance in the movie Eternal Sunshine of the Spotless Mind.",rated,Kate Winslet,Lindsay Lohan,Kirstie Alley,Kate Winslet,Renee Zellweger
677,Which Welsh-born actor got two Oscar nominations for playing US Presidents in the movies Nixon and Amistad?,rated,Sir Anthony Hopkins,Jeremy Irons,John Spencer,Sir Anthony Hopkins,John Malkovich
678,"This Hollywood actress, who at the age of 7 starred in the film E.T. the Extra -Terrestrial, described her troubled childhood in her 1990 autobiography, Little Girl Lost.",rated,Drew Barrymore,Winona Ryder,Kate Moss,Juliette Lewis,Drew Barrymore
679,"This Golden Globe-winning actress was arrested on December 12, 2001 for shoplifting designer clothes in a department store in Beverly Hills.",rated,Winona Ryder,Kate Moss,Angelina Jolie,Winona Ryder,Natasha Lyonne
680,"The following words belong to a fictional private detective, created by Agatha Cristie: I, who have undoubtedly the finest brain in Europe at present, can afford to be magnanimous.",rated,Hercule Poirot,John Shaft,Drury Lane,Perry Mason,Hercule Poirot
681,"This fictional detective, created by a British author and physician, delivered the following words in the short story, The Boscome Valley Mystery: There is nothing more deceptive than an obvious fact.",rated,Sherlock Holmes,Sherlock Holmes,Philip Trent,Charlie Chan,Sam Spade
682,"This eccentric literary detective, who lives alone in Paris, is the creation of Edgar Allan Poe.",rated,Auguste Dupin,Paul Temple,Auguste Dupin,Hercule Poirot,Henry Merrivale
683,"This fictional detective first appeared in the novel, The Murder at the Vicarage. Her motto is The young people think the old people are fools, but the old people know the young people are fools.",rated,Miss Jane Marple,Jessica Fletcher,Miss Jane Marple,Daphne Matthews,Kate Fansler
684,"This fictional character, depicted by G. K. Chesterton, is both a detective and a Catholic priest. He addressed the following words to the reformed criminal, Flambeau: Has it never struck you that a man who does next to nothing but hear mens real sins is not likely to be wholly unaware of human evil?.",rated,Father Brown,Father Brown,Father Roger,Father Smith,Gideon Fell
685,"This fictional detective, described as a hard and shifty fellow, is the leading character in the novel The Maltese Falcon.",rated,Sam Spade,Rex Carver,Sam Spade,Mike Hammer,Philip Marlowe
686,"This fictional police detective, who likes smoking pipes, is the literary creation of Georges Simenon. Unlike his assistant Leroy, he often relies on his instincts in solving cases.",rated,Jules Maigret,Hercule Poirot,Jules Maigret,Dick Tracy,Inspector Morse
687,"The name of this fictional detective from the novel, The Roman Hat Mystery is also the pseudonym under which the two cousins, Frederick Dannay and Manfred B. Lee wrote detective fiction.",rated,Ellery Queen,Inspector Rebus,Ellery Queen,Henri Bencolin,Jim Rockford
688,"This literary private eye, who works in Southern California, was first introduced in the novel, The Moving Target.",rated,Lew Archer,Lew Archer,Ellery Queen,Travis McGee,Paul Temple
689,"This fictional private eye made the following observation in the book, The Big Sleep: Dead men are heavier than broken hearts.",rated,Phillip Marlowe,Cliff Hardy,Rex Carver,Phillip Marlowe,Dick Tracy
692,What was the estimated number of deaths of marijuana overdose in the USA for 2005?,rated,0,0,1000,"45,000","15,000"
693,Archaeologists report that marijuana was possibly the first plant cultivated by humans. The first evidences of this date back to approximately what time?,rated,8000 BC,4000 BC,1000 BC,8000 BC,"12,000 BC"
696,Sterilized hemp seeds are often sold as what?,rated,Bird seed,Bird seed,Catnip,Snacks,Jewelry
697,How many Americans were arrested on marijuana charges in 1997?,rated,"More than 690,000","100,000","More than 690,000","50,000","Less than 5,000"
698,Which of the following is not a name for marijuana?,rated,Cancer stick,Joint,Cancer stick,Blunt,Maryjane
699,Which film about marijuana was directed by Louis Gasnier and released in 1936?,rated,Reefer Madness,Dont get high,Reefer Madness,Pot and you,Reefer times
700,The famous boyhood friends depicted by Mark Twain were Huckleberry Finn and this character.,rated,Tom Sawyer,The Duke,Jim the slave,Tom Sawyer,Injun Joe
701,What was the title of Leo Tolstoys classic about the Napoleonic Wars?,rated,War and Peace,War and Remembrance,War and Its Aftermath,War and Prosperity,War and Peace
702,Which of the following words usually follows the word zip?,rated,Code,Code,Area,Zone,Postal
703,"In the B  O Railroad, what does the B stand for?",rated,Baltimore,Birmingham,Baltimore,Boston,Brooklyn
704,What are the first names of the comedy team of Rowan and Martin?,rated,Dick and Dan,Frick and Frack,Thelma and Louise,Dick and Dan,Bob and Ray
705,Which cartoon character was the gentleman friend of Olive Oyle?,rated,Popeye,Bluto,Caster Oyle,Sweet Pea,Popeye
706,"In the Old Testament, whose hair was cut off by the temptress Delilah?",rated,Samson,"Aaron, the brother of Moses",Nimrod,Solomon,Samson
707,Who was the ever faithful friend and comrade-in-arms of Sherlock Holmes?,rated,John Watson,John Watson,Nicholas Moriarty,Mrs. Hudson,The Baker Street Irregulars
708,Name the comedy team of the late 60s whose routines include Earache My Eye and Santa Claus and his Old Lady.,rated,Cheech and Chong,Toker and Reefer,Bubba and Bong,Cheech and Chong,Weed and Joint
709,What team of animators is responsible for most of the Saturday morning cartoons?,rated,Hanna and Barbera,The Disney Brothers,Crocker and Otis,Hanna and Barbera,Dow and Jones
710,What word completes the following cliche: The blind leading the ______. ?,rated,blind,soldiers,blind,sheep,faithful
711,What is correct word to complete the cliche: like a ___ in a china shop?,rated,bull,bull,beggar,clown,dog
712,What word completes the following cliche: a square ____ in a round hole?,rated,peg,lizard,peg,button,letter
713,What is correct word to complete the cliche: Face the ______.?,rated,music,music,east wind,crowd,angry bees
714,What word completes the following cliche: to make a _____ out of a molehill?,rated,mountain,horse,mountain,mansion,castle
715,"Reservoir Dogs, Kill Bill, Jackie Brown",rated,"Tarantino, Quentin","Allen, Woody","Coppola, Francis Ford","Tarantino, Quentin","Eastwood, Clint"
716,"Topaz, Frenzy, Psycho",rated,"Hitchcock, Alfred","Hitchcock, Alfred","Lynch, David","Coppola, Sofia","Besson, Luc"
717,"The Hills Have Eyes, The Twilight Zone, Cursed",rated,"Craven, Wes","Craven, Wes","Crichton, Michael","Lynch, David","Hitchcock, Alfred"
718,"Sleepy Hollow, Beetle Juice, Big Fish",rated,"Burton, Tim","Burton, Tim","Chopra, Yash","Herzog, Werner","Argento, Dario"
719,"Twin Peaks, Wild at Heart, Hotel Room",rated,"Lynch, David","Lynch, David","Burton, Tim","Reggio, Godfrey","Van Gogh, Theo"
720,"Dracula, The Rainmaker, The Godfather",rated,"Coppola, Francis Ford","Coppola, Francis Ford","Almod, Pedro","Tarantino, Quentin","Chopra, Yash"
721,"Lonesome Cowboys, Saturday Night Live, LAmour",rated,"Warhol, Andy","Ozon, Francois","Riefenstahl, Leni","Burton, Tim","Warhol, Andy"
722,"Bowling for Columbine, And Justice for All, Fahrenheit 9/11",rated,"Moore, Michael","Coppola, Francis Ford","Reggio, Godfrey","Spielberg, Steven","Moore, Michael"
723,"Eyes Wide Shut, Full Metal Jacket, Lolita",rated,"Kubrick, Stanley","Jackson, Peter","Lynch, David","Kubrick, Stanley","Avary, Roger"
724,"Midnight in the Garden of Good and Evil, Absolute Power, Mystic River",rated,"Eastwood, Clint","Riefenstahl, Leni","Eastwood, Clint","Jackson, Peter","Spielberg, Steven"
725,Which of these significant tragic events was the last to occur during the decade of the 1980s?,rated,The Tiananmen Square Massacre in China,The space shuttle Challenger explosion,John Hinckleys assassination attempt on President Ronald Reagan,The Tiananmen Square Massacre in China,The Soviet invasion of Afghanistan
726,"The 1985-86 Boston Celtics were on top of the world. There had just won their 16th NBA championship and their super star Larry Bird won the MVP. To make things even better, they drafted a young man in 1986 who was considered by many to be the future of the Celtics. Tragically, this young man died of a cocaine overdose just 48 hours after he was drafted. What was the name of this person whose death shocked the country?",rated,Len Bias,Ralph Sampson,Jimmy Black,Len Bias,Reggie Lewis
727,"In the fall of 1982, seven people in the Chicago area died after taking an over-the-counter medication deliberately laced with cyanide. What brand of medication was it?",rated,Extra Strength Tylenol,Bayer Aspirin,Benadryl,Extra Strength Tylenol,Excedrin PM
728,Which television sitcom was not originally on the air at some time during the 1980s?,rated,Good Times,Silver Spoons,Good Times,Family Ties,Too Close for Comfort
729,"This 1980s rap group trio brought rap into the mainstream with the 1986 rap-rock hit Walk This Way, a collaborative effort with the rock band Aerosmith.",rated,Run DMC,Whodini,The Beastie Boys,The Boogie Boys,Run DMC
730,The Berlin Wall was constructed in 1961 to separate West Berlin and East Germany. Its construction was approved by Soviet leader Nikita Khrushchev. Who was the leader of the Soviet Union when the Berlin Wall was dismantled in 1989?,rated,Mikhail Gorbachev,Yuri Andropov,Mikhail Gorbachev,Leonid Brezhnev,Konstantin Chernenko
731,"In 1981, Nintendo developed a video arcade game which featured a giant ape as the villain. The ape would try to stop Mario, the games hero, from reaching and rescuing the damsel in distress by rolling wooden barrels at him. What was the name of this arcade game?",rated,Donkey Kong,Kong vs. Mario,Donkey Kong,Grape Ape,Super Mario Bros.
732,The Detroit Tigers defeated the San Diego Padres in the 1984 World Series. The Tigers clinched the series in game 5 when Kirk Gibson hit a three-run homerun off of this famous closer (pitcher).,rated,Goose Gossage,Donnie Moore,Bruce Sutter,Goose Gossage,Steve Bedrosian
733,"This NFL team established their dominance in the 1980s, winning three Super Bowls during the decade.",rated,San Francisco 49ers,Pittsburgh Steelers,Washington Redskins,Green Bay Packers,San Francisco 49ers
734,"Comedic actor Jesse Donald Knotts was born on 21 July, in what year?",rated,1924,1930,1934,1924,1922
735,In which film did Don Knotts star as Wheely Applegate?,rated,Herbie Goes to Monte Carlo (1977),Bedknobs and Broomsticks (1971),Benji (1974),Herbie Goes to Monte Carlo (1977),Escape to Witch Mountain (1975)
736,What was Colonel Potters home state according to the M*A*S*H TV series?,rated,Missouri,Montana,Iowa,Minnesota,Missouri
737,"According to the M*A*S*H series, what unit of the Army did Colonel Potter belong to during World War I?",rated,Cavalry,Cavalry,Infantry,Fighter Pilot,Engineer
738,"In M*A*S*H, Colonel Potter had received a Purple Heart during World War II. How did he suffer his injury?",rated,His still blew up,Bobming raid,Cavalry charge,A mine,His still blew up
740,Colonel Potter was 1/4 Native American according to the M*A*S*H series. Which Native American group was he related to?,rated,Cherokee,Cherokee,Iroquois,Navahoe,Comanchee
741,"In the very last episode of M*A*S*H*, what did Colonel Potter receive as a goodbye gift from B.J. and Hawkeye?",rated,A salute,A hug,A joke book,A kiss on the cheek,A salute
742,In what language does Ich habe Hunger mean Im hungry?,rated,German,French,German,Swedish,Icelandic
743,I dont feel well is Ik voel me niet lekker in which European language?,rated,Dutch,Romanian,Serbian,German,Dutch
744,"The following sentence is written in what language:

I trdgrden lg ett gammalt hus, och i huset bodde Pippi Lngstrump?",rated,Swedish,German,Danish,Swedish,Dutch
745,In questo disco affrontano uno straordinario viaggio alla ricerca delle radici della musica classica is a sentence in what language?,rated,Italian,Italian,Spanish,French,Icelandic
746,"In what language is this line:

Mariachi me acompaa cuando canto mi cancin?",rated,Spanish,Swedish,French,Hebrew,Spanish
747,"Name the language in which this sentence is written:

He otunwahe kin el tuktel owotetipi wanzi han hwo.",rated,Lakota,Japanese,Hawaiian,Lakota,Icelandic
748,"Jai compris tous les mots, jai bien compris, merci is a sentence in what language?",rated,French,French,Romanian,Dutch,Italian
749,"In what language is the sentence:

Kalevala on inspiroinut monia kirjailijoita mys Suomen ulkopuolella?",rated,Finnish,Bulgarian,Finnish,German,Hungarian
750,U petom mjesecu 2006 godine Crna Gora se odcijepila od Srbije is in what language?,rated,Croatian,Hungarian,French,Spanish,Croatian
751,Doomo arigatou gozaimasu is a very polite expression which means Thank you very much in what language?,rated,Japanese,Bulgarian,French,Japanese,Irish
753,"If a doctor gives you three pills with instructions to take one every half hour, when will you take the last one?",rated,1 hour later,1 hour later,None of the above,1 and 1/2 hours later,2 hours later
755,"Brothers and sisters I have none, but that mans father is my fathers son. Who am I?",rated,Son,Son,Uncle,Father,Grandfather
757,Some months have 30 days and some have 31. How many have 28?,rated,12,5,1,12,3
760,"A plane crashes on the border of Canada and the USA, 60 people die. Where do they bury the survivors?",rated,Neither,Split 50/50,Neither,USA,Canada
761,"I have 10 apples and I give all but 6 away, how many do I have left?",rated,6,0,5,4,6
762,Mike and Gloria were two of the main characters on which TV show?,rated,All in the Family,Happy Days,All in the Family,The Brady Bunch,Threes Company
763,Which TV show featured the characters Florida and Penny?,rated,Good Times,Good Times,Gilligans Island,Lassie,Mash
764,Thurston Howell was the richest among the characters of which television series?,rated,Gilligans Island,Gilligans Island,Nashville,Dodge City,Stockton
765,On which TV show were two of the characters called Matthew and Galan?,rated,Gunsmoke,Gunsmoke,Family Affair,Rifleman,Good Times
766,"In this television series, Wally had a younger brother who pestered him constantly.",rated,Leave it to Beaver,Rifleman,Good Times,Leave it to Beaver,Family Affair
767,Jethro Bodine was a character from which of these shows?,rated,The Beverly Hillbillies,Johnny Quest,The Beverly Hillbillies,Mannix,The Life of Riley
768,On which sitcom did Roxie Roker play Helen Willis?,rated,The Jeffersons,Happy Days,Gunsmoke,The Jeffersons,Baretta
769,"Jaime Sommers, a character stronger than the usual human being, was played by Lindsey Wagner in which TV series?",rated,The Bionic Woman,The Six Million Dollar Woman,Women Are Strong Too,The Bionic Woman,Americas Most Wanted
770,Jackie Harris is a character played by Laurie Metcalf on which sitcom?,rated,Roseanne,Cosby,Kids are funny too,Roseanne,Fat Albert
771,Characters Reverend Jim and Louie worked for the Sunshine Cab Company on which TV show?,rated,Taxi,Taxi,Cabs R Us,D. C. Cab,Taxi Driver
772,"This toilet, also referred to as kybo, is a small structure separate from the main building which does not have a flush or sewer attached.",rated,Outhouse,Restroom,Lavatory,Outhouse,Chamber pot
773,"This toileting facility, typically used in the case of bedridden persons, usually consists of of a metal, glass, or plastic receptacle.",rated,Bedpan,Outhouse,Bathroom,Loo,Bedpan
774,Which British word is a synonym of toilet?,rated,Loo,John,Restroom,Loo,Head
775,What would your pet cat use to relieve itself?,rated,Litter Box,Chamber Pot,Litter Box,Lavatory,Outhouse
776,"This low-mounted plumbing fixture, similar in design to a toilet, is used for washing the external genitalia and the anus.",rated,Bidet,Lavatory,Bedpan,Bidet,Urinal
777,Which specialized toilet is designed to be used only for urination?,rated,Urinal,Bedpan,Compost,Loo,Urinal
779,"This word, which in French means convenient, is sometimes used as a euphemistic term, meaning a toilet.",rated,Commode,Lavatory,Outhouse,Bidet,Commode
780,"This criminal from the novel, Great Expectations escapes from prison and later becomes the secret benefactor of the boy who helped him out.",rated,Abel Magwitch,Fagin,Mr Micawber,Abel Magwitch,Bill Sikes
781,"This literary criminal, described by Charles Dickens as a loathsome reptile?, trains a band of young boys to steal and make a living by pickpocketing.",rated,Fagin,Bill Sikes,Noah Claypole,Mr. Brownlow,Fagin
782,"This literary villain, mainly driven by greed, is Mr. Wickfields clerk. He makes treacherous plans to take control of his employers business.",rated,Uriah Heep,Tommy Traddles,Uriah Heep,Wilkins Micawber,James Steerforth
783,This shrewd and sophisticated female protagonist from the epistolary novel Dangerous Liaisons controls and dominates the lives of people around her through sex intrigues.,rated,Marquise de Merteuil,Cruella de Ville,Cecile de Volanges,Marquise de Merteuil,Madame de Tourvel
784,"This literary character, created by Thomas Harris, is a psychiatrist and serial killer, who practices cannibalism.",rated,Hannibal Lecter,Ed Gein,Professor Moriarty,Hannibal Lecter,Barney Matthews
785,"This extremely ambitious and corrupt fictional character urges her husband to murder Duncan, the King of Scotland, and to take the throne.",rated,Lady Macbeth,Madame de Tourvel,Lady Chatterley,Lady Macbeth,Desdemona
786,This fictional villain is described by Arthur Conan Doyle as the Napoleon of Crime.,rated,Professor Moriarty,Professor Moriarty,Charlie Chan,Ellery Queen,Lord John Roxton
787,"This villainous literary character, created by Mark Twain, murders Dr. Robinson and plans to mutilate Widow Douglas.",rated,Injun Joe,Joe Harper,Silas Phelps,Judge Thatcher,Injun Joe
788,"This fictional villain, has a reputation of an honest man, but manipulates all people around him. He makes Othello believe that his wife is having an adulterous affair.",rated,Iago,Roderigo,Gratiano,Claudius,Iago
789,"This fictional evil and atrocious character, described by John Steinbeck, murders her own parents and ruthlessly uses people around her to serve her own needs.",rated,Cathy Trask,Mildred Rogers,Daisy Buchanon,Nora Barnacle,Cathy Trask
