,question,category,answer,choices/0,choices/1,choices/2,choices/3
1596,"In 1869 Mendeleev made this classification, which became one of the most useful and important generalizations of chemistry and science.",rated,The periodic table of the chemical elements,The theory about the origin of species,The periodic table of the chemical elements,The discovery of dynamite,Pasteurization
1598,"This artists work Impression: Sunrise, painted in 1874, started a whole new movement in art - Impressionism. Yet, another source of the name of this movement was the press. Journalists called him and his colleagues impressionists because their works were too sketchy, unfinished,  and just made an impression.",rated,Claude Monet,Renoir,Pissaro,Claude Monet,Vincent Van Gogh
1599,"The eruption of this volcano in 1883 on Pulau island in Indonesia is one of the greatest so far. It threw ash up to 50 miles in the sky above in a tremendous explosion. The latter could be heard in Australia, which is 2,200 miles away.",rated,Krakatoa,Zao,Etna,Vesuvius,Krakatoa
1600,"This drug was first produced in 1853 by German chemists. The name of this medicine comes from a plant, called spirea, that releases salicylic acid.",rated,Aspirin,Vitamin C,Analgin,Aspirin,Quinine
1601,"At the age of 10, this actress portrayed the character of Samantha Micelli on the popular 1980s sitcom, Whos the Boss?",rated,Alyssa Milano,Alyssa Milano,Candace Cameron,Judith Light,Nicole Eggert
1602,"What actor co-starred as Scott Baios wild and crazy friend, Buddy Lembeck, on the sitcom Charles In Charge?",rated,Willie Aames,Donny Most,Leif Garrett,Willie Aames,Ron Howard
1603,"In the sitcom Mork  Mindy, that ran on ABC from 1978 to 1982, which actress played Mindy McConnell?",rated,Pam Dawber,Pam Dawber,Sarah Jessica Parker,Marion Ross,Erin Moran
1605,"This actress won two Emmys for her acting on the sitcom Hazel, where she played the sassy and domineering maid, who worked for the Baxter Family.",rated,Shirley Booth,Donna Reid,Shirley Booth,Nell Carter,Diahann Carroll
1606,"In the ABC TV series Grace Under Fire, this actress portrayed Graces best friend, Nadine.",rated,Julie White,Julie White,Brett Butler,Amy Williams,Michelle Lewis
1607,"Which actress played the gossip-prone neighbor Willona Woods on the 1970s show, Good Times ?",rated,Janet DuBois,Estelle Getty,Janet DuBois,Esther Rolle,Isabelle Sanford
1608,"Who played the wealthy and spoiled Blair Warner in the series The facts of Life, a show about the life at an all-girl boarding school in NY ?",rated,Lisa Whelchel,Kim Fields,Nancy McKeon,Lisa Whelchel,Mindy Cohn
1609,"On the 1960s television show Bewitched, Agnes Moorhead played which character?",rated,Endora,Aunt Clara,Gladys,Samantha,Endora
1610,This actress is famous for playing Rhoda Morgenstern on the 1970s sitcom Rhoda.,rated,Valerie Harper,Linda Lavin,Mary Tyler Moore,Sandy Duncan,Valerie Harper
1611,"It is the son of Poseidon in the Olympian theogony, or of Oceanus and a Naiad. and the herdsman of Poseidons seals. He can foretell the future, but will change his shape to avoid having to. He will only answer to someone who is capable of capturing him.",rated,Proteus,Proteus,Kraken,Capricorn,Cetus
1612,"What was the real name of Baby, one of the main characters in the movie Dirty Dancing?",rated,Frances,Frances,Margaret,Judy,Alice
1613,"This actor was initially offered the role of Johnny in Dirty Dancing, that was eventually played by actor Patrick Swayze.",rated,Val Kilmer,Dennis Quade,John Travolta,Johnny Depp,Val Kilmer
1614,What is the name of the summer resort that the Housman family attend in the film Dirty Dancing?,rated,Kellermans,Claytons,Caffreys,Bennigans,Kellermans
1615,"What is the last name of Johnny, the character portrayed by actor Patrick Swayze in the movie Dirty Dancing?",rated,Castle,Warsaw,Wheat,Castle,Bandit
1618,"Actress Jennifer Grey, most famous for her role of Baby in Dirty Dancing, also plays the part of Jeanie in which 1986 film?",rated,Ferris Buellers Day Off,Pretty in Pink,Ferris Buellers Day Off,The Breakfast Club,Sixteen Candles
1619,"In 1989, this rock singer married actress Cynthia Rhodes, who appeared in the movie Dirty Dancing as Johnnys dance partner, Penny.",rated,Richard Marx,Huey Lewis,Richard Marx,Sammy Hagar,Rick Astley
1623,"Michelangelo died in the same year that Galileo was born. What famous person was born in Woolsthorpe-by-Colsterworth, in the year Galileo died?",rated,Isaac Newton,Rembrandt,Isaac Newton,Luther,Renoir
1624,What is the official name for a resident of the state of Utah?,rated,Utahn,Utahian,Utahtonian,Utahn,Ute
1625,What is the last letter of the Greek alphabet?,rated,Omega,Chi,Zeta,Omega,Psi
1626,How many dry quarts are in a peck?,rated,8,None,4,2,8
1627,"Which animals sees more daylight than any other creature on the planet, thanks to its 19,000 km (12,000 mile) journey to winter in the Antarctic?",rated,The Arctic Tern,The Blue Whale,The Emperor Penguin,The Arctic Tern,The Polar Bear
1628,In 1799 Napoleon ordered 10  days of national mourning because of the death if this person.,rated,George Washington,George Washington,Col. Ney,Napoleons mother,Lafayette
1629,What is plumbism?,rated,Lead poisoning,Lead poisoning,Swelling of the stomach,Black lung disease,Obesity
1631,The Berlin Wall was one of the most prominent symbols of the Cold War.  Its construction commenced on this date.,rated,13 August 1961,12 June 1959,13 July 1949,13 August 1961,31 June 1967
1632,"At first the wall was made of barbed wire and wire entanglements, but as time passed, it was strengthened to become a frightening concrete monster.  It was so enormous, it ran through 32 railway lines, 8 S-Bahn and 3 autobahns. How many streets did it cut through?",rated,192,9,19,1925,192
1634,"He was born and raised in a family of social-democrats and later helped found the Communist Party. In 1960 he became head of the National Defence Council, which gave him enough power to initiate the construction of the Wall, with Soviet permission of course.",rated,Walter Ulbricht,Walter Ulbricht,Erich Fromm,Alex Ulbricht,Erich Honecker
1635,The Berlin Wall was one of the most modern and best guarded borders in the world. The list of obstacles that formed the Wall is quite terrifying. These safety measures made it almost impossible to pass the border without being seen (and killed). There were two concrete walls- one facing the Eastern side and one facing the Western. What was the color of the later one?,rated,Grayish-white,Black,Red,Grayish-white,White
1636,"Rudolf Urban died on 19 August 1961, becoming the first one of the estimated 239 victims of the Wall. The last person was shot by the guards just two weeks before firing orders were withdrawn. What was his name?",rated,Chris Gueffroy,Daniel Schorr,Winfried Freudenberg,Chris Gueffroy,Peter Fechter
1637,"Just two days after construction of the Berlin Wall began, the first East Berliner escaped, jumping over the barbed fence. Some of the daring attempts to flee the Republic were really amazing; before the frontier barrier was fitted with vertical bars, nine people escaped from East Berlin in a small sports car, driving under the barrier. Do you know what kind of car it was?",rated,Isetta,Mini Cooper,Fiat 500,Wolkswagen Beatle,Isetta
1639,"After 10 315 days in existence, the symbol of the Cold War came down. On 9 November 1989 East Germans could once again visit their relatives and beloved ones in West Berlin. But when was the Brandenburg Gate opened?",rated,22 December 1989,22 December 1989,1 January 1991,3 December 1989,23 June 1991
1640,How many bags of wool did the black sheep have in the nursery rhyme Baa Baa Black Sheep?,rated,3,3,1,0,5
1641,What animal jumped over the moon in the nursery rhyme Hey Diddle Diddle?,rated,Cow,Spoon,Dog,Cat,Cow
1643,"In the nursery rhyme One, Two, Buckle My Shoe what do you do on Five, Six?",rated,Pick up sticks,A big fat hen,Give it a twist,Pick up sticks,Shut the door
1644,Who were the three men in the nursery rhyme Rub a Dud Dub?,rated,"Butcher, Candlestick Maker and Baker","Farmer, Blacksmith and Tinker","Doctor, Lawyer and Indian Chief","Rich man, Poor man and Baker","Butcher, Candlestick Maker and Baker"
1645,What does Jack jump over in the nursery rhyme Jack Be Nimble?,rated,Candlestick,Wall,Candlestick,Fire,Pie
1647,"In the nursery rhyme Mary, Mary, Quite Contrary, what type of shells help Marys garden grow?",rated,cockle,conch,oyster,cockle,clam
1648,"Whats the last line of the nursery rhyme Little Bo Peep:
Little Bo Peep has lost her sheep
And cant tell where to find them.
Leave them alone, And theyll come home,
..................................?",rated,Wagging their tails behind them,Sooner then you think,Wishing they never left,Wagging their tails behind them,Waiting for their mommy
1649,What did Jack break in the nursery rhyme Jack and Jill?,rated,Crown,Neck,Arm,Pail,Crown
1650,"Fill in the missing words in the nursery rhyme Hush, Little Baby:
Hush, little baby, dont say a word
Mamas gonna buy you a mockinbird
If that mockinbird dont sing
Mamas gonna buy you ....................",rated,A diamond ring,A diamond ring,A cart and bull,A billy goat,A looking glass
1651,What holiday pie was Little Jack Horner eating in the nursery rhyme Little Jack Horner?,rated,Christmas pie,New Years pie,Easter pie,Christmas pie,Pass Over pie
1652,What is the boy doing under the haystack in the nursery rhyme Little Boy Blue?,rated,Sleeping,Hiding,Sleeping,Tying his shoe,Praying
1653,Who cuts off the mices tails in the nursery rhyme Three Blind Mice?,rated,The farmers wife,The butcher,The farmer,The butchers wife,The farmers wife
1654,"With its 2,505,810 sq. km (967,499 sq. miles) this is the largest country in Africa and the tenth largest in the world. Its ancient name was Nubia. Its contemporary name comes from an Arabic expression which means land of the blacks.",rated,Sudan,Egypt,Congo,Sudan,South Africa
1655,"The 9th biggest country in the world, with a territory of 2,717,300 sq. km (1,049,155 sq. miles). This country appeared in the movies Air Force One (starring Harrison Ford), The World is Not Enough (James Bond), and Rollerball (with Jean Reno).  Its capital is Astana.",rated,Kazakhstan,Georgia,Ukraine,Kazakhstan,Kyrgyzstan
1656,"This is the second largest country in South America and the 8th largest in the world, with a territory of 2,766,890 sq. km (1,068,302 sq. miles). More than one third of its population lives in or around Buenos Aires.",rated,Argentina,Peru,Chile,Brazil,Argentina
1657,"With its 3,287,590 sq. km. (1,269,346 sq. miles) this country ranks 7th largest in the world.  Numbers were invented here, even though Europeans learned them from the Arabs.",rated,India,Bahrain,India,Iran,China
1658,"With a territory of 7,686,850 sq. km.  (2,967,909 sq. miles), it the the smallest continent, the largest island, and the 6th biggest country in the world.",rated,Australia,Greenland,Great Britain,Australia,Austria
1659,"Stretching over 8,511,965 sq. km. (3,286,488 sq. miles),  this South American country ranks 5th largest.  It has the worlds widest expressways, the Monumental Axis.",rated,Brazil,Colombia,Peru,Argentina,Brazil
1660,"9,596,960 sq. km. (3,705,407 sq. miles) position this Asian country as 4th largest in the world.  Porcelain, gunpowder, paper and money were all invented here.",rated,China,Thailand,Russia,India,China
1661,"This country ranks 3rd largest weighing in at 9,629,091sq. km. (3,717,813 sq. miles). One of the symbols of this North American country is a gift from France.",rated,USA,USA,Mexico,Canada,Hawaii
1662,"This immigrant friendly North American country is the second largest in the world with a total area of 9,976,140 sq. km (3,851,809 sq. miles). There are two official languages there: English and French.",rated,Canada,Mexico,USA,Argentina,Canada
1663,"The largest country in the world, almost doubling the area of USA.  It lies on 17,075,200 sq. km. (6,592,772 sq. miles) of terrain, even though it sold Alaska to the USA in 1867 for $7.2 million.",rated,Russia,Russia,Canada,China,India
1664,"This pediatrician is the author of bestseller, Baby and Child Care, published in 1946.",rated,Dr. Spock,Dr. Love,Dr. Seuss,Dr. Spock,Dr. Livingston
1665,"In 1881, this dentist and gunfighter of the Old West frontier took part in the Gunfight at the O.K. Corral in Tombstone, Arizona, along with Wyatt Earp, Virgil Earp, and Morgan Earp.",rated,Doc Holliday,Doc Johnson,Doc Holliday,Doc Jackson,Doc Lemaur
1666,"This flat-picking guitarist from North Carolina, nicknamed Doc, was inducted into the International Bluegrass Music Hall of Honor in 2000.",rated,Doc Watson,Doc Watson,Doc Jackson,Dr. Dre,Doc Travis
1667,"This pseudonym belonged to a British singer, songwriter, poet and guitarist, who wrote and performed the song Imagine.",rated,Dr. Winston OBoogie,Doc Hollywood,Dr. Harlan OBoogie,Dr. Winston OBoogie,Harry Doc Nilsson
1668,"This American author of childrens books, known by the pen name Dr. Suess, was awarded a Pulitzer Prize in 1984.",rated,Theodore Geisel,Theodore Geisel,Tamford L. Wall,Terence Walford,Teddy Geismel
1669,"This mysterious time-travelling adventurer, known as The Doctor, is the central character in a long-running BBC television science-fiction series.",rated,Dr. Who,Dr. Why,Dr. Zhivago,Dr. Who,Dr. Morraco
1670,"This cultural and moral commentator, famous as the host of a radio therapy call-in show, wrote the book, Ten Stupid Things Women Do to Mess Up Their Lives.",rated,Dr. Laura,Dr. Ruth,Dr. Laura,Dr. Jaqueline,Dr. Lori
1672,"What PhD did Dr. Henry Kissinger, secretary of state under Presidents Nixon and Ford, receive at Harvard?",rated,PhD in International Relations,PhD in Psychology,PhD in Foreign Affairs,None of these,PhD in International Relations
1673,How many years are in a decade?,rated,10,100,10,1000,500
1674,How many years are in a century?,rated,100,500,100,10,1000
1675,How many weeks are in a fortnight?,rated,2,3,5,2,4
1676,How many cards are in a traditional pack?,rated,52,52,10,50,100
1677,How many players are present in a double match?,rated,4,6,4,2,8
1678,How many tens are in a score?,rated,2,5,2,20,10
1679,How many lines are on a standard tennis court?,rated,9,10,15,5,9
1680,How many cents are in a dollar?,rated,100,200,50,100,10
1681,How many players are on a soccer team?,rated,11,9,11,12,10
1682,How many notes constitute an octave?,rated,8,9,6,8,7
1683,How many lines are contained in a sonnet?,rated,14,11,12,14,13
1684,How many seconds are there in a score of years?,rated,631 152 000,63 115 200,631 152 000,63 072 000,630 720 000
1685,Who was the first baseball player to have his uniform number retired?,rated,Lou Gehrig,Joe Dimaggio,Lou Gehrig,Babe Ruth,Miller Huggins
1686,What was Joe Dimaggios nickname while playing with the Yankees?,rated,The Yankee Clipper,The San Francisco Kid,The Coffee Man,The Yankee Clipper,The Yankee Smoothie
1687,"How many times did the Yankees win consecutive World Series crowns, before the start of the new millennium?",rated,6,4,7,2,6
1688,"When this Yankee retired, he had the record for  most  World Series most home runs during his career? He still holds that record as of 2005.",rated,Mickey Mantle,Roger Maris,Reggie Jackson,Mickey Mantle,Babe Ruth
1689,How many times did Babe Ruth win the American League MVP award?,rated,1,4,1,3,2
1690,Which great Yankee was not elected to the Hall of Fame during his first year of eligibility?,rated,Joe Dimaggio,Babe Ruth,Lou Gehrig,Joe Dimaggio,Mickey Mantle
1691,"Between July 28, 1957, and May 10, 1959, this player set major league records by catching in 148 consecutive games and accepting 950 chances without making an error.",rated,Yogi Berra,Joe Dimaggio,Whitey Ford,Yogi Berra,Reggie Jackson
1692,Which Yankee earned the nickname Mr. October?,rated,Reggie Jackson,Yogi Berra,Mickey Mantle,Reggie Jackson,Don Larsen
1693,How long did the Hundred Years War last?,rated,116 years,116 years,100 years,10 years,99 years
1694,How long did the Thirty Years War last?,rated,30 years,30 months,29 years,100 years,30 years
1695,Where are the Panama hats made?,rated,Ecuador,Argentina,Cuba,Panama,Ecuador
1696,Kiwi fruit or Chinese Gooseberries came from which country?,rated,China,Newfoundland,Kiwi,China,New Zealand
1697,What color is the male purple finch?,rated,Crimson,Purple,Crimson,Green,Yellow
1698,The strings for harps and cellos were once made from catgut. Where do we get catgut from?,rated,Sheep intestines,Cat intestines,Very strong silk,Sheep intestines,None of these
1699,What was the first name of King George VI?,rated,Albert,Herman,Albert,King,George
1701,What is the camels hair brush made of?,rated,Squirrel hair,Human hair,Camels hair,Catgut,Squirrel hair
1702,What animal are the Canary Islands named after?,rated,Dog,Dog,Cat,Pigeon,Canary
1703,"This romantic comedy, starring Will Smith, was released in 2005.",rated,Hitch,Ditch,Hitch,Fitch,Gitch
1704,"Ive got an itch, because he ______ my watch. I am never going to find this thief.",rated,Snitched,Switched,Snitched,Aritched,Stitched
1705,"He was born Gordon Matthew Sumner in Wallsend, Northumberland.",rated,Sting,Elton John,Sting,Leo Sayer,Travis Tritt
1706,He was born Vernon Louis Gomez.,rated,Lefty Gomez,Martin Sheen,John Astin,Che Guevara,Lefty Gomez
1707,"This phrase means, a day during which nothing seems to be going right.",rated,Bad hair day,Bad hair day,Blind leading the blind,Cut to the Chase,Break A Leg
1708,"This idiom originated from a sorcerer who prepared his magic with his hands over the table and not below, where nothing could be seen and he could easily conceal any trickery.",rated,Above board,Above board,Apple of my eye,End of story,Across the board
1709,"This expression originates from the Bible. There Jesus tells a story about a man who stored a lot of food for months and years to come. When he finally told himself he had enough, he died. That is why God referred to him as a fool because he stored all the stuff in vain - he could not take it with him in the afterlife.",rated,"Eat, drink, and be merry",Dont Bite the hand that feeds you,"Eat, drink, and be merry",Feeding frenzy,Flesh and blood
1710,This expression comes from the 17th century when wooden planks were attached to the side of a ship. When a sailor had to go out and fix something outside the ship he was at danger of falling in the water.,rated,Between the devil and the deep blue sea,Between the devil and the deep blue sea,Fly on the wall,Got out of the wrong side of bed,Burn the midnight oil
1711,The original version of this idiom was to beat the pistol. It became popular in the early 1900s when it was referred a race before the starter fired the pistol.,rated,Jump the gun,Off the cuff,Over the top,Go the extra mile,Jump the gun
1712,"The origin of this expression comes from the 9th century. People then paid high taxes and if they did not pay, their nose was cut off.",rated,Pay through the nose,Hell to pay,Pay on the nail,Pay through the nose,Money is the root of all evil
1714,"This expression evolved around the 14th century when pins were invented.  Pin makers then offered pins for general sale, only on the 1st and 2nd of January. The upper class women would get an allowance from their husbands to buy pins.",rated,Pin money,On pins and needles,From pillar to post,Pin money,Ps and Qs
1715,This expression became popular first among the hedonists of the early 19th century. Opium pipe smoking was fashionable among them.,rated,Pipe dream,Pipe dream,Plain sailing,Pleased as punch,From pillar to post
1716,"This expression appeared when sea voyages were the only way to travel a great distance. There were women who gave birth on the ship, usually at the forward deck behind the main cannon.",rated,Son of a gun,Top Notch,Son of a gun,Red herring,The Wave
1717,"This 1985 action movie tells a story about a former prisoner sent on a mission. He falls in love with his Vietnamese partner and when sadistic people kill her, the protagonist wants revenge, while still focusing on his top secret mission.",rated,Rambo: First Blood Part II,Deer Hunter,Platoon,"Good Morning, Vietnam",Rambo: First Blood Part II
1718,"This 1986 fairy-tale-like movie is about Sarah, who unwillingly babysits her brother. As he keeps on crying, she inadvertently summons the goblins to free her from the boy. After all, they take him away and she has only 13 hours to get her brother back, otherwise he will become a goblin.",rated,Labyrinth,Labyrinth,Amadeus,Kin-Dza-Dza,Neverending Story
1719,"This 1984 comedy started a successful franchise under which 6 hilarious sequels, an animated TV series and a live-action TV series appeared.",rated,Police Academy,Raging Bull,Full Metal Jacket,Aliens,Police Academy
1720,"This 1985 release is the first action film starring Schwarzenegger, where the actor shows his sense of humour. The movie is about a retired commando who has just a couple of hours to save his daughter from an exiled dictator. The movie grossed $57 million worldwide.",rated,Commando,Amadeus,Rambo,Rocky,Commando
1721,"In 1984, when this film was released, it won 8 academy awards -: Best Picture, Best Actor, Best Director, Art Director, Costume Design, Best Make-up, Best Sound and Adapted Screenplay. It tells the story of a classical musicians life.",rated,Amadeus,The Phantom of the Opera,Amadeus,Savage Messiah,Noi Tre
1722,"Released in 1986, this movie featured Tom Cruise and Val Kilmer, although the latter did not want to take part in the film -- he was forced to participate by contractual obligations.",rated,Top Gun,Iron Eagle,Top Gun,Indiana Jones and the Last Crusade,Once Upon a Time in America
1723,"In 1984 this film, written by George Lucas, directed by Steven Spielberg and starring Harrison Ford, was criticised for being too violent and scary. When making its sequel, Spielberg apologized for the poor quality of the film.",rated,Indiana Jones and the Temple of Doom,Indiana Jones and the Temple of Doom,Indiana Jones and the Last Crusade,Crocodile Dundee,Raiders of the Lost Ark
1724,"In 1986 when it was released, this movie became number one worldwide at the box office. The name of the animal included in its title was put in quotes for the American public, so that people did not think that the main character was this animal.  (quotes omitted in the answers)",rated,Crocodile Dundee,The African Elephant,Crocodile Dundee,Crouching Tiger Hidden Dragon,Batman
1725,"In 1982 this Steven Spielbergs sci-fi movie received 4 Oscars: Best Sound Effects Editing, Best Visual Effects, Best Score, and Best Sound. The main characters are three young children who help a space creature return home. So the greater part of the film was deliberately shot from a lower camera angle to enhance a childs point of view.",rated,E.T. the Extra-Terrestrial,Close Encounters of the Third Kind,E.T. the Extra-Terrestrial,Contact,The Iron Giant
1726,"This movie, starring Michael Keaton, was released in U.S. theaters on June 23, 1989 and soon became the highest grossing movie of the year.",rated,Batman,X-Man,Batman,Superman,Spider-man
1727,"What was the name of the plumber in The Golden Girls, who brought the ladies the new Standard Lowboy toilet?",rated,Lou,Larry,Joe,Lou,Lloyd
1728,"What did Stan Zbornak from The Golden Girls lose, while he was travelling to the girls house in his Corvette?",rated,his toupee,Dorothys ring,his wallet,his hat,his toupee
1729,How long did Sophias marinara sauce take to make on the sitcom The Golden Girls?,rated,14 hours,12 hours,6 hours,A whole week,14 hours
1730,Where did Blanche Devereaux from The Golden Girls work?,rated,at a museum,at a museum,at a flower shop,in a bar,in a library
1731,"Rose Nylund, one of the main characters in the series The Golden Girls, was from which small town?",rated,St. Olaf,St. Ives,St. Gustov,St. Weiderfergan,St. Olaf
1732,"This CBS series, which ran from September 1992 to May 1993, was a spin-off from The Golden Girls.",rated,Golden Palace,Golden Palace,Rusty Anchor,Golden Place,Dorothys Place
1733,"On the sitcom The Golden Girls, after suffering a debilitating stroke, Sophia was put  in which nursing home?",rated,Shady Pines,The Home,Shady Acres,Shady Pines,Sunny Acres
1734,"On the popular sitcom The Golden Girls, Dorothy and Sophia dress up as which famous couple?",rated,Sonny and Cher,Ronald and Nancy,Burt and Loni,Sonny and Cher,Anthony and Cleopatra
1735,What year was Pixars computer-animated film Finding Nemo released?,rated,2003,2004,2002,2000,2003
1736,"Who voiced Nemos father, Marlin in the animated film Finding Nemo?",rated,Albert Brooks,Tim Allen,Albert Brooks,Billy Crystal,Nathan Lane
1737,"In Finding Nemo, what nickname was Nemo given during his initiation ceremony in the dentists fishtank?",rated,Sharkbait,Bubbles,Squirt,Chum,Sharkbait
1738,"In the animated movie Finding Nemo, before it stung her, Dory wanted to make a baby jellyfish her pet and she wanted to call it by what name?",rated,Squishy,Spike,Squishy,Spot,Fluffy
1739,"What is the name of the pelican that Nemo, and later Marlin and Dory befriend in the film Finding Nemo?",rated,Nigel,Alistair,Clive,Nigel,Basil
1741,Which one of these actors did NOT lend their voice to a character from Finding Nemo?,rated,Nathan Lane,Geoffrey Rush,Nathan Lane,Willem Dafoe,John Ratzenberger
1742,"Which of these words were NOT said by Dory, while she was talking in her sleep in Finding Nemo?",rated,"P. Sherman, 42 Wallaby Way, Sydney...","P. Sherman, 42 Wallaby Way, Sydney...",The sea monkey has my money...,Careful with that hammer...,"Yes, Im a natural blue..."
1743,Which of these was NOT a character in Finding Nemo?,rated,Sebastian,Chum,Bloat,Anchor,Sebastian
1744,"This character from the film Phenomenon, portrayed by John Travolta, is a man who discovers he has super intelligence, after seeing a bright light on the evening of his 37th birthday.",rated,George Malley,George Malley,Ted Rhome,Nate Pope,Jimmy Pope
